page,rank,title,price,reviews_count,rating,asin,url,date,bought_number,category,market_place
1,1,Matilda Style Headband Red Bow Hairband Alice Band Royal and Sporting Celebrations School Dress Up Days Handmade in the UK,EUR 5.13,559,4.3 out of 5 stars,B07M7ZXVKX,https://www.amazon.co.uk/Matilda-Hairband-Headband-Postage-Dispatch/dp/B07M7ZXVKX/ref=zg_bs_g_handmade_d_sccl_1/520-7137096-7068841?psc=1,2026-02-27,0,Handmade-Products,co.uk
1,2,"Printperfect - K POP Birthday Card For Girls- ""Have A Golden Birthday"" K-POP Greetings Card For Girls - Birthday Cards for Friend Daughter Sister Bestie Niece Grandaughter (Gold Envelope)",EUR 4.56,43,4.8 out of 5 stars,B0G1ZMNZKM,https://www.amazon.co.uk/Printperfect-Birthday-Greetings-Daughter-Grandaughter/dp/B0G1ZMNZKM/ref=zg_bs_g_handmade_d_sccl_2/520-7137096-7068841?psc=1,2026-02-27,0,Handmade-Products,co.uk
1,3,"Printperfect - Funny Birthday Card From The Dog Amusing Birthday Card For Dog Owner - “Fur Baby Gift For Dog Mum, Dad, Wife, Husband, Girlfriend, Boyfriend - Hilarious Card For Dog Parents",EUR 4.56,332,4.8 out of 5 stars,B0F3WFFV45,https://www.amazon.co.uk/Printperfect-Birthday-Girlfriend-Boyfriend-Hilarious/dp/B0F3WFFV45/ref=zg_bs_g_handmade_d_sccl_3/520-7137096-7068841?psc=1,2026-02-27,0,Handmade-Products,co.uk
1,4,"Printperfect - Funny Birthday Card - ""The Very Best For You On Your Birthday"" Humorous Greetings Card For Family, Friends, Him, Her, For Men, Women, Dad, Mum, Friend (Red Envelope)",EUR 4.56,283,4.6 out of 5 stars,B0F5BSP99C,https://www.amazon.co.uk/Printperfect-Birthday-Humorous-Greetings-Envelope/dp/B0F5BSP99C/ref=zg_bs_g_handmade_d_sccl_4/520-7137096-7068841?psc=1,2026-02-27,0,Handmade-Products,co.uk
1,5,"The Ilex Wood Natural Deodorant Stick 70ml – Handmade in UK, Aluminium Salts Free, Plastic Free, Alcohol Free, Vegan, Eco Friendly Cardboard Tube – Ylang Ylang & Cedarwood (Sweet & Woody)",EUR 9.65,5690,4.1 out of 5 stars,B09RKS585V,https://www.amazon.co.uk/Ylang-Cedarwood-Natural-Deodorant-Aluminium/dp/B09RKS585V/ref=zg_bs_g_handmade_d_sccl_5/520-7137096-7068841?psc=1,2026-02-27,0,Handmade-Products,co.uk
1,6,The Original Designed Emotions Regulation Keychain – 4 Colour Coded Mood Zone Discs Teaching Aid | Emotional Regulation and Management Tool for Kids & Adults | SEN Communication Tool/Accessory,EUR 6.04,135,4.7 out of 5 stars,B0DXD4ZRSY,https://www.amazon.co.uk/Original-Designed-Zones-Regulation-Keychain/dp/B0DXD4ZRSY/ref=zg_bs_g_handmade_d_sccl_6/520-7137096-7068841?psc=1,2026-02-27,1K+,Handmade-Products,co.uk
1,7,"21st Birthday Card for Girl Boy Son Daughter, Big Pop Up 21st Birthday Cards for Grandson Granddaughter, Back In 2005 Funny 21 Year Old Birthday Decorations",EUR 11.41,236,4.7 out of 5 stars,B0G42K9FSF,https://www.amazon.co.uk/Birthday-Daughter-Grandson-Granddaughter-Decorations/dp/B0G42K9FSF/ref=zg_bs_g_handmade_d_sccl_7/520-7137096-7068841?psc=1,2026-02-27,100+,Handmade-Products,co.uk
1,8,"CICIX LIMITED Scented Vacuum Freshner Discs. 130+ Scents To Pick From. Handmade in England. Strong Scented, Long lasting. Pack of 4x 3cm Discs. Vegan And Cruelty Free. (Clean Cotton)",EUR 6.84,67,4.0 out of 5 stars,B0CLKP76DY,https://www.amazon.co.uk/CICIX-Scented-Vaccum-Handmade-England/dp/B0CLKP76DY/ref=zg_bs_g_handmade_d_sccl_8/520-7137096-7068841?psc=1,2026-02-27,0,Handmade-Products,co.uk
1,9,"The Ilex Wood - Rose and Frankincense Face Cream - 100% Natural Handcrafted, Vegan, Moisturising, Anti Ageing, Wrinkle and Line Reducing Ingredients, Cruelty-Free, Palm Oil Free, Plastic Free - 60ml",EUR 22.79,5131,4.6 out of 5 stars,B07H447QHB,https://www.amazon.co.uk/Ilex-Wood-Frankincense-Moisturising-Cruelty-Free/dp/B07H447QHB/ref=zg_bs_g_handmade_d_sccl_9/520-7137096-7068841?psc=1,2026-02-27,1K+,Handmade-Products,co.uk
1,10,"Printperfect funny birthday cards for women, happy birthday card for her ""We'll Be Friends Until We're Old And Senile"" joke humour birthday card for best friend or bestie",EUR 4.56,141,4.8 out of 5 stars,B0DDJQBCBF,https://www.amazon.co.uk/Printperfect-birthday-Friends-Senile-humour/dp/B0DDJQBCBF/ref=zg_bs_g_handmade_d_sccl_10/520-7137096-7068841?psc=1,2026-02-27,0,Handmade-Products,co.uk
1,11,"The Ilex Wood - Lip Balm with Lemon Balm and Peppermint - All natural, coldsore prevention, palm oil free, cruelty free, plastic free, moisturising lip balm, handcrafted in the UK - 10ml",EUR 9.08,6138,4.6 out of 5 stars,B07MHD173X,https://www.amazon.co.uk/Lemon-Balm-Peppermint-Lip-10ml/dp/B07MHD173X/ref=zg_bs_g_handmade_d_sccl_11/520-7137096-7068841?psc=1,2026-02-27,0,Handmade-Products,co.uk
1,12,Printperfect - Boyfriend Birthday Card - Husband Birthday Card - 'The Best Decision You Ever Made' - I Love You Gifts For Him or Her - Sweet Birthday Cards for Wife Girlfriend Partner,EUR 4.56,262,4.7 out of 5 stars,B0DLL91ZRZ,https://www.amazon.co.uk/Printperfect-Boyfriend-Birthday-Decision-Girlfriend/dp/B0DLL91ZRZ/ref=zg_bs_g_handmade_d_sccl_12/520-7137096-7068841?psc=1,2026-02-27,0,Handmade-Products,co.uk
1,13,"Printperfect - Congratulations Next Chapter Card - Moving, Leaving or New Job Card for Him or Her - 'Here's To Your Next Chapter' Good Luck Card for Men and Women, promotion, university, new baby",EUR 4.56,43,4.7 out of 5 stars,B0G1KCPPBX,https://www.amazon.co.uk/Printperfect-Congratulations-Chapter-promotion-university/dp/B0G1KCPPBX/ref=zg_bs_g_handmade_d_sccl_13/520-7137096-7068841?psc=1,2026-02-27,0,Handmade-Products,co.uk
1,14,Printperfect - Happy Birthday Card For Big Sister – Cute Birthday Cake Card for Sis – From Little Brother Sister Sibling - Pink Cake Card For Her 150mm x 150mm,EUR 4.56,69,4.7 out of 5 stars,B0DV9RPH1R,https://www.amazon.co.uk/Printperfect-Birthday-Sister-Brother-Sibling/dp/B0DV9RPH1R/ref=zg_bs_g_handmade_d_sccl_14/520-7137096-7068841?psc=1,2026-02-27,0,Handmade-Products,co.uk
1,15,Printperfect - 2026 New Baby Card Baby Girl Welcome To The World - Newborn Card - Congratulations On Your New Baby - Niece/Goddaughter - Grandaughter - Girls - Born in 2026 (2026),EUR 4.56,63,4.9 out of 5 stars,B0G66TWR72,https://www.amazon.co.uk/Printperfect-Welcome-Congratulations-Goddaughter-Grandaughter/dp/B0G66TWR72/ref=zg_bs_g_handmade_d_sccl_15/520-7137096-7068841?psc=1,2026-02-27,0,Handmade-Products,co.uk
1,16,Printed Lanyards Personalised Custom Any Text Colour Lanyard Safety Break ID Card Holder. Visitor Security Company Event Gig Show Staff Teacher NHS Nurse (Navy Blue),EUR 5.66,535,4.4 out of 5 stars,B0B4F13D82,https://www.amazon.co.uk/Printed-Lanyards-Personalised-Lanyard-Security/dp/B0B4F13D82/ref=zg_bs_g_handmade_d_sccl_16/520-7137096-7068841?psc=1,2026-02-27,0,Handmade-Products,co.uk
1,17,"Printperfect mum birthday card, happy birthday mum card from daughter, sweet birthday card for mum, women (Pink Envelope)",EUR 4.56,34,4.5 out of 5 stars,B0FHQFPM7M,https://www.amazon.co.uk/Printperfect-birthday-happy-daughter-Envelope/dp/B0FHQFPM7M/ref=zg_bs_g_handmade_d_sccl_17/520-7137096-7068841?psc=1,2026-02-27,0,Handmade-Products,co.uk
1,18,Printperfect - Boyfriend Birthday Card - Husband Birthday Card - 'I Love You Longer' - I Love You Gifts For Him or Her - Sweet Birthday Cards for Wife Girlfriend Partner,EUR 4.56,238,4.8 out of 5 stars,B0DLHVCQ9P,https://www.amazon.co.uk/Printperfect-Boyfriend-Birthday-Husband-Girlfriend/dp/B0DLHVCQ9P/ref=zg_bs_g_handmade_d_sccl_18/520-7137096-7068841?psc=1,2026-02-27,0,Handmade-Products,co.uk
1,19,"Printperfect mum birthday cards, happy birthday mum legend card, funny mum cards from son or daughter (Pink Envelope)",EUR 4.56,54,4.8 out of 5 stars,B0DCTPXSZ3,https://www.amazon.co.uk/Printperfect-birthday-legend-daughter-Envelope/dp/B0DCTPXSZ3/ref=zg_bs_g_handmade_d_sccl_19/520-7137096-7068841?psc=1,2026-02-27,0,Handmade-Products,co.uk
1,20,"Happy 1st Birthday Card for Boys, Cute Safari Animals (Blue)",EUR 4.56,182,4.7 out of 5 stars,B0CLKQTBWN,https://www.amazon.co.uk/Happy-Birthday-Card-Safari-Animals/dp/B0CLKQTBWN/ref=zg_bs_g_handmade_d_sccl_20/520-7137096-7068841?psc=1,2026-02-27,0,Handmade-Products,co.uk
1,21,"Printperfect - Funny Birthday Card From The Dog Amusing Birthday Card For Dog Owner - “Fur Baby Gift For Dog Mum, Dad, Wife, Husband, Girlfriend, Boyfriend - Hilarious Card For Dog Parents",EUR 4.56,136,4.7 out of 5 stars,B0DVCD9H9X,https://www.amazon.co.uk/Printperfect-Birthday-Girlfriend-Boyfriend-Hilarious/dp/B0DVCD9H9X/ref=zg_bs_g_handmade_d_sccl_21/520-7137096-7068841?psc=1,2026-02-27,0,Handmade-Products,co.uk
1,22,"Printperfect - Sympathy card, loss card, Thinking of you, with sympathy, sorry for your loss, sending love card, condolences card, ""one day at a time""",EUR 4.56,3,4.6 out of 5 stars,B0GKWSKDWM,https://www.amazon.co.uk/Printperfect-Sympathy-Thinking-sympathy-condolences/dp/B0GKWSKDWM/ref=zg_bs_g_handmade_d_sccl_22/520-7137096-7068841?psc=1,2026-02-27,0,Handmade-Products,co.uk
1,23,"Wax Melts Scented Handmade Snap Bars, 4 Pack Alien, Angel, Black Opium, Lady Millionairess Scented Soy Wax Melts Vegan Aromatherapy (Perfume1)",EUR 7.42,359,4.0 out of 5 stars,B0CY9TDXMT,https://www.amazon.co.uk/Scented-Handmade-Millionairess-Aromatherapy-Perfume1/dp/B0CY9TDXMT/ref=zg_bs_g_handmade_d_sccl_23/520-7137096-7068841?psc=1,2026-02-27,0,Handmade-Products,co.uk
1,24,Maise & Rose A Little Pocket Hug For Friends Token | Hug Gift | Thinking Of You | Miss You | From Friend | Cheer Up Gift | Letterbox Gift | Get Well Soon | Positive Pick Me Up | Thinking Of You | TKF,EUR 4.56,453,4.6 out of 5 stars,B0C4KW83TS,https://www.amazon.co.uk/Maise-Rose-Thinking-Letterbox-Positive/dp/B0C4KW83TS/ref=zg_bs_g_handmade_d_sccl_24/520-7137096-7068841?psc=1,2026-02-27,0,Handmade-Products,co.uk
1,25,"Printperfect - Brother/Uncle - Birthday Cards for Special Brother and Uncle - ""I Couldn't Be Bothered Getting Two Cards"" Funny Card for Him - Blue",EUR 4.56,41,4.9 out of 5 stars,B0F74B3YYQ,https://www.amazon.co.uk/Printperfect-Brother-Birthday-Special-Bothered/dp/B0F74B3YYQ/ref=zg_bs_g_handmade_d_sccl_25/520-7137096-7068841?psc=1,2026-02-27,0,Handmade-Products,co.uk
1,26,Printperfect - Friend Birthday Card For Her - Female - Best Friend Birthday Card - Special Bestie Cards For Women,EUR 4.56,104,4.8 out of 5 stars,B0DYGC526T,https://www.amazon.co.uk/Printperfect-Friend-Birthday-Female-Special/dp/B0DYGC526T/ref=zg_bs_g_handmade_d_sccl_26/520-7137096-7068841?psc=1,2026-02-27,0,Handmade-Products,co.uk
1,27,Printperfect - Sister Birthday Card For Her - Female - Sis Birthday Card - Special Sisters Cards For Women,EUR 4.56,21,4.6 out of 5 stars,B0FVY2FJHJ,https://www.amazon.co.uk/Printperfect-Sister-Birthday-Special-Sisters/dp/B0FVY2FJHJ/ref=zg_bs_g_handmade_d_sccl_27/520-7137096-7068841?psc=1,2026-02-27,0,Handmade-Products,co.uk
1,28,"Crafted Memories Custom Licence Plate Keychain, Personalised Number Plate Keychain, Mini Number Plate Key Ring, Name Plate Keychain, Custom Car Plate Keyring, New Car, Just Passed",EUR 8.56,1813,4.5 out of 5 stars,B0C29LZ5P8,https://www.amazon.co.uk/Custom-Licence-Keychain-Personalised-Keyring/dp/B0C29LZ5P8/ref=zg_bs_g_handmade_d_sccl_28/520-7137096-7068841?psc=1,2026-02-27,0,Handmade-Products,co.uk
1,29,Printperfect - 2026 New Baby Card Baby Boy - Welcome To The World - New Arrival Card - Congratulations On Your New Baby - Nephew/Godson - Grandson/Great-Grandson - Boys - Born in 2026 (2026),EUR 4.56,43,4.7 out of 5 stars,B0G66ZWXYZ,https://www.amazon.co.uk/Printperfect-Welcome-Congratulations-Grandson-Great-Grandson/dp/B0G66ZWXYZ/ref=zg_bs_g_handmade_d_sccl_29/520-7137096-7068841?psc=1,2026-02-27,0,Handmade-Products,co.uk
1,30,Printperfect - Boyfriend Birthday Card - Husband Birthday Card - 'Happy Birthday To My Favourite Person' - I Love You Gifts For Him or Her - Sweet Birthday Cards for Wife Girlfriend Partner,EUR 4.56,50,4.6 out of 5 stars,B0DVMYP949,https://www.amazon.co.uk/Printperfect-Boyfriend-Birthday-Favourite-Girlfriend/dp/B0DVMYP949/ref=zg_bs_g_handmade_d_sccl_30/520-7137096-7068841?psc=1,2026-02-27,0,Handmade-Products,co.uk
1,31,"Manta Makes Mentor Thank You Gift, Coaster for Colleague Teacher Friend Mentor Gifts, Thank You Gifts for Women, Men, Friends (Amazing People)",EUR 7.99,302,4.7 out of 5 stars,B0D2VD39JT,https://www.amazon.co.uk/Manta-Makes-coaster-colleague-teacher/dp/B0D2VD39JT/ref=zg_bs_g_handmade_d_sccl_31/520-7137096-7068841?psc=1,2026-02-27,0,Handmade-Products,co.uk
1,32,"Printperfect - Birthday Cards For Mum – Best Mum Ever – Birthday Card From Daughter Son, Happy Birthday, Birthday Cards 150mm x 150mm",EUR 4.56,26,4.8 out of 5 stars,B0D9TLNFDG,https://www.amazon.co.uk/Birthday-Cards-Mum-Daughter-Happy/dp/B0D9TLNFDG/ref=zg_bs_g_handmade_d_sccl_32/520-7137096-7068841?psc=1,2026-02-27,0,Handmade-Products,co.uk
1,33,"Printperfect daddy birthday cards, happy birthday daddy Mario inspired, funny daddy cards from son or daughter super daddio (Red Envelope)",EUR 4.56,61,4.7 out of 5 stars,B0D3WH7BVY,https://www.amazon.co.uk/Printperfect-birthday-inspired-daughter-Envelope/dp/B0D3WH7BVY/ref=zg_bs_g_handmade_d_sccl_33/520-7137096-7068841?psc=1,2026-02-27,0,Handmade-Products,co.uk
1,34,The Smelly Wax Company Unstoppables Fresh Strong Scented Laundry Type Wax Melt Snapbar Clamshell Handmade in UK Vegan Friendly Natural Wax,EUR 6.27,289,4.5 out of 5 stars,B09DSXM641,https://www.amazon.co.uk/Unstoppables-Wax-Snapbar-Clamshell-Scented/dp/B09DSXM641/ref=zg_bs_g_handmade_d_sccl_34/520-7137096-7068841?psc=1,2026-02-27,0,Handmade-Products,co.uk
1,35,Maise & Rose New Baby Card | Baby Boy Welcome To The World Card | Winnie The Pooh New Arrival Card | Congratulations On Your New Baby | P6,EUR 4.56,56,4.8 out of 5 stars,B0D76WPM1G,https://www.amazon.co.uk/Maise-Rose-Welcome-Arrival-Congratulations/dp/B0D76WPM1G/ref=zg_bs_g_handmade_d_sccl_35/520-7137096-7068841?psc=1,2026-02-27,0,Handmade-Products,co.uk
1,36,Personalised 21st Birthday Card – Twenty-First Birthday Card for Twenty-One 21 Year Old Women – Custom Unique Keepsake Girls | Daughter | Granddaughter | Niece | Sister | Her | Female | Wife (Age 21),EUR 5.66,92,4.9 out of 5 stars,B0DYR7CPWF,https://www.amazon.co.uk/Personalised-21st-Birthday-Card-Granddaughter/dp/B0DYR7CPWF/ref=zg_bs_g_handmade_d_sccl_36/520-7137096-7068841?psc=1,2026-02-27,0,Handmade-Products,co.uk
1,37,UK BRITISH MADE CATNIP TOYS WITH ORGANIC SUPER STRONG HIGH STENGTH POTENCY CAT NIP INSIDE LARGE CAT KICKER TOY FOR PET CATS. NEW CAT DESIGN!!!(Cat Catnip Kicker Toy),EUR 11.41,138,4.5 out of 5 stars,B0FDY532T7,https://www.amazon.co.uk/DESIGN-BRITISH-ORGANIC-STENGTH-POTENCY/dp/B0FDY532T7/ref=zg_bs_g_handmade_d_sccl_37/520-7137096-7068841?psc=1,2026-02-27,0,Handmade-Products,co.uk
1,38,Happy Birthday Card For Little Sister – Cute Birthday Cake Card for Sis – From Big Brother Sister Sibling - Pink Cake Card For Her 150mm x 150mm,EUR 4.56,64,4.6 out of 5 stars,B0F3W587BS,https://www.amazon.co.uk/Happy-Birthday-Card-Little-Sister/dp/B0F3W587BS/ref=zg_bs_g_handmade_d_sccl_38/520-7137096-7068841?psc=1,2026-02-27,0,Handmade-Products,co.uk
1,39,Maise & Rose New Baby Card | Baby Girl Welcome To The World Card | Winnie The Pooh New Arrival Card | Congratulations On Your New Baby | P7,EUR 4.56,51,4.8 out of 5 stars,B0D76Y5SX1,https://www.amazon.co.uk/Maise-Rose-Welcome-Arrival-Congratulations/dp/B0D76Y5SX1/ref=zg_bs_g_handmade_d_sccl_39/520-7137096-7068841?psc=1,2026-02-27,0,Handmade-Products,co.uk
1,40,"Maise & Rose Pet Loss Sympathy Card and Pocket Hug Token | Bereavement Gift For The Loss Of a Pet Cat, Dog, Rabbit, Hamster, Gerbil, Guinea Pig | Sorry For Your Loss Gift | PLTKN",EUR 4.56,141,4.5 out of 5 stars,B0D269BMB8,https://www.amazon.co.uk/Maise-Rose-Sympathy-Bereavement-Hamster/dp/B0D269BMB8/ref=zg_bs_g_handmade_d_sccl_40/520-7137096-7068841?psc=1,2026-02-27,0,Handmade-Products,co.uk
1,41,Maise & Rose Retirement Card | Funny Retirement Card For Him or Her | Retirement Card For Men | Congratulations Retirement Card For Women | P66,EUR 4.56,58,4.9 out of 5 stars,B0D8TL79DJ,https://www.amazon.co.uk/Maise-Rose-Retirement-Funny-Congratulations/dp/B0D8TL79DJ/ref=zg_bs_g_handmade_d_sccl_41/520-7137096-7068841?psc=1,2026-02-27,0,Handmade-Products,co.uk
1,42,Pink Positive Will You Be My Maid of honour Card - Hen Do Maid of honour Proposal Card - A6 White Card with Gold Foil - Luxury Foiled Be My Maid of honour Gifts (Maid of Honour),EUR 4.56,20,4.3 out of 5 stars,B0DCTVFBX1,https://www.amazon.co.uk/Pink-Positive-Will-Maid-honour/dp/B0DCTVFBX1/ref=zg_bs_g_handmade_d_sccl_42/520-7137096-7068841?psc=1,2026-02-27,0,Handmade-Products,co.uk
1,43,Maise & Rose 16th Birthday Card For Her | Girls 16th Birthday Card | Sweet 16 Birthday Balloon Card | P193,EUR 4.56,46,4.4 out of 5 stars,B0DPB8F1DQ,https://www.amazon.co.uk/Maise-Rose-Birthday-Girls-Balloon/dp/B0DPB8F1DQ/ref=zg_bs_g_handmade_d_sccl_43/520-7137096-7068841?psc=1,2026-02-27,0,Handmade-Products,co.uk
1,44,Maise & Rose Christening Card For Her | Little Girl Christening Card | Christening Day Card For Baby Girl | P80,EUR 4.56,43,4.8 out of 5 stars,B0D96K3KPL,https://www.amazon.co.uk/Maise-Rose-Christening-Card-Little/dp/B0D96K3KPL/ref=zg_bs_g_handmade_d_sccl_44/520-7137096-7068841?psc=1,2026-02-27,0,Handmade-Products,co.uk
1,45,"Congratulations Driving Test Card pink, New Card Driving Exam, Well Done Passing Exam Card, Blank Inside with Envelope, Driving Test Card",EUR 4.51,30,4.8 out of 5 stars,B0FGK3G75B,https://www.amazon.co.uk/Congratulations-Driving-Passing-Inside-Envelope/dp/B0FGK3G75B/ref=zg_bs_g_handmade_d_sccl_45/520-7137096-7068841?psc=1,2026-02-27,0,Handmade-Products,co.uk
1,46,Room on The Broom Inspired Yellow and Red Spot Hair Clip with Witches Wand Yellow Star Wand with Striped Handle World Book Day Accessories Magical Dress-Up Duo,EUR 15.98,35,4.2 out of 5 stars,B09R6JG3TX,https://www.amazon.co.uk/Broom-Inspired-Yellow-Striped-Handle/dp/B09R6JG3TX/ref=zg_bs_g_handmade_d_sccl_46/520-7137096-7068841?psc=1,2026-02-27,0,Handmade-Products,co.uk
2,51,Custom Text Stickers Gloss Matt Colours Small to Large Sizes 30 Fonts Personalised Quotes Names Wording Slogan Phrase Die Cut Vinyl Car Window Bumper Bedroom Wall Decals Graphics,EUR 4.28,1106,4.6 out of 5 stars,B07P914HBH,https://www.amazon.co.uk/Gloss-Colours-Personlised-Stickers-Graphics/dp/B07P914HBH/ref=zg_bs_g_handmade_d_sccl_1/520-7137096-7068841?psc=1,2026-02-27,0,Handmade-Products,co.uk
2,52,"Funny Birthday Card for Pilates and Yoga girl friends, BFF, bestie, wife, Mum, daughter, sister or friend - Humorous pie lattes gym cartoon - Special for every occasions - Fun Birthday Card for Him",EUR 4.56,118,4.8 out of 5 stars,B07MV6L5ZV,https://www.amazon.co.uk/Birthday-Pilates-friends-bestie-daughter/dp/B07MV6L5ZV/ref=zg_bs_g_handmade_d_sccl_2/520-7137096-7068841?psc=1,2026-02-27,100+,Handmade-Products,co.uk
2,53,"Printperfect dad birthday cards, happy birthday dad legend card, funny dad cards from son or daughter (Red Envelope)",EUR 4.56,43,4.6 out of 5 stars,B0DCTQ64GX,https://www.amazon.co.uk/Printperfect-birthday-legend-daughter-Envelope/dp/B0DCTQ64GX/ref=zg_bs_g_handmade_d_sccl_3/520-7137096-7068841?psc=1,2026-02-27,0,Handmade-Products,co.uk
2,54,Printperfect Salah Football Birthday Cards For Boys - Football Birthday Card For Son - Football Birthday Card For Men “It's Time To Salah-brate!” - Football Fan Gift - Football Fan Birthday Card,EUR 4.56,159,4.6 out of 5 stars,B0DPGN1J47,https://www.amazon.co.uk/Printperfect-Salah-Football-Birthday-Cards/dp/B0DPGN1J47/ref=zg_bs_g_handmade_d_sccl_4/520-7137096-7068841?psc=1,2026-02-27,0,Handmade-Products,co.uk
2,55,"Room on the Broom Inspired Yellow & Red Spot Hair Bow Clip – Girls’ Fancy Dress Accessory for School Events, World Book Day, or Charity Dress-Up Days – Handmade Ribbon Bow",EUR 6.84,17,4.0 out of 5 stars,B09TB7B386,https://www.amazon.co.uk/Broom-Inspired-Witches-Yellow-Spots/dp/B09TB7B386/ref=zg_bs_g_handmade_d_sccl_5/520-7137096-7068841?psc=1,2026-02-27,50+,Handmade-Products,co.uk
2,56,Personalised 18th Birthday Card - Eighteenth Birthday Card for 18 Year Old Boys Eighteen Son Grandson Nephew Brother Men Him (Age 18),EUR 5.66,492,4.8 out of 5 stars,B0B9HVD6M8,https://www.amazon.co.uk/Personalised-18th-Birthday-Card-Eighteenth/dp/B0B9HVD6M8/ref=zg_bs_g_handmade_d_sccl_6/520-7137096-7068841?psc=1,2026-02-27,0,Handmade-Products,co.uk
2,57,"Printperfect - SisterAuntie/Aunty - Birthday Cards for Special Sister and Auntie - ""I Couldn't Be Bothered Getting Two Cards"" Funny Card for Her - Pink",EUR 4.56,21,4.7 out of 5 stars,B0F6YSS4CF,https://www.amazon.co.uk/Printperfect-SisterAuntie-Birthday-Special-Bothered/dp/B0F6YSS4CF/ref=zg_bs_g_handmade_d_sccl_7/520-7137096-7068841?psc=1,2026-02-27,0,Handmade-Products,co.uk
2,58,Printperfect - K POP Birthday Card For Girls- HAPPY BIRTHDAY IS WHAT IT SOUNDS LIKE K-POP Greetings Card For Girls - Birthday Cards for Friend Daughter Sister Bestie Niece Grandaughter,EUR 4.56,4,5.0 out of 5 stars,B0GCX9BDHD,https://www.amazon.co.uk/Printperfect-Birthday-BIRTHDAY-Greetings-Grandaughter/dp/B0GCX9BDHD/ref=zg_bs_g_handmade_d_sccl_8/520-7137096-7068841?psc=1,2026-02-27,0,Handmade-Products,co.uk
2,59,"Chicken Craft Customisable Personalised Drawstring Bag - Ideal PE Kit, Gym, and Swimming Bag for Boys, Girls, Kids in Nursery and Primary School, Available with Monogrammed Initial and Name",EUR 10.27,683,4.6 out of 5 stars,B0CCSY884Y,https://www.amazon.co.uk/Customisable-Personalised-Drawstring-Bag-Monogrammed/dp/B0CCSY884Y/ref=zg_bs_g_handmade_d_sccl_9/520-7137096-7068841?psc=1,2026-02-27,0,Handmade-Products,co.uk
2,60,Mermaid Mary's Pocket hug gift | Sending you a big hug | Send a hug in the post gift | Pocket Hug token | good luck for starting school,EUR 4.51,218,4.6 out of 5 stars,B0D5YNNCVQ,https://www.amazon.co.uk/Pocket-gift-Sending-token-heart/dp/B0D5YNNCVQ/ref=zg_bs_g_handmade_d_sccl_10/520-7137096-7068841?psc=1,2026-02-27,0,Handmade-Products,co.uk
2,61,Maise & Rose 30th Birthday Card For Her | 30th Birthday Card For Friend | Pink Thirtieth Birthday Card For Women | 30 Today | P177,EUR 4.56,42,4.7 out of 5 stars,B0DPL9NZM3,https://www.amazon.co.uk/Maise-Rose-Birthday-Friend-Thirtieth/dp/B0DPL9NZM3/ref=zg_bs_g_handmade_d_sccl_11/520-7137096-7068841?psc=1,2026-02-27,0,Handmade-Products,co.uk
2,62,"Birthday Cards For Daddy – ""We Love You More Than Youtube"" – Fathers Day or Birthday Card From Daughters Sons, Children, Kids, Happy Birthday Father, Daddy, Father's or Bday Gift 150mm x 150mm",EUR 4.56,71,4.7 out of 5 stars,B0DJ11KZHM,https://www.amazon.co.uk/Birthday-Cards-Daddy-Daughters-Children/dp/B0DJ11KZHM/ref=zg_bs_g_handmade_d_sccl_12/520-7137096-7068841?psc=1,2026-02-27,0,Handmade-Products,co.uk
2,63,"Print&CoUK - Birthday Surprise Scratch Card, Scratch to reveal, Gift, Surprise, Scratch off ticket",EUR 6.84,14,4.6 out of 5 stars,B0F4DGV9Y6,https://www.amazon.co.uk/Print-CoUK-Birthday-Surprise-Scratch/dp/B0F4DGV9Y6/ref=zg_bs_g_handmade_d_sccl_13/520-7137096-7068841?psc=1,2026-02-27,0,Handmade-Products,co.uk
2,64,Snow Fairys Wax Melt Snap Bar 5 Blocks Highly Scented Handmade UK Scented Soy Wax Melts Vegan Aromatherapy,EUR 4.56,270,4.0 out of 5 stars,B09FLQQZXP,https://www.amazon.co.uk/Snow-Fairy-Blocks-Highly-Scented/dp/B09FLQQZXP/ref=zg_bs_g_handmade_d_sccl_14/520-7137096-7068841?psc=1,2026-02-27,0,Handmade-Products,co.uk
2,65,Maise & Rose Daughter Birthday Card | Birthday Card For Daughter | Daughter Birthday Card With Words | P120,EUR 4.56,135,4.7 out of 5 stars,B0DCSYWCMR,https://www.amazon.co.uk/Maise-Rose-Daughter-Birthday-Words/dp/B0DCSYWCMR/ref=zg_bs_g_handmade_d_sccl_15/520-7137096-7068841?psc=1,2026-02-27,0,Handmade-Products,co.uk
2,66,Maise & Rose Birthday Card For Friend | Winnie The Pooh and Piglet Birthday Card | Birthday Celebration | Birthday Card For Women | Men | P1,EUR 4.56,33,4.5 out of 5 stars,B0D749DT6Z,https://www.amazon.co.uk/Maise-Rose-Birthday-Friend-Celebration/dp/B0D749DT6Z/ref=zg_bs_g_handmade_d_sccl_16/520-7137096-7068841?psc=1,2026-02-27,0,Handmade-Products,co.uk
2,67,"Forget Me Not Memorial Pin, Flower Design, Funeral Favour, Bereavement Gift, Rememberance Brooch (1 x Memorial Pin)",EUR 8.57,149,4.8 out of 5 stars,B0D2RFPJPS,https://www.amazon.co.uk/Forget-Memorial-Funeral-Bereavement-Rememberance/dp/B0D2RFPJPS/ref=zg_bs_g_handmade_d_sccl_17/520-7137096-7068841?psc=1,2026-02-27,0,Handmade-Products,co.uk
2,68,Will you be my Bridesmaid card - Bridesmaid Proposal Card (Bridesmaid),EUR 1.94,61,4.6 out of 5 stars,B0D45KV59W,https://www.amazon.co.uk/Will-you-Bridesmaid-card-Proposal/dp/B0D45KV59W/ref=zg_bs_g_handmade_d_sccl_18/520-7137096-7068841?psc=1,2026-02-27,0,Handmade-Products,co.uk
2,69,Wax Melts 4 Bars | Build Your Own Box (Choose 4 Scents) Wax Melts Handmade Highly Scented Soy Snap Bars Designer Fragrance Vegan & Cruelty Free,EUR 7.42,869,3.9 out of 5 stars,B0BSRFQYG8,https://www.amazon.co.uk/Handmade-Scented-Designer-Fragrance-Cruelty/dp/B0BSRFQYG8/ref=zg_bs_g_handmade_d_sccl_19/520-7137096-7068841?psc=1,2026-02-27,0,Handmade-Products,co.uk
2,70,Personalised Holiday Scratch Card with Gold Envelope - Custom Scratch Boarding Pass Ticket Surprise - We are Going to - Travel Scratchcard for Christmas (Personalised),EUR 5.66,83,4.6 out of 5 stars,B0FRB8JZ7L,https://www.amazon.co.uk/Personalised-Holiday-Scratch-Card-Envelope/dp/B0FRB8JZ7L/ref=zg_bs_g_handmade_d_sccl_20/520-7137096-7068841?psc=1,2026-02-27,0,Handmade-Products,co.uk
2,71,Silver Double Hoop Nose Ring - Thin Tiny 20 Gauge 7mm Spiral Double Nose Hoop - Handmade 925 Sterling Silver Spiral Nose Piercing Jewellery For Women - Gift Ready,EUR 7.94,687,3.3 out of 5 stars,B09NTWK7R8,https://www.amazon.co.uk/Tiny-Silver-Double-Hoop-Nose/dp/B09NTWK7R8/ref=zg_bs_g_handmade_d_sccl_21/520-7137096-7068841?psc=1,2026-02-27,0,Handmade-Products,co.uk
