page,rank,title,price,reviews_count,rating,asin,url,date,bought_number,category,market_place
2,75,"FitBeast Pull Up Bands Set, 5 Different Levels Resistance Band Pull Up for Calisthenics, Bodyweight Training, Muscle Toning, Yoga, Stretch Mobility, Pull Up Assistance Bands",EUR 22.84,4616,4.6 out of 5 stars,B087CSNDRT,https://www.amazon.co.uk/FitBeast-Resistance-Different-Exercise-Powerlifting/dp/B087CSNDRT/ref=zg_bs_g_sports_d_sccl_25/525-1211990-8722466?psc=1,2026-02-27,0,sports,co.uk
2,76,"Trespass Albus Backpack Perfect Rucksack for School, Hiking, Camping or Work",EUR 22.79,20862,4.5 out of 5 stars,B07T5F99K6,https://www.amazon.co.uk/Trespass-Albus-Backpack-Rucksack-Litres/dp/B07T5F99K6/ref=zg_bs_g_sports_d_sccl_26/525-1211990-8722466?psc=1,2026-02-27,0,sports,co.uk
2,77,"Core Balance Soft Pilates Ball 23cm / 9 Inch, Small Anti Burst, Yoga Exercise Fitness Physiotherapy Physical Training, Inflatable Straw For Easy Inflation, 200kg Weight Capacity",EUR 7.76,1992,4.5 out of 5 stars,B08HSG8RHG,https://www.amazon.co.uk/Core-Balance-Pilates-Burst-Inflation/dp/B08HSG8RHG/ref=zg_bs_g_sports_d_sccl_27/525-1211990-8722466?psc=1,2026-02-27,0,sports,co.uk
2,78,"XIAOMI Smart Band 10 Fitness Tracker, 44mm AMOLED Display, 21Day Battery Life, 150 Sports Modes,Sleep Monitoring, 5ATM Waterproof, Compatible With Android and IOS – Midnight Black",EUR 39.68,6517,4.4 out of 5 stars,B0DYF82545,https://www.amazon.co.uk/Fitness-Monitoring-Electronic-Waterproof-Warranty/dp/B0DYF82545/ref=zg_bs_g_sports_d_sccl_28/525-1211990-8722466?psc=1,2026-02-27,0,sports,co.uk
2,79,OZE SPORTS Yoga Mat Exercise NBR Fitness foam mat Extra Thick Non-Slip Large Padded High Density ideal for HiiT Pilates gymnastics mats Fitness & Workout with Free Carry Strap (Pink),EUR 11.41,861,4.6 out of 5 stars,B0BMGCTJQV,https://www.amazon.co.uk/Exercise-Fitness-Non-Slip-Density-gymnastics/dp/B0BMGCTJQV/ref=zg_bs_g_sports_d_sccl_29/525-1211990-8722466?psc=1,2026-02-27,0,sports,co.uk
2,80,"Garmin Forerunner 55 GPS 42mm Running Smartwatch, Easy to use, Lightweight, Training Guidance, Safety & Tracking Features, Black",EUR 131.80,10755,4.5 out of 5 stars,B0953X73TP,https://www.amazon.co.uk/Garmin-Forerunner-Running-Smartwatch-Black/dp/B0953X73TP/ref=zg_bs_g_sports_d_sccl_30/525-1211990-8722466?psc=1,2026-02-27,0,sports,co.uk
2,81,"TOPLUS Swimming Goggles - Adult Unisex Swim Goggles with No Leaking, Anti Fog, UV Protection for Men, Women, Kids 8+",EUR 10.27,3492,4.3 out of 5 stars,B07ZZ4QVYT,https://www.amazon.co.uk/TOPLUS-Swimming-Goggles-Protection-Silicone/dp/B07ZZ4QVYT/ref=zg_bs_g_sports_d_sccl_81/525-1211990-8722466?psc=1,2026-02-27,0,sports,co.uk
2,82,"DDUO Portable Ball Pump,Air Pump Inflator Kit with Needle,Nozzle, Extension Hose Hand Pumps for Basketball Football Volleyball Water Polo Rugby Exercise Sports Ball Balloon swimming ring",EUR 6.84,17643,4.3 out of 5 stars,B07Z1R96TH,https://www.amazon.co.uk/DDUO-Sports-Inflation-Needle-Nozzles/dp/B07Z1R96TH/ref=zg_bs_g_sports_d_sccl_82/525-1211990-8722466?psc=1,2026-02-27,0,sports,co.uk
2,83,"SNMIX Ball Pump with Needle, Nozzle and Extension Hose for Basketball, Football, Rugby Balls - Durable Aluminium-alloy Tube, Ergonomic Design, Fast Air Inflator, Silver",EUR 5.82,2031,4.4 out of 5 stars,B0C2CH91H8,https://www.amazon.co.uk/SNMIX-Needle-Extension-Basketball-Football/dp/B0C2CH91H8/ref=zg_bs_g_sports_d_sccl_83/525-1211990-8722466?psc=1,2026-02-27,0,sports,co.uk
2,84,adidas TIRO 0.75L Bottle,EUR 6.84,544,4.5 out of 5 stars,B0CZ15Z7KB,https://www.amazon.co.uk/adidas-UNISEX-TIRO-BOTTLE-LITRE/dp/B0CZ15Z7KB/ref=zg_bs_g_sports_d_sccl_84/525-1211990-8722466?psc=1,2026-02-27,0,sports,co.uk
2,85,"BEEWAY Locking Carabiner, Premium Aluminum Alloy D-Ring Carabiners Key Chain Clip Hook for Camping, Hiking, Traveling, Fishing, Backpack",EUR 6.84,4543,4.5 out of 5 stars,B095P963PG,https://www.amazon.co.uk/BEEWAY-Carabiner-Aluminum-Carabiners-Traveling/dp/B095P963PG/ref=zg_bs_g_sports_d_sccl_85/525-1211990-8722466?psc=1,2026-02-27,0,sports,co.uk
2,86,"CFX Resistance Bands Set, Exercise Bands with Non-Slip Design for HIPS & Glutes, 3 Levels Workout Bands for Women and Men, Booty Bands for Home Fitness, Yoga, Pilates",EUR 14.74,19900,4.7 out of 5 stars,B07RBLJH73,https://www.amazon.co.uk/CFX-Resistance-Premium-Exercise-Non-Slip/dp/B07RBLJH73/ref=zg_bs_g_sports_d_sccl_86/525-1211990-8722466?psc=1,2026-02-27,2K+,sports,co.uk
2,87,"Vexloria Resistance Bands, Exercise Band Set of Five with Five Resistance Levels, Resistance Band Women with Carrying Case, Resistance Bands Set Men for Home, Gym, Yoga, Training",EUR 4.90,292,4.4 out of 5 stars,B0DGH15YCL,https://www.amazon.co.uk/Vexloria-Resistance-Exercise-Carrying-Training/dp/B0DGH15YCL/ref=zg_bs_g_sports_d_sccl_87/525-1211990-8722466?psc=1,2026-02-27,0,sports,co.uk
2,88,"BEAST RAGE Weight Lifting Gloves for men and women, Gym Gloves for Crossfit.Breathable,Non-Slip Silicon padded palm Protection workout gloves for weightlifting, Cycling,Strength training",EUR 10.27,2568,4.4 out of 5 stars,B0CPPBGZKG,https://www.amazon.co.uk/BEAST-RAGE-Crossfit-Breathable-Protection-weightlifting/dp/B0CPPBGZKG/ref=zg_bs_g_sports_d_sccl_88/525-1211990-8722466?psc=1,2026-02-27,0,sports,co.uk
2,89,"Abdominal Trainer, Sit-Up Training Equipment, Bodybuilding Expander, Full Body Trainer for Home, 6 Tubes, Elastic Pull Rope, Multifunctional Leg Exerciser for Fitness, Weight Loss, Training, Yoga",EUR 9.13,1788,4.0 out of 5 stars,B09KY93T8X,https://www.amazon.co.uk/Resistance-Exercise-Equipment-Bodybuilding-Stretching/dp/B09KY93T8X/ref=zg_bs_g_sports_d_sccl_89/525-1211990-8722466?psc=1,2026-02-27,0,sports,co.uk
2,90,"Slime Bike Inner Tube with Slime Puncture Sealant, Self Sealing, Prevent and Repair",EUR 8.96,32500,4.2 out of 5 stars,B00NHF3HGO,https://www.amazon.co.uk/Slime-30023-Puncture-Sealant-60-584mm/dp/B00NHF3HGO/ref=zg_bs_g_sports_d_sccl_90/525-1211990-8722466?psc=1,2026-02-27,0,sports,co.uk
2,91,"2 Pcs Swimming Caps for Kids Girls Boys and Adult Teenager,Comfortable Light Swimming Caps,Super Stretch No Pull Hair Swim Hats for Long and Short Hair",EUR 4.56,1451,4.3 out of 5 stars,B09XXTTQTS,https://www.amazon.co.uk/Elastic-Swimming-Comfortable-Stretch-Lightweight/dp/B09XXTTQTS/ref=zg_bs_g_sports_d_sccl_91/525-1211990-8722466?psc=1,2026-02-27,0,sports,co.uk
2,92,"Fitbit Charge 6 Activity Tracker with 6 Months Premium Membership Included, 7 Days Battery Life and Google Wallet and Google Maps, Obsidian/Black Aluminum",EUR 122.26,4846,4.2 out of 5 stars,B0CHN2F11G,https://www.amazon.co.uk/Fitbit-Activity-6-months-Membership-Included/dp/B0CHN2F11G/ref=zg_bs_g_sports_d_sccl_92/525-1211990-8722466?psc=1,2026-02-27,0,sports,co.uk
2,93,FitBeast Grip Strengthener Forearm Strengthener Hand Grips Strengthener Kit - 5 Pack Adjustable Resistance,EUR 10.84,14450,4.4 out of 5 stars,B07BXDN3HH,https://www.amazon.co.uk/FitBeast-Hand-Strengthener-Forearm-Workout/dp/B07BXDN3HH/ref=zg_bs_g_sports_d_sccl_93/525-1211990-8722466?psc=1,2026-02-27,0,sports,co.uk
2,94,"Resistance Bands Set, [Set of 3] 1.5M/4.9ft Skin-Friendly Exercise Bands with 3 Resistance Levels,Workout Resistance Bands Set for Women Men,Ideal for Strength Training,Yoga,Gym,Pilates,Fitness",EUR 7.96,1290,4.6 out of 5 stars,B09F5VH5HY,https://www.amazon.co.uk/Resistance-Skin-Friendly-Exercise-Strength-Training/dp/B09F5VH5HY/ref=zg_bs_g_sports_d_sccl_94/525-1211990-8722466?psc=1,2026-02-27,0,sports,co.uk
2,95,EVO Fitness Weight Lifting Straps Anti Slip Gym Powerlifting Deadlifting Bodybuilding Workout Strength Training Hand Bar Grips Neoprene Gel padded Wrist Support Unisex Men Women,EUR 6.84,995,4.6 out of 5 stars,B0BT243M9C,https://www.amazon.co.uk/EVO-Fitness-Powerlifting-Deadlifting-Bodybuilding/dp/B0BT243M9C/ref=zg_bs_g_sports_d_sccl_95/525-1211990-8722466?psc=1,2026-02-27,0,sports,co.uk
2,96,"Nikwax TECH WASH and TX DIRECT Twin Pack, Technical Cleaner and Wash-In Waterproofer for Waterproof Clothing, Cleans, Waterproofs, Revitalizes Breathability, 2x 1L",EUR 35.93,1594,4.7 out of 5 stars,B01IFEISWO,https://www.amazon.co.uk/Nikwax-Waterproofer-Waterproofs-Revitalizes-Breathability/dp/B01IFEISWO/ref=zg_bs_g_sports_d_sccl_96/525-1211990-8722466?psc=1,2026-02-27,0,sports,co.uk
