page,rank,title,price,reviews_count,rating,asin,url,date,bought_number,category,market_place
1,1,"Air Wick Linen & White Orchid Aerosol-Free Automatic Spray Refill 228ml, Lasts up to 70 Days, Air Freshener",EUR 5.69,1714,4.6 out of 5 stars,B0DP7JQK98,https://www.amazon.co.uk/Orchid-Aerosol-Free-Automatic-Refill-Freshener/dp/B0DP7JQK98/ref=zg_bs_g_automotive_d_sccl_1/260-0569253-8374645?psc=1,2026-02-27,0,automotive,co.uk
1,2,"AstroAI Tyre Inflator Air Compressor 12V DC, Car Accessories Digital Tyre Pump 150 PSI, Preset Tyre Pressure & Auto Shutoff, Electric tyre Pumps for Cars Motorcycles Bikes (Black&Yellow)",EUR 18.08,9770,4.5 out of 5 stars,B0C2H652ZJ,https://www.amazon.co.uk/AstroAI-Inflator-Compressor-Pressure-Inflatables/dp/B0C2H652ZJ/ref=zg_bs_g_automotive_d_sccl_2/260-0569253-8374645?psc=1,2026-02-27,10K+,automotive,co.uk
1,3,"lanpard Faraday Pouch for car Keys,2 Pack Faraday Bag | Car Key Signal Blocking Pouch | Keyless Entry Car Keys Case | RFID Blocker Bag for Car Security | Anti-Theft Remote Entry Keyless Protect(M)",EUR 7.53,49141,4.5 out of 5 stars,B07PP1X4MJ,https://www.amazon.co.uk/Faraday-Lanpard-Blocker-Blocking-Security/dp/B07PP1X4MJ/ref=zg_bs_g_automotive_d_sccl_3/260-0569253-8374645?psc=1,2026-02-27,10K+,automotive,co.uk
1,4,"Miracase Car Phone Holder for Cars Dashboard Windscreen Desk, 3in 1 Mobile Phone Mount Automobile Cradle 360° Rotatable Stand GPS Vehicle Mount for iPhone 17 16 15 Pro Plus Max 14 13 12 11Samsung",EUR 12.57,66210,4.3 out of 5 stars,B0DHJSBGTT,https://www.amazon.co.uk/Miracase-Dashboard-Windscreen-Automobile-Rotatable/dp/B0DHJSBGTT/ref=zg_bs_g_automotive_d_sccl_4/260-0569253-8374645?psc=1,2026-02-27,4K+,automotive,co.uk
1,5,"Autoglym Polar Blast, 2.5L Concentrate Extra Thick Snow Foam (15L when diluted) Softens dirt in advance of wash, pH Neutral Car Shampoo Suitable For All Paint Types",EUR 18.70,14307,4.6 out of 5 stars,B079QNQL1R,https://www.amazon.co.uk/Autoglym-Concentrate-diluted-Softens-Suitable/dp/B079QNQL1R/ref=zg_bs_g_automotive_d_sccl_5/260-0569253-8374645?psc=1,2026-02-27,0,automotive,co.uk
1,6,"Car Air Fresheners, California Scents Car Scent, Long Lasting, Pack of 4, Coronado Cherry (Package may vary)",EUR 12.11,8997,4.0 out of 5 stars,B09GG3RX93,https://www.amazon.co.uk/California-Scents-Coronado-Cherry-AMAZON/dp/B09GG3RX93/ref=zg_bs_g_automotive_d_sccl_6/260-0569253-8374645?psc=1,2026-02-27,0,automotive,co.uk
1,7,Dr Beckmann Upholstery Stain Remover with Brush 400ml,EUR 8.56,7842,4.4 out of 5 stars,B09Q42NQ5D,https://www.amazon.co.uk/Dr-Beckmann-Upholstery-stubborn-applicator/dp/B09Q42NQ5D/ref=zg_bs_g_automotive_d_sccl_7/260-0569253-8374645?psc=1,2026-02-27,0,automotive,co.uk
1,8,"Blukar Car Phone Holder, Air Vent Car Phone Mount Cradle 360° Rotation - Upgraded Super Stable Hook Clip - One Button Release Holder for iPhone, Galaxy, All 4.0''-6.7'' Smartphones",EUR 6.83,12034,4.4 out of 5 stars,B0B45XQ6Q3,https://www.amazon.co.uk/Phone-Holder-Blukar-Cradle-Rotation/dp/B0B45XQ6Q3/ref=zg_bs_g_automotive_d_sccl_8/260-0569253-8374645?psc=1,2026-02-27,5K+,automotive,co.uk
1,9,"caslord Faraday Pouch for Car Keys, Pack of 2 Anti-Theft RFID Key Fob Protection Bag with 4 Pack Key Rings for Car Security, Keyless Entry Car Keys Case, M, Red and Blue",EUR 8.67,3048,4.6 out of 5 stars,B0DYDRX4K1,https://www.amazon.co.uk/caslord-Faraday-Anti-Theft-Protection-Security/dp/B0DYDRX4K1/ref=zg_bs_g_automotive_d_sccl_9/260-0569253-8374645?psc=1,2026-02-27,9K+,automotive,co.uk
1,10,"Onarway Fully Magnetic Car L-Plates Red L Plate 2 Pack for Car Magnetic Extra Thick Strong Learner Plates, No Melting No Blow off Easy to Move without Scratching Painting off",EUR 6.62,9379,4.6 out of 5 stars,B075QD6MQD,https://www.amazon.co.uk/Onarway-Magnetic-L-Plates-magnetic-Scratching/dp/B075QD6MQD/ref=zg_bs_g_automotive_d_sccl_10/260-0569253-8374645?psc=1,2026-02-27,5K+,automotive,co.uk
1,11,"CarPlan All Seasons Ready Mixed Screen Wash, Removes Dirt, Grime, Prevents Freezing, 5 Litres",EUR 10.26,9583,4.6 out of 5 stars,B004DEC8L8,https://www.amazon.co.uk/CarPlan-ASW005-Screen-Wash-Litre/dp/B004DEC8L8/ref=zg_bs_g_automotive_d_sccl_11/260-0569253-8374645?psc=1,2026-02-27,0,automotive,co.uk
1,12,Castrol EDGE 5W-30 LL Engine Oil 1L,EUR 19.40,26123,4.8 out of 5 stars,B0C8154V2R,https://www.amazon.co.uk/Castrol-EDGE-5W-30-Engine-Oil/dp/B0C8154V2R/ref=zg_bs_g_automotive_d_sccl_12/260-0569253-8374645?psc=1,2026-02-27,0,automotive,co.uk
1,13,"BEEWAY Blind Spot Mirrors, Round Frameless 360° Rotate Sway Adjustable HD Glass Convex Mirror Maximize RearView Universal for Car SUV Trucks Traffic Safety - Pack 2",EUR 5.70,10291,4.5 out of 5 stars,B06XSJNDFH,https://www.amazon.co.uk/Frameless-Adjustable-Maximize-RearView-Universal/dp/B06XSJNDFH/ref=zg_bs_g_automotive_d_sccl_13/260-0569253-8374645?psc=1,2026-02-27,0,automotive,co.uk
1,14,CarPlan POL102 Car Wash Shampoo and Wax Protective Layer 5L Ph Neutral 5 Litre Detailing Cleaner Care Vehicle Cleaning Soap - Remove Dirt Road Grime Streak Free Showroom Shine Finish,EUR 6.57,3755,4.5 out of 5 stars,B00NXIOKQQ,https://www.amazon.co.uk/CarPlan-POL102-Ultra-Wash-Wax/dp/B00NXIOKQQ/ref=zg_bs_g_automotive_d_sccl_14/260-0569253-8374645?psc=1,2026-02-27,0,automotive,co.uk
1,15,"Jelly Belly 15210 Very Cherry Air Freshener, 18g",EUR 4.95,12834,4.4 out of 5 stars,B003WA3O9O,https://www.amazon.co.uk/Jelly-Belly-15210-Freshener-Cherry/dp/B003WA3O9O/ref=zg_bs_g_automotive_d_sccl_15/260-0569253-8374645?psc=1,2026-02-27,0,automotive,co.uk
1,16,"Ipflin Tyre Inflator Air Compressor - Digital Car Tyre Pump 12V DC,Portable Car Accessories for Men,Electric Air Pump 150 PSI For Car Tyres,Bikes,Football,Preset Tyre Pressure & Auto Shutoff",EUR 17.14,1792,4.5 out of 5 stars,B0DS5TMTF1,https://www.amazon.co.uk/Ipflin-Tyre-Inflator-Air-Compressor/dp/B0DS5TMTF1/ref=zg_bs_g_automotive_d_sccl_16/260-0569253-8374645?psc=1,2026-02-27,0,automotive,co.uk
1,17,"Bosch H7 (477) Pure Light Halogen Headlight Bulb, 12 V 55 W, Original Quality - Socket Type PX26d - 1 Replacement Car Light Bulb",EUR 5.34,25428,4.6 out of 5 stars,B002B552T6,https://www.amazon.co.uk/Bosch-987-Light-Bulb-Pure/dp/B002B552T6/ref=zg_bs_g_automotive_d_sccl_17/260-0569253-8374645?psc=1,2026-02-27,2K+,automotive,co.uk
1,18,"AA Magnetic L Plate, White, Pack of 2",EUR 4.42,6715,4.2 out of 5 stars,B002AQ40N0,https://www.amazon.co.uk/AA-AA5060-Plates-Magnetic-Pair/dp/B002AQ40N0/ref=zg_bs_g_automotive_d_sccl_18/260-0569253-8374645?psc=1,2026-02-27,5K+,automotive,co.uk
1,19,"Little Trees Air Freshener, Traditional Fragrances, Pack of 3 (Packaging may vary)",EUR 3.56,3382,4.4 out of 5 stars,B000BQULRA,https://www.amazon.co.uk/Little-Freshener-Traditional-Fragrances-Packaging/dp/B000BQULRA/ref=zg_bs_g_automotive_d_sccl_19/260-0569253-8374645?psc=1,2026-02-27,0,automotive,co.uk
1,20,"AstroAI B8 Car Battery Booster Jump Starter Power Pack for 12V Vehicles (7.0L Petrol / 5.5L Diesel) and Motorcycles, Car Jump Starter Power Bank, Includes LED Light & Full Accessories, Orange",EUR 34.25,10168,4.6 out of 5 stars,B0FB2L7CCX,https://www.amazon.co.uk/AstroAI-B8-Vehicles-Motorcycles-Accessories/dp/B0FB2L7CCX/ref=zg_bs_g_automotive_d_sccl_20/260-0569253-8374645?psc=1,2026-02-27,0,automotive,co.uk
1,21,"VapourVanish Reusable Dehumidifier Bags - Car Dehumidifier Moisture Absorber With Dashboard Anti-Slip Mats, Rechargeable Silica Gel Interior Dehumidifiers, Eliminates Foggy Windscreen - Home Wardrobe",EUR 15.98,1208,4.2 out of 5 stars,B0DFR8HZHN,https://www.amazon.co.uk/VapourVanish-Reusable-Dehumidifier-Bags-Dehumidifiers/dp/B0DFR8HZHN/ref=zg_bs_g_automotive_d_sccl_21/260-0569253-8374645?psc=1,2026-02-27,0,automotive,co.uk
1,22,Little Trees Air Freshener Tree MTR0004 Black Ice Fragrance For Car Home Boat Caravan - Single Pack,EUR 2.86,12302,4.4 out of 5 stars,B0006ZXU2Y,https://www.amazon.co.uk/Air-Freshener-LITTLE-Fragrance-MTR0004/dp/B0006ZXU2Y/ref=zg_bs_g_automotive_d_sccl_22/260-0569253-8374645?psc=1,2026-02-27,0,automotive,co.uk
1,23,"10 pcs Tyre Valve Caps, Universal Dust Cap - Black Stem Caps - Used On Car Tyres, Bikes, Bicycles, Motorbik",EUR 3.42,999,4.6 out of 5 stars,B0CSC26BRZ,https://www.amazon.co.uk/Plastic-Universal-commonly-Bicycles-Motorbikes/dp/B0CSC26BRZ/ref=zg_bs_g_automotive_d_sccl_23/260-0569253-8374645?psc=1,2026-02-27,0,automotive,co.uk
1,24,"Xtremeauto H7 Headlight Bulb - X2 H7 477 Car Headlight Bulb, 12V 55W Headlight Bulbs Light Bulbs, Dipped Headlamp Halogen Bulb PX26D Base Headlight Bulbs (Original)",EUR 7.99,1359,4.5 out of 5 stars,B0CM6QPM7D,https://www.amazon.co.uk/Xtremeauto-H7-Headlight-Bulb-Headlamp/dp/B0CM6QPM7D/ref=zg_bs_g_automotive_d_sccl_24/260-0569253-8374645?psc=1,2026-02-27,0,automotive,co.uk
1,25,"T-Cut Colour Fast 3-in-1 Paintwork Renovator, Black, 500ml",EUR 16.33,17641,4.2 out of 5 stars,B004E5BQAA,https://www.amazon.co.uk/T-Cut-CMW002-Colour-Cleaner-500ml/dp/B004E5BQAA/ref=zg_bs_g_automotive_d_sccl_25/260-0569253-8374645?psc=1,2026-02-27,0,automotive,co.uk
1,26,"STP Diesel Particulate Filter Cleaner 200 ml, Cleans and Protects Your Filter by Removing Soot in One Treatment, Restores Power and Acceleration, Mechanical Car Cleaning Products, Made in the UK",EUR 7.64,9812,4.5 out of 5 stars,B00H1SQRFQ,https://www.amazon.co.uk/STP-Diesel-Particulate-Filter-Cleaner/dp/B00H1SQRFQ/ref=zg_bs_g_automotive_d_sccl_26/260-0569253-8374645?psc=1,2026-02-27,0,automotive,co.uk
1,27,"ARVO 2 Pack Magnetic P Plates for Cars – Strong & Thick Learner Plates – No Melting, No Blow Off, Easy to Move Without Scratching Paint – 178mm x 178mm UK Road Legal Driver Signs",EUR 4.51,494,4.5 out of 5 stars,B0DF5MDC2X,https://www.amazon.co.uk/ARVO-Magnetic-Plates-Cars-Pack/dp/B0DF5MDC2X/ref=zg_bs_g_automotive_d_sccl_27/260-0569253-8374645?psc=1,2026-02-27,0,automotive,co.uk
1,28,"Tevlaphee Upgraded Steering Wheel Lock, Seat Belt Lock, Metal Head, High Visibility Car Lock Anti-Theft Device, Heavy Duty, Universal Fit for Car, SUV, Pickup, Jeep, Van, RV, 3Keys(Yellow)",EUR 45.69,7273,4.6 out of 5 stars,B0F7QJ1BMM,https://www.amazon.co.uk/Tevlaphee-Upgraded-Visibility-Anti-Theft-Universal/dp/B0F7QJ1BMM/ref=zg_bs_g_automotive_d_sccl_28/260-0569253-8374645?psc=1,2026-02-27,0,automotive,co.uk
1,29,"WD-40 Multi Use Lubricant Spray 250ml, Wide and Narrow Smart Straw, Multipurpose WD40 Spray Lubricant for DIY Maintenance, Water Displacement, and Protection on Gears, Threads, and Hinges",EUR 6.26,2128,4.8 out of 5 stars,B00KMRDDQE,https://www.amazon.co.uk/WD-40-44783-250ml-Smart-Straw/dp/B00KMRDDQE/ref=zg_bs_g_automotive_d_sccl_29/260-0569253-8374645?psc=1,2026-02-27,0,automotive,co.uk
1,30,"Autoglym Leather Cleaner, 500ml - Car Leather Cleaner Deep Cleans and Freshens Automotive Leather Upholstery",EUR 10.27,17262,4.6 out of 5 stars,B00114T7QC,https://www.amazon.co.uk/Autoglym-AG-215007-Leather-Cleaner/dp/B00114T7QC/ref=zg_bs_g_automotive_d_sccl_30/260-0569253-8374645?psc=1,2026-02-27,0,automotive,co.uk
1,31,"Bluecol AdBlue with Integrated Easy Pour Spout, 10L - High Purity Diesel Exhaust Fluid for SCR Equipped Vehicles, Reduces Emissions & Protects the Environment",EUR 17.13,124,4.5 out of 5 stars,B0FTMHG7N8,https://www.amazon.co.uk/Bluecol-AdBlue-Integrated-Easy-Spout/dp/B0FTMHG7N8/ref=zg_bs_g_automotive_d_sccl_31/260-0569253-8374645?psc=1,2026-02-27,0,automotive,co.uk
1,32,"Prestone Screenwash, Ready To Use Screen Wash For Cars - Winter, High Performance Cleaning With Streak Free Formula, Maximum Visibility Winter Windscreen Washer Fluid, Removes Stubborn Dirt, 5L Bottle",EUR 7.43,3023,4.6 out of 5 stars,B07QX13TXB,https://www.amazon.co.uk/Prestone-PSCW0029A-Screen-Visibility-Winter/dp/B07QX13TXB/ref=zg_bs_g_automotive_d_sccl_32/260-0569253-8374645?psc=1,2026-02-27,0,automotive,co.uk
1,33,"Air Wick Cherry Blossom & Raspberry Essential Mist Kit 20ml, Lasting for up to 45 days per refill, Air Freshener",EUR 9.14,14736,4.4 out of 5 stars,B0DP7HY9D9,https://www.amazon.co.uk/Blossom-Raspberry-Essential-Lasting-Freshener/dp/B0DP7HY9D9/ref=zg_bs_g_automotive_d_sccl_33/260-0569253-8374645?psc=1,2026-02-27,0,automotive,co.uk
1,34,"JOREST 168 Pcs Car Fuse Assorted Kit, 114 Mini Blade + 54 Standard+ 1Pullers – 11 Specifications Mixed Auto Fuse: 2Amp 3A 5A 7.5A 10A 15A 20A 25A 30A 35A 40A",EUR 9.13,45988,4.6 out of 5 stars,B093L93DRC,https://www.amazon.co.uk/JOREST-Assorted-Standard-Automotive-Pullers/dp/B093L93DRC/ref=zg_bs_g_automotive_d_sccl_34/260-0569253-8374645?psc=1,2026-02-27,0,automotive,co.uk
1,35,"Tyre Tread Depth Gauge, Preciva 0-25.4mm/Inch Digital Tire Checker UK, Tyres Surface Measuring Tool with Large LCD Screen for Cars, Trucks, Motos, Orange",EUR 7.99,8969,4.4 out of 5 stars,B0B3D5ZV3N,https://www.amazon.co.uk/Preciva-0-25-4mm-Digital-Checker-Measuring/dp/B0B3D5ZV3N/ref=zg_bs_g_automotive_d_sccl_35/260-0569253-8374645?psc=1,2026-02-27,0,automotive,co.uk
1,36,Castrol EDGE 5W-30 LL Engine Oil 4L,EUR 49.65,2273,4.8 out of 5 stars,B0C8166RD9,https://www.amazon.co.uk/Castrol-EDGE-5W-30-Engine-Oil/dp/B0C8166RD9/ref=zg_bs_g_automotive_d_sccl_36/260-0569253-8374645?psc=1,2026-02-27,0,automotive,co.uk
1,37,"WHonor Faraday Pouch for Car Keys, Keyless Entry Signal Blocker, Anti-Theft RFID Blocking Key Fob Protector for Car Security (2 Pack)",EUR 6.27,9133,4.5 out of 5 stars,B07R9ZHV97,https://www.amazon.co.uk/Upgraded-Blocker-Faraday-Blocking-Protector-Black/dp/B07R9ZHV97/ref=zg_bs_g_automotive_d_sccl_37/260-0569253-8374645?psc=1,2026-02-27,0,automotive,co.uk
1,38,"MOTOPOWER MP69033 OBD2 Scanner Universal Car Engine Fault Code Reader, CAN Diagnostic Scan Tool for All OBD II Protocol Cars",EUR 22.84,48033,4.3 out of 5 stars,B07Z3HB7DR,https://www.amazon.co.uk/MOTOPOWER-MP69033-Universal-Diagnostic-Protocol/dp/B07Z3HB7DR/ref=zg_bs_g_automotive_d_sccl_38/260-0569253-8374645?psc=1,2026-02-27,0,automotive,co.uk
1,39,"Tiger Tape® Number Plate Sticky Pads. Automotive Grade Heavy Duty, Extra Strong Double Sided Adhesive for Vehicle Number Plates, Licence Plates, Car Registration, Mounting Tape – 10 Strips",EUR 6.84,1960,4.4 out of 5 stars,B0CLM34WXT,https://www.amazon.co.uk/Tiger-Automotive-Adhesive-Stickers-Permanent/dp/B0CLM34WXT/ref=zg_bs_g_automotive_d_sccl_39/260-0569253-8374645?psc=1,2026-02-27,0,automotive,co.uk
1,40,"Holts Tyreweld Puncture Sealant 500ml, Emergency Tyre Repair Foam, Car Puncture Repair Kit Sealant To Get You Back On The Road, Quick & Easy Flat Tyre Foam, Drive Up To 100 Miles, No Tools Needed",EUR 17.13,10366,4.4 out of 5 stars,B0024WB4SY,https://www.amazon.co.uk/Holts-LOYHT4YA-Tyreweld-500ml/dp/B0024WB4SY/ref=zg_bs_g_automotive_d_sccl_40/260-0569253-8374645?psc=1,2026-02-27,0,automotive,co.uk
1,41,"T-Cut Perfect Paint Rapid Scratch Remover, 500ml – Removes Swirl Marks, Paint Transfer & Scratches | No Harmful Residues or Silicones | Suitable for All Paint Types",EUR 7.47,5211,4.3 out of 5 stars,B071X47XHW,https://www.amazon.co.uk/T-Cut-Rapid-Scratch-Remover-500ml/dp/B071X47XHW/ref=zg_bs_g_automotive_d_sccl_41/260-0569253-8374645?psc=1,2026-02-27,0,automotive,co.uk
1,42,"JOVS AdBlue 10 Liters with Spout – Diesel Exhaust Fluid Additive for SCR-Equipped Vehicles - Crystal Clean Diesel Treatment Fluid, ISO 22241 Compliant, Injected into Engine Exhaust Gases – DEF",EUR 15.94,237,4.5 out of 5 stars,B0BJ4GCHHM,https://www.amazon.co.uk/Jovs-AdBlue-Liters-Spout-SCR-Equipped/dp/B0BJ4GCHHM/ref=zg_bs_g_automotive_d_sccl_42/260-0569253-8374645?psc=1,2026-02-27,0,automotive,co.uk
1,43,"Prestone PAFR0035B Coolant Antifreeze for All Vehicles 10 year 300,000 miles Corrosion Protection, Ready to Use, 1 Litre",EUR 11.37,1603,4.7 out of 5 stars,B0CLS46ZW3,https://www.amazon.co.uk/Prestone-PAFR0035B-Antifreeze-Corrosion-Protection/dp/B0CLS46ZW3/ref=zg_bs_g_automotive_d_sccl_43/260-0569253-8374645?psc=1,2026-02-27,0,automotive,co.uk
1,44,SAVAGE Car Fragrances Inspired Car Air Freshener for Men Diffuser Scent Luxury Ornament Long Lasting (SAVAG INSPIRED) BEZQ,EUR 7.42,595,4.1 out of 5 stars,B0BYSXMF3F,https://www.amazon.co.uk/BEZQ-Fragrances-Inspired-Freshener-Diffuser/dp/B0BYSXMF3F/ref=zg_bs_g_automotive_d_sccl_44/260-0569253-8374645?psc=1,2026-02-27,0,automotive,co.uk
1,45,"Holts Brake Cleaner Spray, Clutch and Disc Brake Cleaner, Fast Acting Powerful Cleaning Action, Cleans & Degreases Any Surface, Paintwork Safe Car Brake Clean, 360° Spray Nozzle, 600ml",EUR 9.13,5185,4.7 out of 5 stars,B0025KOQYY,https://www.amazon.co.uk/Holts-1831697-Brake-Cleaner/dp/B0025KOQYY/ref=zg_bs_g_automotive_d_sccl_45/260-0569253-8374645?psc=1,2026-02-27,0,automotive,co.uk
1,46,"VANMASS 2026 BEST Car Phone Holder [Strongest & Stablest & Durablest]Military-Grade Suction Mobile Mount for Dashboard Windscreen Vent,Van Stand Cradle for iPhone 17 Pro Max 16 15 14 13 12 Samsung S25",EUR 24.76,50582,4.5 out of 5 stars,B08R5GZBS2,https://www.amazon.co.uk/Military-Grade-VANMASS-Universal-Windscreen-automobile/dp/B08R5GZBS2/ref=zg_bs_g_automotive_d_sccl_46/260-0569253-8374645?psc=1,2026-02-27,2K+,automotive,co.uk
2,51,"Autoglym Fast Glass, 500ml - Streak Free Car Cleaner for Windscreen, Windshield, Window Cleaning, Mirrors and More",EUR 9.01,12589,4.7 out of 5 stars,B0011569SK,https://www.amazon.co.uk/Autoglym-AG-185003-Glass-500ml/dp/B0011569SK/ref=zg_bs_g_automotive_d_sccl_1/260-0569253-8374645?psc=1,2026-02-27,0,automotive,co.uk
2,52,"DCS Microfibre Cleaning Cloth, Blue, Pack of 10, Large Size: 40x40cm. Super Soft Premium Streak Free Washable Cloth Duster for Kitchen, Bathrooms, Surfaces, Mirrors, Car, Motorbike",EUR 10.51,18422,4.6 out of 5 stars,B00M09VYAY,https://www.amazon.co.uk/Microfibre-Cleaning-Cleaning-Appliances-Industrial/dp/B00M09VYAY/ref=zg_bs_g_automotive_d_sccl_2/260-0569253-8374645?psc=1,2026-02-27,1K+,automotive,co.uk
2,53,"Autosol Metal Polish Paste for Home, Bike, Boat and Car Cleaning, Alloy Wheel Cleaner, Rust Remover for Metal, All-Purpose Metal Cleaner 75ml Tube",EUR 7.85,16318,4.6 out of 5 stars,B003XJ1ODM,https://www.amazon.co.uk/Autosol-Cleaning-Cleaner-Remover-All-Purpose/dp/B003XJ1ODM/ref=zg_bs_g_automotive_d_sccl_3/260-0569253-8374645?psc=1,2026-02-27,0,automotive,co.uk
2,54,"Rain-X 2-in-1 Glass Cleaner + Rain Repellent – Streak-Free Shine & Advanced Water Beading – Helps Protect Against Rain, Snow, Ice & Insects – Quick & Easy Spray Application – 500ml",EUR 12.55,11958,4.3 out of 5 stars,B002G27G98,https://www.amazon.co.uk/Rain-88199500-Repellent-Glass-Cleaner/dp/B002G27G98/ref=zg_bs_g_automotive_d_sccl_4/260-0569253-8374645?psc=1,2026-02-27,0,automotive,co.uk
2,55,"2 Pack Car Sponges,Jumbo Sponges For Car Cleaning,Anti Scratch Technology for Car Exterior & Window Washing- Perfect For Wheels, Windscreen & Bodywork (2 Yellow Jumbo Car Sponge)",EUR 6.83,1079,4.5 out of 5 stars,B0C9S3QFD5,https://www.amazon.co.uk/Sponges-Technology-Windscreen-Bodywork-Cleaning/dp/B0C9S3QFD5/ref=zg_bs_g_automotive_d_sccl_5/260-0569253-8374645?psc=1,2026-02-27,2K+,automotive,co.uk
2,56,"URAQT Tie Down Straps, 4 Pack Heavy Duty Tensioning Belts, 2M Adjustable Cargo Straps Ratchet Straps for Motorcycle, Cargo, Trucks, Trailer, Luggage, 250kg Loading Capacity, Quick Release (Black)",EUR 7.76,4595,4.4 out of 5 stars,B08RS6Z745,https://www.amazon.co.uk/URAQT-Adjustable-Tensioning-Motorcycle-Capacity/dp/B08RS6Z745/ref=zg_bs_g_automotive_d_sccl_6/260-0569253-8374645?psc=1,2026-02-27,1K+,automotive,co.uk
2,57,"Wonder Wheels Colour Active Super Wheel Cleaner, 600ml",EUR 9.12,3720,4.3 out of 5 stars,B071GY11Z4,https://www.amazon.co.uk/Wonder-Wheels-Colour-Active-Cleaner/dp/B071GY11Z4/ref=zg_bs_g_automotive_d_sccl_7/260-0569253-8374645?psc=1,2026-02-27,0,automotive,co.uk
2,58,"Autoglym Autofresh, 500ml - Citrus Scented Car Freshener Spray For Long Lasting Freshness On Car Carpets, Trim or Fabrics",EUR 11.19,9908,4.4 out of 5 stars,B001151Z0W,https://www.amazon.co.uk/Autoglym-AG-205008-Autofresh-500ml/dp/B001151Z0W/ref=zg_bs_g_automotive_d_sccl_8/260-0569253-8374645?psc=1,2026-02-27,0,automotive,co.uk
2,59,"Blukar Car Phone Holder, Adjustable Car Phone Mount Cradle 360° Rotation - 4 in 1 Super Stable for Car Dashboard/Windscreen/Air Vent, One Button Release for All 4.7 to 6.7 inch Smartphones",EUR 11.41,16390,4.4 out of 5 stars,B08JTVBNNN,https://www.amazon.co.uk/Blukar-Phone-Holder-Universal-Cradle/dp/B08JTVBNNN/ref=zg_bs_g_automotive_d_sccl_9/260-0569253-8374645?psc=1,2026-02-27,3K+,automotive,co.uk
2,60,"Stick Well Extra Strong 2 Pack L Plates Magnetic For Car, Extra Thick Learner Plates Magnetic, No Melting No Blow Off Easy To Move Without Scratching Painting Off",EUR 4.56,727,4.3 out of 5 stars,B0BK15XHC9,https://www.amazon.co.uk/Magnetic-L-Plates-magnetic-Scratching-Painting/dp/B0BK15XHC9/ref=zg_bs_g_automotive_d_sccl_10/260-0569253-8374645?psc=1,2026-02-27,2K+,automotive,co.uk
2,61,"KITBEST Rear View Mirror for Driving Test, Driving Instructor Mirror, Extra Second Interior Car Rearview Mirrors for Instructor Examiner Passenger Learner Driver & Test (200 x 62mm)",EUR 10.27,14498,4.4 out of 5 stars,B0BLH52S6T,https://www.amazon.co.uk/Instructor-Interior-Rearview-Examiner-Passenger/dp/B0BLH52S6T/ref=zg_bs_g_automotive_d_sccl_11/260-0569253-8374645?psc=1,2026-02-27,2K+,automotive,co.uk
2,62,"Samfolk Faraday Box and Pouch 2 Pack, Keyless Entry Car Key Safe Protector,Anti-Theft Signal Blocking Cages",EUR 22.84,16381,4.6 out of 5 stars,B08FX6Q4H3,https://www.amazon.co.uk/Samfolk-Faraday-Protector-Anti-Theft-Blocking/dp/B08FX6Q4H3/ref=zg_bs_g_automotive_d_sccl_12/260-0569253-8374645?psc=1,2026-02-27,2K+,automotive,co.uk
2,63,"CarPlan TPH005 5L Fuel Can, Unleaded Petrol (Green)",EUR 6.86,7463,4.3 out of 5 stars,B001CMYACE,https://www.amazon.co.uk/CarPlan-TPH005-Tetracan-Unleaded-5L/dp/B001CMYACE/ref=zg_bs_g_automotive_d_sccl_13/260-0569253-8374645?psc=1,2026-02-27,0,automotive,co.uk
2,64,"OSRAM ULTRA LIFE, P21/5W, Double Blister, (2 lamps)",EUR 3.70,2515,4.6 out of 5 stars,B0D842YXXH,https://www.amazon.co.uk/OSRAM-ULTRA-Double-Blister-lamps/dp/B0D842YXXH/ref=zg_bs_g_automotive_d_sccl_14/260-0569253-8374645?psc=1,2026-02-27,1K+,automotive,co.uk
2,65,"TOPDON CarPal A, OBD2 Scanner, All System Diagnosis, Wireless Bluetooth Diagnostic Tool, Vehicle Health Check, Smog Check, Repair Guide, Engine Inspection, Vehicle Performance Test",EUR 52.55,1941,4.5 out of 5 stars,B0DCZ6GFKR,https://www.amazon.co.uk/TOPDON-Diagnosis-Diagnostic-Inspection-Performance/dp/B0DCZ6GFKR/ref=zg_bs_g_automotive_d_sccl_15/260-0569253-8374645?psc=1,2026-02-27,2K+,automotive,co.uk
2,66,"Redex DPF Cleaner Diesel, DPF Diesel Particulate Filter Cleaner To Clear Soot Blockages Quickly & Avoid Costly Repairs, DPF Cleaner To Prevent Clogging & Reduce Emissions, 250ml",EUR 13.71,3699,4.4 out of 5 stars,B06XBX2R61,https://www.amazon.co.uk/Redex-Diesel-Particulate-Filter-Cleaner/dp/B06XBX2R61/ref=zg_bs_g_automotive_d_sccl_16/260-0569253-8374645?psc=1,2026-02-27,0,automotive,co.uk
2,67,"Prestone Screenwash Concentrate 2.5L, Screen Wash For Cars - Winter, High Performance Cleaning With Streak Free Formula, Extreme Performance Super Concentrated Screenwash, Reduce Plastic, 2.5 Litre",EUR 5.43,4465,4.6 out of 5 stars,B09TW9FWYV,https://www.amazon.co.uk/Prestone-PSCW0039A-Concentrate-Screenwash-protects/dp/B09TW9FWYV/ref=zg_bs_g_automotive_d_sccl_17/260-0569253-8374645?psc=1,2026-02-27,2K+,automotive,co.uk
2,68,Greed Car Air Freshener for Men | Aventos Perfume Inspired Car Fragrances | Strong Freshener with Odour Eliminator Technology | Automotive Air Freshener | GREED Scent by Perfa,EUR 14.84,5063,4.3 out of 5 stars,B0BZQC1VY6,https://www.amazon.co.uk/Freshener-Fragrances-Eliminator-Technology-Perfa/dp/B0BZQC1VY6/ref=zg_bs_g_automotive_d_sccl_18/260-0569253-8374645?psc=1,2026-02-27,0,automotive,co.uk
2,69,"Wynn's Extreme Diesel System Cleaner - Deep Cleaning Engine Treatment - Restores Fuel Economy & Reduces Emissions - Prevents Turbo, EGR Valve & DPF Issues - 325ml",EUR 11.99,3576,4.6 out of 5 stars,B00FZLCHT6,https://www.amazon.co.uk/Wynns-WY12264-Injector-Additive-Treatment/dp/B00FZLCHT6/ref=zg_bs_g_automotive_d_sccl_19/260-0569253-8374645?psc=1,2026-02-27,0,automotive,co.uk
2,70,"Autoglym Instant Tyre Dressing, 500ml - Easy To Use Tyre Spray for a Gloss or Matte Finish",EUR 16.27,11083,4.7 out of 5 stars,B001156BBA,https://www.amazon.co.uk/Autoglym-ITD500US-Instant-Dressing-500ml/dp/B001156BBA/ref=zg_bs_g_automotive_d_sccl_20/260-0569253-8374645?psc=1,2026-02-27,0,automotive,co.uk
2,71,Car Window Shades for Baby with Certified UV Protection - Optimal Darkness with Suction Cups in Universal Size 51 x 31 cm - Black Design - Pack of 2,EUR 11.41,9849,4.0 out of 5 stars,B07RJY9713,https://www.amazon.co.uk/Window-Shades-Baby-Certified-Protection/dp/B07RJY9713/ref=zg_bs_g_automotive_d_sccl_21/260-0569253-8374645?psc=1,2026-02-27,0,automotive,co.uk
2,72,"Bosch P21W (382) Longlife Daytime Halogen Headlight Bulbs, 12 V 21 W, Long-lasting - Socket Type BA15s - Pack of 2 Replacement Car Light Bulbs",EUR 3.38,9086,4.6 out of 5 stars,B003JY81S2,https://www.amazon.co.uk/Bosch-Longlife-Daytime-light-bulbs/dp/B003JY81S2/ref=zg_bs_g_automotive_d_sccl_22/260-0569253-8374645?psc=1,2026-02-27,1K+,automotive,co.uk
2,73,"Stoplock Pro Elite Car Steering Wheel Lock HG 150-00 - Safe Secure Heavy Duty Anti-Theft Bar - Universal Fit - Includes 2 Keys and Carry Bag, Black/Yellow, 1 Unit",EUR 54.83,16332,4.5 out of 5 stars,B06XP21DK6,https://www.amazon.co.uk/Stoplock-Pro-Elite-Steering-Anti-Theft/dp/B06XP21DK6/ref=zg_bs_g_automotive_d_sccl_23/260-0569253-8374645?psc=1,2026-02-27,1K+,automotive,co.uk
2,74,"Draper 140mm PVC Flexible Funnel | Gauze Filter | Handle for Efficient Refilling | Multifunctional Funnels | 56141, Black",EUR 4.58,7089,4.4 out of 5 stars,B0001K9WB2,https://www.amazon.co.uk/Draper-56141-Flexible-Funnel/dp/B0001K9WB2/ref=zg_bs_g_automotive_d_sccl_24/260-0569253-8374645?psc=1,2026-02-27,2K+,automotive,co.uk
