page,rank,title,price,reviews_count,rating,asin,url,rank_filled,category,market_place,bought_number_2
2,82,"Bohome Living - Chest and storage trunk in woven wicker, Deco Bohemian Chic (100 cm)",€129.90,82.0,4.4 out of 5 stars,B0BS13X4BC,https://www.amazon.fr/-/en/Bohome-Living-storage-wicker-Bohemian/dp/B0BS13X4BC/ref=zg_bs_g_handmade_d_sccl_82/520-1801314-7172713?psc=1,82,handmade,fr,0
2,83,House nest for bats 28x17x13 cm,€23.64,930.0,4.4 out of 5 stars,B07QKG5HWC,https://www.amazon.fr/-/en/House-nest-bats-28x17x13-cm/dp/B07QKG5HWC/ref=zg_bs_g_handmade_d_sccl_83/520-1801314-7172713?psc=1,83,handmade,fr,20+ bought
2,84,Genuine Leather Bookmark - Handmade - Personalised - Stylish Gift for Reading Lovers,€11.90,60.0,4.8 out of 5 stars,B0DKG8S126,https://www.amazon.fr/-/en/Genuine-Leather-Bookmark-Handmade-Personalised/dp/B0DKG8S126/ref=zg_bs_g_handmade_d_sccl_84/520-1801314-7172713?psc=1,84,handmade,fr,40+ bought
2,85,"Tote Bag Grandma Chérie Coeur – Gift Idea for Christmas, Birthday, Grandmother's Day – Natural Shopping Bag 100% Cotton",€14.90,50.0,4.7 out of 5 stars,B07N5LXR2Q,https://www.amazon.fr/-/en/Tote-Bag-Grandma-Ch%C3%A9rie-Coeur/dp/B07N5LXR2Q/ref=zg_bs_g_handmade_d_sccl_85/520-1801314-7172713?psc=1,85,handmade,fr,0
2,86,Scented Powder for Vacuum Cleaner and Ambient 90g Natural Handmade Sand Shop (Sakura Flower) Natural Air Freshener,€9.90,37.0,4.6 out of 5 stars,B0DYP3Q7H2,https://www.amazon.fr/-/en/Scented-Cleaner-Ambient-Handmade-Freshener/dp/B0DYP3Q7H2/ref=zg_bs_g_handmade_d_sccl_86/520-1801314-7172713?psc=1,86,handmade,fr,0
2,87,240 Pieces Candle Safety Stickers DIY Candle Making Labels AFNOR CLP Compliant White Self Adhesive Diameter 4.3cm,€8.90,16.0,4.4 out of 5 stars,B0F6NW9SPW,https://www.amazon.fr/-/en/Pieces-Stickers-Compliant-Adhesive-Diameter/dp/B0F6NW9SPW/ref=zg_bs_g_handmade_d_sccl_87/520-1801314-7172713?psc=1,87,handmade,fr,0
2,88,"Personalised Badge 5.5 cm with Text Photo Logo for Event, Party, Wedding, Birthday, Christening – French Crafts Colleen Illustrations",€5.90,21.0,4.9 out of 5 stars,B0DP3QW7TV,https://www.amazon.fr/-/en/Personalised-Badge-Wedding-Birthday-Christening/dp/B0DP3QW7TV/ref=zg_bs_g_handmade_d_sccl_88/520-1801314-7172713?psc=1,88,handmade,fr,30+ bought
2,89,Personalised Wooden Bottle Opener | Personalised Gift | Laser Engraving | for Home Kitchen Bar Birthday Gift (Your Text),€8.90,260.0,4.7 out of 5 stars,B0BHH61PQS,https://www.amazon.fr/-/en/Personalised-Wooden-Engraving-Kitchen-Birthday/dp/B0BHH61PQS/ref=zg_bs_g_handmade_d_sccl_89/520-1801314-7172713?psc=1,89,handmade,fr,0
2,90,Easycosy Personalised First Name Necklace – Christmas Gift Woman Mum Necklace with Engraved Birthstones 1-4 Name Necklace Heart Pendant Jewellery Gift Mum Daughter Grandma Girlfriend Birthday,€19.99,187.0,4.4 out of 5 stars,B0F59BD1FB,https://www.amazon.fr/-/en/Easycosy-Personalised-Birthstones-Jewellery-Personalized/dp/B0F59BD1FB/ref=zg_bs_g_handmade_d_sccl_90/520-1801314-7172713?psc=1,90,handmade,fr,0
2,91,"Personalised Embroidered Apron, 100% Cotton, Men/Women, Embroidery Choice - Ideal for Mother's / Father's Day, Gifts, Cooking, Gardening, Restaurant",€22.99,50.0,4.6 out of 5 stars,B0D6J42PQY,https://www.amazon.fr/-/en/Personalised-Embroidered-Cotton-Embroidery-Choice/dp/B0D6J42PQY/ref=zg_bs_g_handmade_d_sccl_91/520-1801314-7172713?psc=1,91,handmade,fr,0
2,92,"Personalised Large Baby Bib - Add Your Message | Original Personalised Gift for Birth, Birthday, Baby Shower",€10.40,236.0,4.6 out of 5 stars,B08W2C9LPL,https://www.amazon.fr/-/en/Personalised-Large-Baby-Bib-Original/dp/B08W2C9LPL/ref=zg_bs_g_handmade_d_sccl_92/520-1801314-7172713?psc=1,92,handmade,fr,40+ bought
2,93,1 x Green Stop Pub Sticker 9 x 2 cm No Advertising No Advertising Ecology Mailboxes,€2.19,178.0,4.6 out of 5 stars,B07JVJ1DBG,https://www.amazon.fr/-/en/Green-Sticker-Advertising-Ecology-Mailboxes/dp/B07JVJ1DBG/ref=zg_bs_g_handmade_d_sccl_93/520-1801314-7172713?psc=1,93,handmade,fr,0
2,94,no title,€13.99,,,B0GKGXK5TL,https://www.amazon.fr/-/en/Personalised-Dummy-Clip-Girl-Boy/dp/B0GKGXK5TL/ref=zg_bs_g_handmade_d_sccl_94/520-1801314-7172713?psc=1,94,handmade,fr,0
2,95,Natural Stone Bracelet Women Men Blue Green Defense Confidence and Balance Tiger Eye Bead 8mm Superior Quality Handmade Jewellery Strong and Durable Grandmother's Day Gift,€14.99,456.0,4.4 out of 5 stars,B0C4LZ12LX,https://www.amazon.fr/-/en/Bracelet-Confidence-Superior-Jewellery-Grandmothers/dp/B0C4LZ12LX/ref=zg_bs_g_handmade_d_sccl_95/520-1801314-7172713?psc=1,95,handmade,fr,0
2,96,COLLEEN ILLUSTRATIONS Magnet 56 mm Great Grandmother of Love,€5.90,61.0,4.8 out of 5 stars,B07JW4SPBX,https://www.amazon.fr/-/en/COLLEEN-ILLUSTRATIONS-Magnet-Great-Grandmother/dp/B07JW4SPBX/ref=zg_bs_g_handmade_d_sccl_96/520-1801314-7172713?psc=1,96,handmade,fr,0
