page,rank,title,price,reviews_count,rating,asin,url,date,bought_number,category,market_place
1,1,"Magnesium Glycinate 3-in-1 Complex - 1800mg Supplements as Bisglycinate, Citrate & Malate 90 Vegan Capsules, Triple High Absorption 384mg Elemental, UK Made",EUR 11.41,28859,4.4 out of 5 stars,B0C9VVCL12,https://www.amazon.co.uk/Magnesium-Glycinate-Complex-Supplements-Bisglycinate/dp/B0C9VVCL12/ref=zg_bs_g_drugstore_d_sccl_1/523-8125264-5194111?psc=1,2026-02-27,0,drugstore,co.uk
1,2,"HIGH5 ZERO Electrolyte Tablet - Hydration Tablets Enhanced with Vitamin C - 0 Calories & Sugar Free - Boost Hydration, Performance & Wellness - Berry, 20 Tablets",EUR 6.86,33508,4.5 out of 5 stars,B003AIF4Q4,https://www.amazon.co.uk/HIGH5-ZERO-Electrolyte-Tablet-Performance/dp/B003AIF4Q4/ref=zg_bs_g_drugstore_d_sccl_2/523-8125264-5194111?psc=1,2026-02-27,0,drugstore,co.uk
1,3,"TePe Interdental Brush, Original, Pink, 0.4mm/ISO 0, 8pcs, Plaque Removal, efficient Clean Between Teeth, Tooth Floss, for Narrow Gaps",EUR 4.00,58660,4.6 out of 5 stars,B015D4MRZI,https://www.amazon.co.uk/TePe-Pink-Original-Interdental-Brush/dp/B015D4MRZI/ref=zg_bs_g_drugstore_d_sccl_3/523-8125264-5194111?psc=1,2026-02-27,10K+,drugstore,co.uk
1,4,"Grenade OREO White High Protein, Low Sugar Bars, 12 x 60 g – 21 g Protein per Snack Bar with Crunchy OREO Pieces & White Chocolate Coating",EUR 28.56,36026,4.4 out of 5 stars,B0CGDWCLGY,https://www.amazon.co.uk/Grenade-High-Protein-Low-Sugar/dp/B0CGDWCLGY/ref=zg_bs_g_drugstore_d_sccl_4/523-8125264-5194111?psc=1,2026-02-27,0,drugstore,co.uk
1,5,Turmeric Tablets 2000mg with Black Pepper & Ginger - 120 High Strength Curcumin Supplements - Easy Swallow Tablets (Not Turmeric Capsules or Powder) - Vegan - UK Made,EUR 7.99,14702,4.6 out of 5 stars,B088W5HWVX,https://www.amazon.co.uk/Turmeric-Strength-Curcumin-Supplements-Supplement/dp/B088W5HWVX/ref=zg_bs_g_drugstore_d_sccl_5/523-8125264-5194111?psc=1,2026-02-27,0,drugstore,co.uk
1,6,"Pure Creatine Monohydrate Powder - 315g (90 Servings) - Easy Dissolve Creatine Powder, Unflavoured & Micronised (Not Creatine Gummies or Creatine Tablets), Vegan Creatine for Women and Men",EUR 11.41,3560,4.5 out of 5 stars,B0DQQDZGCW,https://www.amazon.co.uk/Pure-Creatine-Monohydrate-Powder-Unflavoured/dp/B0DQQDZGCW/ref=zg_bs_g_drugstore_d_sccl_6/523-8125264-5194111?psc=1,2026-02-27,0,drugstore,co.uk
1,7,"TePe EasyPick Toothpicks, Orange, ISO XS-S, 60pcs, Dental Plaque Removal Tool, efficient and Easy Cleaning Between The Teeth, toothpicks for Narrow Gaps",EUR 8.56,33799,4.6 out of 5 stars,B08DG29232,https://www.amazon.co.uk/TePe-EasyPick-Toothpicks-efficient-toothpicks/dp/B08DG29232/ref=zg_bs_g_drugstore_d_sccl_7/523-8125264-5194111?psc=1,2026-02-27,0,drugstore,co.uk
1,8,"Vitamin D3 4000 iu & Vitamin K2 MK7 100μg - 1 Year Supply, 365 Easy-Swallow Vitamin D3 K2 Tablets, 1-A-Day High Strength Vegetarian D3 and K2 Vitamin Supplements, UK Made Vitamin D Tablets",EUR 11.41,15114,4.6 out of 5 stars,B0CR57HRDV,https://www.amazon.co.uk/Vitamin-4000-MK7-100%CE%BCg-Day/dp/B0CR57HRDV/ref=zg_bs_g_drugstore_d_sccl_8/523-8125264-5194111?psc=1,2026-02-27,0,drugstore,co.uk
1,9,"Omega 3 Fish Oil 2000mg, EPA 660mg DHA 440mg per Daily Serving. 120 Capsules (2 Months Supply). Supports Heart, Brain Function and Eye Health. 2 Capsules Per Serving",EUR 11.41,19705,4.6 out of 5 stars,B07649WV5Y,https://www.amazon.co.uk/Omega-2000mg-Capsules-Strength-Serving/dp/B07649WV5Y/ref=zg_bs_g_drugstore_d_sccl_9/523-8125264-5194111?psc=1,2026-02-27,0,drugstore,co.uk
1,10,"Science in Sport Hydro Electrolyte Tablets 20 pcs. Berry – Vegan & Gluten-Free, Ideal to Promote Hydration and Maintain Electrolytes Balance (Packaging May Vary)",EUR 5.71,21399,4.5 out of 5 stars,B008AGN01C,https://www.amazon.co.uk/Science-Sport-Hydro-Hydration-Tablets/dp/B008AGN01C/ref=zg_bs_g_drugstore_d_sccl_10/523-8125264-5194111?psc=1,2026-02-27,0,drugstore,co.uk
1,11,"Sudafed Blocked Nose Spray (1 x 15ml), Relief from Congestion Caused by Cold and Allergies, Nasal Spray Provides Congestion Relief, Lasts Up to 10 Hours and Gets to Work in 2 Minutes",EUR 4.57,17272,4.7 out of 5 stars,B004RDYI04,https://www.amazon.co.uk/Sudafed-15ml-Blocked-Nose-Spray/dp/B004RDYI04/ref=zg_bs_g_drugstore_d_sccl_11/523-8125264-5194111?psc=1,2026-02-27,0,drugstore,co.uk
1,12,"Biotin Hair Growth Supplement - 180 Vegan Tablets Enhanced with Zinc & Selenium, Hair Vitamins Complex - Biotin 10000 mcg - Hair Skin and Nails Vitamins for Women & Men UK (Packaging Design May Vary)",EUR 7.99,10969,4.4 out of 5 stars,B08XBGJMK3,https://www.amazon.co.uk/Biotin-Hair-Growth-Supplement-Enhanced/dp/B08XBGJMK3/ref=zg_bs_g_drugstore_d_sccl_12/523-8125264-5194111?psc=1,2026-02-27,0,drugstore,co.uk
1,13,"Bulk Pure Whey Protein Powder,Vanilla,23g Protein and 5g BCAAs per Scoop,Whey Concentrate Shake,Low Sugar,Supports Muscle Growth and Repair,Smooth Mixing,Vegetarian,1kg",EUR 35.42,28105,4.4 out of 5 stars,B00HF63AYA,https://www.amazon.co.uk/BULK-POWDERS-Protein-Powder-Vanilla/dp/B00HF63AYA/ref=zg_bs_g_drugstore_d_sccl_13/523-8125264-5194111?psc=1,2026-02-27,0,drugstore,co.uk
1,14,"Oral-B Vitality Pro Electric Toothbrushes for Adults, for Him/Her, 1 Handle, 2 Toothbrush Heads, 3 Brushing Modes Including Sensitive Plus, 2 Pin UK Plug, Black",EUR 23.64,21349,4.2 out of 5 stars,B0B18V92KS,https://www.amazon.co.uk/Oral-B-Vitality-Toothbrush-Including-Sensitive/dp/B0B18V92KS/ref=zg_bs_g_drugstore_d_sccl_14/523-8125264-5194111?psc=1,2026-02-27,10K+,drugstore,co.uk
1,15,"Optimum Nutrition, Gold Standard 100% Whey Protein Powder, Double Rich Chocolate, 899g, 29 Servings",EUR 51.40,127554,4.6 out of 5 stars,B002DYIZH6,https://www.amazon.co.uk/Optimum-Nutrition-Standard-Protein-Glutamine/dp/B002DYIZH6/ref=zg_bs_g_drugstore_d_sccl_15/523-8125264-5194111?psc=1,2026-02-27,0,drugstore,co.uk
1,16,"Ashwagandha KSM 66 Complex – 3000mg Enhanced with L-Tryptophan & Vitamin B6 (2 Month Supply) – Ashwagandha High Strength Capsules with 250mg Extract (Not Gummies or Powder) - Vegan, UK Made",EUR 10.27,5953,4.4 out of 5 stars,B0C111HFF4,https://www.amazon.co.uk/Ashwagandha-KSM-66-Complex-Enhanced/dp/B0C111HFF4/ref=zg_bs_g_drugstore_d_sccl_16/523-8125264-5194111?psc=1,2026-02-27,0,drugstore,co.uk
1,17,Hycosan Extra - Eye Drops with Hyaluronic Acid for Soothing Relief of Severe and Persistent Dry Eyes - Contact Lens Compatible - Preservative Free (7.5 ml (Pack of 1)),EUR 13.69,10159,4.7 out of 5 stars,B07PHZCQYB,https://www.amazon.co.uk/Hycosan-Eye-Drops-Dry/dp/B07PHZCQYB/ref=zg_bs_g_drugstore_d_sccl_17/523-8125264-5194111?psc=1,2026-02-27,0,drugstore,co.uk
1,18,"SlimFast Ready To Drink Cafe Latte Shake, 6 x 325ml",EUR 14.84,14037,4.5 out of 5 stars,B010PM6XQW,https://www.amazon.co.uk/SlimFast-Balanced-Vitamins-Multipack-Packaging/dp/B010PM6XQW/ref=zg_bs_g_drugstore_d_sccl_18/523-8125264-5194111?psc=1,2026-02-27,0,drugstore,co.uk
1,19,"Dulcolax Adult - Constipation Relief Laxative 5mg Bisacodyl Gastro Resistant Tablets Tablets, 20 Count",EUR 4.56,15053,4.5 out of 5 stars,B08K4JPSKK,https://www.amazon.co.uk/Dulcolax-Constipation-Laxative-Bisacodyl-Resistant/dp/B08K4JPSKK/ref=zg_bs_g_drugstore_d_sccl_19/523-8125264-5194111?psc=1,2026-02-27,0,drugstore,co.uk
1,20,"Iron Tablets High Strength - Energy Tablets with Vitamin C, B12 & Folic Acid - 120 Vegan Iron Supplements for Women and Men - 14mg - Enhanced Energy Support & Increased Absorption - UK Made",EUR 7.99,7765,4.5 out of 5 stars,B09C8NP57H,https://www.amazon.co.uk/Iron-Tablets-High-Strength-Supplements/dp/B09C8NP57H/ref=zg_bs_g_drugstore_d_sccl_20/523-8125264-5194111?psc=1,2026-02-27,0,drugstore,co.uk
1,21,"Warrior Creatine Monohydrate Powder 300g (100 Servings) – Pure Micronised Creatine Powder Supplement for Men & Women, Pre & Post Workout Strength, Muscle Growth & Recovery, Vegan – Unflavoured",EUR 10.27,11967,4.4 out of 5 stars,B01F94TFZW,https://www.amazon.co.uk/Warrior-Supplements-Essentials-Creatine-Powder/dp/B01F94TFZW/ref=zg_bs_g_drugstore_d_sccl_21/523-8125264-5194111?psc=1,2026-02-27,0,drugstore,co.uk
1,22,"Phizz Electrolytes, Multivitamin & Hydration Tablets - 20 Effervescent Rehydration Electrolyte Tablets - 18 Vitamins & Minerals, Vitamin C, Vegan, Vegetarian & Low Calorie (Orange, 20 Count)",EUR 6.28,6679,4.3 out of 5 stars,B0176V7V3E,https://www.amazon.co.uk/Phizz-Hydration-Vitamins-Minerals-Tablets/dp/B0176V7V3E/ref=zg_bs_g_drugstore_d_sccl_22/523-8125264-5194111?psc=1,2026-02-27,0,drugstore,co.uk
1,23,"Collagen Powder, Gold Standard Bovine Collagen Peptides Powder by Wellgard - High Levels of The 8 Essential Amino Acids, Collagen Supplements, Halal & Kosher, Made in UK",EUR 22.83,20250,4.5 out of 5 stars,B07Q6YSGF9,https://www.amazon.co.uk/Collagen-Powder-Standard-Peptides-Wellgard/dp/B07Q6YSGF9/ref=zg_bs_g_drugstore_d_sccl_23/523-8125264-5194111?psc=1,2026-02-27,0,drugstore,co.uk
1,24,"Oral-B iO2 Electric Toothbrush for Adults, Night Black, Long-Lasting Battery for Travel, Includes Gentle Care Brush Head, Travel Case and Refill Holder, Easy Switch to Electric Brushing, 2 Pin Plug",EUR 36.20,94496,4.6 out of 5 stars,B0DNG35BVM,https://www.amazon.co.uk/Oral-B-Electric-Toothbrush-Gentle-Designed/dp/B0DNG35BVM/ref=zg_bs_g_drugstore_d_sccl_24/523-8125264-5194111?psc=1,2026-02-27,0,drugstore,co.uk
1,25,"Calpol Sugar-Free Infant Suspension Paracetamol (1 x 100ml), Strawberry Flavour CalpolInfant with Paracetamol for Fever & Pain Relief, Suitable for 2+ Months Babies & Kids",EUR 3.28,13130,4.9 out of 5 stars,B0018TQ1WS,https://www.amazon.co.uk/Calpol-Infant-Suspension-Sugar-Free-120Mg/dp/B0018TQ1WS/ref=zg_bs_g_drugstore_d_sccl_25/523-8125264-5194111?psc=1,2026-02-27,0,drugstore,co.uk
1,26,"Oral-B Pro Cross Action Electric Toothbrush Head, Electric Toothbrush Heads, X-Shape and Angled Bristles for Deeper Plaque Removal, Pack of 4 Toothbrush Heads, Black, Replacement Heads",EUR 9.11,55886,4.7 out of 5 stars,B0C1H4M1YD,https://www.amazon.co.uk/Oral-B-Electric-Toothbrush-X-Shape-Bristles/dp/B0C1H4M1YD/ref=zg_bs_g_drugstore_d_sccl_26/523-8125264-5194111?psc=1,2026-02-27,0,drugstore,co.uk
1,27,"Retainer Fresh Retainer Cleaner Tablets - Retainer Cleaning, Mouthguard Cleaner, Denture Cleaning, Aligner Cleaner, Brite Retainer Tablets - 120 Tablets 4 Month",EUR 15.98,12283,4.6 out of 5 stars,B07QCPGR14,https://www.amazon.co.uk/Retainer-Denture-Mouthguard-Cleaning-Tablets/dp/B07QCPGR14/ref=zg_bs_g_drugstore_d_sccl_27/523-8125264-5194111?psc=1,2026-02-27,0,drugstore,co.uk
1,28,"Oral-B Pro Cross Action Electric Toothbrush Head, X-Shape and Angled Bristles for Deeper Plaque Removal, Pack of 4",EUR 9.51,6341,4.7 out of 5 stars,B0C1H5XK7D,https://www.amazon.co.uk/Oral-B-Electric-Toothbrush-X-Shape-Bristles/dp/B0C1H5XK7D/ref=zg_bs_g_drugstore_d_sccl_28/523-8125264-5194111?psc=1,2026-02-27,0,drugstore,co.uk
1,29,"Colgate Fluorigard Fluoride Rinse (Alcohol Free) Mouthwash 400 ml, Prevents Tooth Decay, Strengthens Enamel, Prevents Mineral Loss, Mint Flavour",EUR 9.14,10376,4.6 out of 5 stars,B009FAL6OK,https://www.amazon.co.uk/Fluorigard-Fluoride-Mouthwash-Prevents-Strengthens/dp/B009FAL6OK/ref=zg_bs_g_drugstore_d_sccl_29/523-8125264-5194111?psc=1,2026-02-27,0,drugstore,co.uk
1,30,"Optimum Nutrition Micronised Creatine Powder, Unflavoured, 634g, 186 Servings",EUR 39.77,31840,4.6 out of 5 stars,B00T7L20EC,https://www.amazon.co.uk/Optimum-Nutrition-Micronised-Monohydrate-Development/dp/B00T7L20EC/ref=zg_bs_g_drugstore_d_sccl_30/523-8125264-5194111?psc=1,2026-02-27,0,drugstore,co.uk
1,31,"Colgate Maximum Cavity Protection Toothpaste 75ml, with Calcium Boost, Strengthens and Protects Enamel, Protects Against Cavities, Fluoride Toothpaste, Great Regular Flavour",EUR 1.36,2629,4.6 out of 5 stars,B013QW8DZ2,https://www.amazon.co.uk/Colgate-Cavity-Protection-Toothpaste-75/dp/B013QW8DZ2/ref=zg_bs_g_drugstore_d_sccl_31/523-8125264-5194111?psc=1,2026-02-27,0,drugstore,co.uk
1,32,"Zipvit Magnesium Glycinate 2000mg with 400mg Elemental, Plus Vitamin B6, 120 Vegan Tablets, High Strength Magnesium Supplements",EUR 9.70,16364,4.5 out of 5 stars,B0CCSPDBWC,https://www.amazon.co.uk/Magnesium-Glycinate-Strength-Bisglycinate-Supplement/dp/B0CCSPDBWC/ref=zg_bs_g_drugstore_d_sccl_32/523-8125264-5194111?psc=1,2026-02-27,0,drugstore,co.uk
1,33,"Nikura French Lavender Essential Oil - 10ml | 100% Pure Natural Oils | Lavender Oil For Sleep, Aromatherapy, Diffusers for Home | Vegan & UK Made",EUR 9.12,41941,4.6 out of 5 stars,B07G2PVFXH,https://www.amazon.co.uk/100-French-Lavender-Essential-100ml/dp/B07G2PVFXH/ref=zg_bs_g_drugstore_d_sccl_33/523-8125264-5194111?psc=1,2026-02-27,0,drugstore,co.uk
1,34,"Bulk Creatine Monohydrate Powder 500g | Micronised Creatine Supplement for Strength, Power & Performance | Unflavoured Vegan, Easy to Dissolve | Performance Boosting Supplement for Men & Women",EUR 14.84,11251,4.5 out of 5 stars,B00SP2ZKW8,https://www.amazon.co.uk/BULK-POWDERS-Creatine-Monohydrate-Unflavoured/dp/B00SP2ZKW8/ref=zg_bs_g_drugstore_d_sccl_34/523-8125264-5194111?psc=1,2026-02-27,0,drugstore,co.uk
1,35,"Allevia Hayfever Allergy Tablets, Prescription Strength 120 mg Fexofenadine, 24hr Relief Acts Within 1 Hour, Including Sneezing, Watery Eyes, Itchy and Runny Nose, 30 Tablets",EUR 9.01,12224,4.5 out of 5 stars,B09QQRZ4M5,https://www.amazon.co.uk/Allevia-120-Tablets-Fexofenadine-Prescription/dp/B09QQRZ4M5/ref=zg_bs_g_drugstore_d_sccl_35/523-8125264-5194111?psc=1,2026-02-27,0,drugstore,co.uk
1,36,"Myprotein Impact Creatine Monohydrate Powder | 250 g | Micronised Creatine for Strength, Power & Muscle Growth | 3 g Per Serving | Supports High-Intensity Training & Recovery | Unflavoured",EUR 18.27,3706,4.6 out of 5 stars,B00HN8LE7A,https://www.amazon.co.uk/MY-PROTEIN-Creatine-Monohydrate-250/dp/B00HN8LE7A/ref=zg_bs_g_drugstore_d_sccl_36/523-8125264-5194111?psc=1,2026-02-27,0,drugstore,co.uk
1,37,"Lions Mane Supplement 4000mg with Vitamin B1 & Black Pepper, 180 Vegan Tablets - Lion's Mane Mushroom 15:1 Extract (Not Lions Mane Powder or Capsules), UK Made for Mental Performance & Nervous System",EUR 11.41,5471,4.4 out of 5 stars,B0C9TWKQQV,https://www.amazon.co.uk/Supplement-4000mg-Vitamin-Pepper-Tablets/dp/B0C9TWKQQV/ref=zg_bs_g_drugstore_d_sccl_37/523-8125264-5194111?psc=1,2026-02-27,0,drugstore,co.uk
1,38,Canesten Athlete’s Foot 1% w/w Cream | Effective Athlete’s Foot Treatment | Soothes Itching | Destroys Athlete’s Foot Fungi | Antifungal Cream | Big pack |30 g (Pack of 1),EUR 8.55,24302,4.5 out of 5 stars,B00DCPHVMU,https://www.amazon.co.uk/Canesten-Clotrimazole-Antifungal-Antibacterial-Treatment/dp/B00DCPHVMU/ref=zg_bs_g_drugstore_d_sccl_38/523-8125264-5194111?psc=1,2026-02-27,0,drugstore,co.uk
1,39,Kids Magnesium Gummies - 546 Mg Magnesium Citrate Providing 60 mg of Magnesium - Alternative to Magnesium Glycinate – 30 Gummies - 1 Month Supply Magnesium Supplements - Vegan - Gluten Free - Novomins,EUR 11.41,3491,4.4 out of 5 stars,B09ZZM9YWF,https://www.amazon.co.uk/Kids-Magnesium-Gummies-Supplements-Magnesium/dp/B09ZZM9YWF/ref=zg_bs_g_drugstore_d_sccl_39/523-8125264-5194111?psc=1,2026-02-27,0,drugstore,co.uk
1,40,"RENPHO Weighing Scales for Body Weight, Bathroom Scales with High Precision Sensors, Accurate Digital Weight Scale for People, LED Display, Step-On, Black, Core 1S (Stone/Kgs/Lbs)",EUR 11.41,107635,4.4 out of 5 stars,B07S9PTLNZ,https://www.amazon.co.uk/RENPHO-Bathroom-Weighing-Precision-Technology/dp/B07S9PTLNZ/ref=zg_bs_g_drugstore_d_sccl_40/523-8125264-5194111?psc=1,2026-02-27,10K+,drugstore,co.uk
1,41,Magnesium Glycinate Supplements 1500mg & Vitamin B6-120 High Strength Capsules - 1500mg of Magnesium Providing 315mg Elemental Magnesium (Bisglycinate) - Pure Active Ingredient,EUR 9.70,5988,4.4 out of 5 stars,B0BR5X8FDF,https://www.amazon.co.uk/Magnesium-Glycinate-Supplements-Ingredient-Manufactured/dp/B0BR5X8FDF/ref=zg_bs_g_drugstore_d_sccl_41/523-8125264-5194111?psc=1,2026-02-27,0,drugstore,co.uk
1,42,"Warrior Protein Shaker Bottle, 600ml with Wire Mixball Blender – Leakproof Clear Gym Bottle for Mixing Whey Protein Shake, Smoothies, Milkshake, Juice, Supplement Drinks – BPA Free, Dishwasher Safe",EUR 3.76,19748,4.5 out of 5 stars,B00C4UQOB8,https://www.amazon.co.uk/Warrior-Supplements-Capacity-Blender-Shaker/dp/B00C4UQOB8/ref=zg_bs_g_drugstore_d_sccl_42/523-8125264-5194111?psc=1,2026-02-27,0,drugstore,co.uk
1,43,"BetterYou Vitamin D3 K2 Oral Spray, Fast Acting Vitamin D 3000 IU + Vitamin K2 (MK7) Supplement, Supports Bones, Teeth, Immune System & Blood Clotting, 1-Month Supply, Natural Peppermint Flavour",EUR 13.61,5814,4.6 out of 5 stars,B007DIJJ0O,https://www.amazon.co.uk/BetterYou-D3000-Vitamin-Spray-12ml/dp/B007DIJJ0O/ref=zg_bs_g_drugstore_d_sccl_43/523-8125264-5194111?psc=1,2026-02-27,0,drugstore,co.uk
1,44,"Calpol Vapour Plug Refills XL 10 Count (Pack of 1), Lavender & Chamomile, Helps with Clear and Easy Breathing, Vapour Plug In & Nightlight Refill Pads for Soothing 8 Hour Night-Time, 3+ Months",EUR 10.80,10707,4.8 out of 5 stars,B08P1SBNLW,https://www.amazon.co.uk/Calpol-Chamomile-Breathing-Nightlight-Night-Time/dp/B08P1SBNLW/ref=zg_bs_g_drugstore_d_sccl_44/523-8125264-5194111?psc=1,2026-02-27,0,drugstore,co.uk
1,45,"Kids Night-Time Gummies - 30 Gummies - Magnesium, L-Theanine, Vitamin B Complex - Vegan & Gluten-Free - Suitable for Ages 3+ - Novomins",EUR 9.70,1673,4.1 out of 5 stars,B0CKY3KF4K,https://www.amazon.co.uk/Novomins-Night-Time-Raspberry-Flavoured-Gummies/dp/B0CKY3KF4K/ref=zg_bs_g_drugstore_d_sccl_45/523-8125264-5194111?psc=1,2026-02-27,0,drugstore,co.uk
1,46,"Natures Aid Cod Liver Oil 1000mg Softgels – High Strength Omega-3 Fish Oil with Vitamins A & D – Supports Immune System, Heart Health, Brain, Vision, Joints – Non-GMO – 180 Capsules",EUR 17.13,13275,4.7 out of 5 stars,B002F5EO6E,https://www.amazon.co.uk/Natures-Aid-Capsules-Strength-Vitamins/dp/B002F5EO6E/ref=zg_bs_g_drugstore_d_sccl_46/523-8125264-5194111?psc=1,2026-02-27,0,drugstore,co.uk
2,51,Myprotein Impact Whey Protein Powder | 22g Premium Protein Per Serving | Builds Lean Muscle & Aids Recovery | Vanilla 1KG | Vegetarian Low Fat & Carbs | Trusted by Athletes,EUR 37.71,37798,4.3 out of 5 stars,B008BH7KKM,https://www.amazon.co.uk/Myprotein-Impact-Whey-Protein-Vanilla/dp/B008BH7KKM/ref=zg_bs_g_drugstore_d_sccl_1/523-8125264-5194111?psc=1,2026-02-27,0,drugstore,co.uk
2,52,Colgate Extra Clean Medium Manual Toothbrush (Assorted) with a Cleaning Tip That Reaches and Cleans Back Teeth (Pack of 3),EUR 1.54,14594,4.6 out of 5 stars,B003Q13R28,https://www.amazon.co.uk/Colgate-Palmolive-Toothbrush-medium-sorted/dp/B003Q13R28/ref=zg_bs_g_drugstore_d_sccl_2/523-8125264-5194111?psc=1,2026-02-27,8K+,drugstore,co.uk
2,53,Beconase 8 in 1 Hayfever Relief Nasal Spray (100 Spray Bottle) - Long Lasting Effective Relief from Hayfever - Portable and Lasts Up to 24 Hours When Used Twice a Day - Non Drowsy,EUR 6.84,18024,4.7 out of 5 stars,B00KGURUS4,https://www.amazon.co.uk/Beconase-Hayfever-Relief-Nasal-Sprays/dp/B00KGURUS4/ref=zg_bs_g_drugstore_d_sccl_3/523-8125264-5194111?psc=1,2026-02-27,0,drugstore,co.uk
2,54,OxiPro BP1 Blood Pressure Monitors - Health & Pharma Award Winner 2025 - Blood Pressure Machine - BP Monitor for Home - Small to Large Cuff Blood Pressure Monitor,EUR 28.55,8298,4.6 out of 5 stars,B0BDJFDX1P,https://www.amazon.co.uk/OxiPro-BP1-Supplied-Sphygmomanometer-Certified/dp/B0BDJFDX1P/ref=zg_bs_g_drugstore_d_sccl_4/523-8125264-5194111?psc=1,2026-02-27,0,drugstore,co.uk
2,55,Vitamin B12 Tablets High Strength - 1 Year Supply (365 Tablets) - 1000mcg Dual Power B12 Vitamin Complex with Methylcobalamin & Adenosylcobalamin - Vegan Supplement - (Packaging Design May Vary),EUR 10.27,6219,4.6 out of 5 stars,B0BSG2NVP5,https://www.amazon.co.uk/Vegan-Vitamin-Supplement-Tablets-Strength/dp/B0BSG2NVP5/ref=zg_bs_g_drugstore_d_sccl_5/523-8125264-5194111?psc=1,2026-02-27,0,drugstore,co.uk
2,56,"Femfresh Daily Intimate Wash, Feminine Hygiene Shower & Bath Gel Cleanser, pH Balanced, Soap Free Feminine Wash with Aloe Vera & Calendula, Hypoallergenic, 250ml",EUR 2.57,14262,4.8 out of 5 stars,B004ZWNKFQ,https://www.amazon.co.uk/Femfresh-pH-Balanced-Hypoallergenic-Dermatologist-Gynaecologist/dp/B004ZWNKFQ/ref=zg_bs_g_drugstore_d_sccl_6/523-8125264-5194111?psc=1,2026-02-27,0,drugstore,co.uk
2,57,"Corsodyl Prevents gum disease & Bleeding Gum Treatment, Medicated Antibacterial Mouthwash, Original Alcohol Free, 300 ml",EUR 8.67,4016,4.7 out of 5 stars,B097QG96GX,https://www.amazon.co.uk/Corsodyl-Bleeding-Treatment-Antibacterial-Mouthwash/dp/B097QG96GX/ref=zg_bs_g_drugstore_d_sccl_7/523-8125264-5194111?psc=1,2026-02-27,0,drugstore,co.uk
2,58,"Oral-B Satin Mint Dental Floss, 25 m",EUR 5.18,1960,4.6 out of 5 stars,B014DGO4A8,https://www.amazon.co.uk/Oral-B-Satin-Mint-Dental-Floss/dp/B014DGO4A8/ref=zg_bs_g_drugstore_d_sccl_8/523-8125264-5194111?psc=1,2026-02-27,0,drugstore,co.uk
2,59,"MasterMedi Tongue Scraper with Travel Case 1 Pack, Bad Breath Treatment Tongue Scraper for Adults & Kids, Stainless Steel Metal Tongue Scraper, Easy to Use Tongue Cleaner for Hygiene and Self Care",EUR 4.56,118197,4.5 out of 5 stars,B0B257614L,https://www.amazon.co.uk/MasterMedi-Scraper-Treatment-Stainless-Cleaner/dp/B0B257614L/ref=zg_bs_g_drugstore_d_sccl_9/523-8125264-5194111?psc=1,2026-02-27,0,drugstore,co.uk
2,60,"Voltarol Joint & Back Pain Relief 2.32% Gel, for Joint Pain Relief, suitable for Knee Pain & Neck Pain, 50g",EUR 9.76,19474,4.6 out of 5 stars,B07HLR7PPZ,https://www.amazon.co.uk/Voltarol-Joint-Back-Relief-2-32/dp/B07HLR7PPZ/ref=zg_bs_g_drugstore_d_sccl_10/523-8125264-5194111?psc=1,2026-02-27,0,drugstore,co.uk
2,61,"Breathe Right Original Tan, Beige Small/Medium 30 Pieces, Nasal Strips for Snoring, Nose Strips for Breathing, Blocked Nose Relief, Drug-free Snoring Aid for Men and Women, Packaging may vary",EUR 13.14,7098,4.1 out of 5 stars,B07DDLHFYX,https://www.amazon.co.uk/Breathe-Right-Congestion-Relief-Original/dp/B07DDLHFYX/ref=zg_bs_g_drugstore_d_sccl_11/523-8125264-5194111?psc=1,2026-02-27,7K+,drugstore,co.uk
2,62,"Otex Express Ear Drops. Clinically Proven Ear Wax Removal Drops for Excessive, Hardened Ear Wax. Can Reduce The Need For Syringing or Microsuction, 10ml",EUR 4.57,25696,4.5 out of 5 stars,B001LK8BRW,https://www.amazon.co.uk/Clinically-Excessive-Hardened-Syringing-Microsuction/dp/B001LK8BRW/ref=zg_bs_g_drugstore_d_sccl_12/523-8125264-5194111?psc=1,2026-02-27,0,drugstore,co.uk
2,63,"Optrex 10 ml Moisturising Eye Drops: Contact Lens Safe, Relieves Irritation, Soothes Inflammation, Hydrates, Provides Comfort for Dry and Sensitive Eyes",EUR 7.99,4988,4.5 out of 5 stars,B0CR6PC7QK,https://www.amazon.co.uk/OptrexTM-Moisturising-Drops-Comforts-soothes/dp/B0CR6PC7QK/ref=zg_bs_g_drugstore_d_sccl_13/523-8125264-5194111?psc=1,2026-02-27,0,drugstore,co.uk
2,64,Canesten Thrush Combi Pessary & External Cream for Thrush Treatment | Clotrimazole | Two-Step Complete Relief Thrush Treatment,EUR 13.24,10252,4.7 out of 5 stars,B000QUWHIM,https://www.amazon.co.uk/Canesten-External-Clotrimazole-Complete-Treatment/dp/B000QUWHIM/ref=zg_bs_g_drugstore_d_sccl_14/523-8125264-5194111?psc=1,2026-02-27,0,drugstore,co.uk
2,65,"Listerine Advanced Defence Gum Treatment Mouthwash (500ml), Clinically Proven to Treat Gum Disease as in Little as Two Weeks, Repels Plaque Germs to Treat and Prevent Gingivitis from Recurring",EUR 9.13,8116,4.6 out of 5 stars,B00I874D4Q,https://www.amazon.co.uk/Listerine-Advanced-Defence-Treatment-Crisp/dp/B00I874D4Q/ref=zg_bs_g_drugstore_d_sccl_15/523-8125264-5194111?psc=1,2026-02-27,0,drugstore,co.uk
2,66,"Seven Seas JointCare Plus Turmeric, with Omega-3, Glucosamine, Chondroitin, Vitamins C and D, Manganese and Zinc, Food Supplements, 30-Day Pack",EUR 16.53,2350,4.5 out of 5 stars,B0D796FB8M,https://www.amazon.co.uk/Seven-Seas-Glucosamine-Chondroitin-Supplements/dp/B0D796FB8M/ref=zg_bs_g_drugstore_d_sccl_16/523-8125264-5194111?psc=1,2026-02-27,0,drugstore,co.uk
2,67,"Nexium Control Heartburn & Indigestion Tablets for Acid Reflux Relief, Gastro-Resistant Esomeprazole Tablets, 20mg, 14 Count",EUR 9.60,11500,4.7 out of 5 stars,B00MA5RMIQ,https://www.amazon.co.uk/Nexium-Control-Heartburn-Gastro-Resistant-Esomeprazole/dp/B00MA5RMIQ/ref=zg_bs_g_drugstore_d_sccl_17/523-8125264-5194111?psc=1,2026-02-27,0,drugstore,co.uk
2,68,"Nicorette Icy White 2mg Gum (210 Pieces), Discreet Stop Smoking and Stop Vaping Aid to Help you Quit For Good, Tackle Cravings and Withdrawal Symptoms, Nicotine Gum (Quit Smoking or Vaping)",EUR 28.56,2994,4.5 out of 5 stars,B078LGB4PW,https://www.amazon.co.uk/Nicorette-Discreet-Fast-Acting-Whitening-Properties/dp/B078LGB4PW/ref=zg_bs_g_drugstore_d_sccl_18/523-8125264-5194111?psc=1,2026-02-27,0,drugstore,co.uk
2,69,"Nurofen For Children 3M-9Y, Kids Ibuprofen Strawberry 100 ml, Baby Teething Pain Relief, Cold Flu, Fast Acting, Up To 8 Hours, Fever Reducer, Child Medicine",EUR 2.66,5295,4.8 out of 5 stars,B001DXNRVM,https://www.amazon.co.uk/Nurofen-Children-Strawberry-100-ml/dp/B001DXNRVM/ref=zg_bs_g_drugstore_d_sccl_19/523-8125264-5194111?psc=1,2026-02-27,0,drugstore,co.uk
2,70,"Nuromol Dual Action Ibuprofen Paracetamol Tablets, 16 Count - Strong Painkillers for Joint, Period, Back Pain & Fever Relief",EUR 5.14,3396,4.7 out of 5 stars,B09NJPNF53,https://www.amazon.co.uk/Nuromol-Relief-Tablets-Paracetemol-Ibuprofen/dp/B09NJPNF53/ref=zg_bs_g_drugstore_d_sccl_20/523-8125264-5194111?psc=1,2026-02-27,0,drugstore,co.uk
2,71,"LULUTOX Original Detox Tea - Herbal Blend with Dandelion, Ginseng, and Ginger - Supports A Healthy Weight, Digestive Health - Vegan, All Natural, Laxative-Free - Peach Flavor (28 Servings)",EUR 30.85,6942,4.0 out of 5 stars,B0CBCRL1KF,https://www.amazon.co.uk/LULUTOX-Original-Detox-Tea-Laxative-Free/dp/B0CBCRL1KF/ref=zg_bs_g_drugstore_d_sccl_21/523-8125264-5194111?psc=1,2026-02-27,0,drugstore,co.uk
