page,rank,title,price,reviews_count,rating,asin,url,date,bought_number,category,market_place
1,1,"Gritin Resistance Bands, Set of 5 Skin-Friendly Resistance Fitness Exercise Loop Bands with 5 Different Strength Levels - Carrying Case Included - Ideal for Home, Gym, Yoga, Training",EUR 11.41,112797,4.4 out of 5 stars,B07L9WLKZQ,https://www.amazon.co.uk/Gritin-Resistance-Skin-Friendly-Exercise-Different/dp/B07L9WLKZQ/ref=zg_bs_g_sports_d_sccl_1/525-1211990-8722466?psc=1,2026-02-27,10K+,sports,co.uk
1,2,"OPRO Silver Level Mouthguard Essential Fit – Gum Shield Adult and Kids – OPRO Mouth Guard Boxing and MMA, Easy Self-Fit Gum Shield Rugby and Hockey – Superior Protection with Dental Warranty",EUR 15.98,2531,4.3 out of 5 stars,B09PLLXVG8,https://www.amazon.co.uk/Mouthguard-Featuring-Revolutionary-Technology-Lacrosse/dp/B09PLLXVG8/ref=zg_bs_g_sports_d_sccl_2/525-1211990-8722466?psc=1,2026-02-27,0,sports,co.uk
1,3,"Target Darts K Flex Integrated Dart Flights And Shafts, No.6 | Pack Of 3 K-Flex - No6, Kflex All In One Moulded Dart Flight & Stem Lengths: Short, Intermediate & Medium | Professional Dart Accessories",EUR 11.37,6993,4.6 out of 5 stars,B0CHB5DXJK,https://www.amazon.co.uk/TARGET-Darts-Integrated-Flights-Shafts/dp/B0CHB5DXJK/ref=zg_bs_g_sports_d_sccl_3/525-1211990-8722466?psc=1,2026-02-27,0,sports,co.uk
1,4,"Sparrow Insulated Water Bottle - 350ml/500ml/750ml/1L/1.2L - FlipFlow Metal Water Bottles with Straw Lid - BPA Free - Leakproof Stainless Steel Flask for Sport, Gym, School, Outdoor, Travel",EUR 19.34,5964,4.6 out of 5 stars,B0B15KHZY4,https://www.amazon.co.uk/Super-Sparrow-Ultralight-Bottle-Stainless/dp/B0B15KHZY4/ref=zg_bs_g_sports_d_sccl_4/525-1211990-8722466?psc=1,2026-02-27,0,sports,co.uk
1,5,"Science in Sport SIS Clear Sports Water Bottle, Plastic Water Bottle, Black Logo, Transparent Colour, 800 ml",EUR 5.66,38093,4.4 out of 5 stars,B002FOMU3O,https://www.amazon.co.uk/Science-Sport-Clear-Drinks-Bottle/dp/B002FOMU3O/ref=zg_bs_g_sports_d_sccl_5/525-1211990-8722466?psc=1,2026-02-27,0,sports,co.uk
1,6,Amazon Basics Neoprene Dumbbell Pair,EUR 11.99,26549,4.7 out of 5 stars,B078Y2Q34Q,https://www.amazon.co.uk/AmazonBasics-Neoprene-Dumbbell-Pair-1-5Kg/dp/B078Y2Q34Q/ref=zg_bs_g_sports_d_sccl_6/525-1211990-8722466?psc=1,2026-02-27,0,sports,co.uk
1,7,"Nikwax Tech Wash & TX.Direct Twin Pack – Wash-In Cleaner and Waterproofer for Waterproof Outdoor Clothing, Restores Breathability and Performance, 2 x 300ml",EUR 15.40,22849,4.6 out of 5 stars,B000PGOOIS,https://www.amazon.co.uk/Nikwax-Tech-Wash-Direct-Twin/dp/B000PGOOIS/ref=zg_bs_g_sports_d_sccl_7/525-1211990-8722466?psc=1,2026-02-27,0,sports,co.uk
1,8,Sistema Twist 'n' Sip Squeeze Kids Water Bottle | Leakproof Water Bottle | 330 ml | BPA-Free | Assorted Colours,EUR 1.71,13153,4.1 out of 5 stars,B003BZ9RPA,https://www.amazon.co.uk/Sistema-780C6-330ml-Squeeze-Bottle/dp/B003BZ9RPA/ref=zg_bs_g_sports_d_sccl_8/525-1211990-8722466?psc=1,2026-02-27,0,sports,co.uk
1,9,Speedo Unisex-Adult Biofuse 2.0 Swimming Goggles | Patented Easy Adjustment | Anti-fog | Anti-leak | Enhanced Fit | Improved Comfort Goggles,EUR 20.00,13562,4.4 out of 5 stars,B0BK1Y38RD,https://www.amazon.co.uk/Speedo-Patented-Adjustment-Anti-fog-Anti-leak/dp/B0BK1Y38RD/ref=zg_bs_g_sports_d_sccl_9/525-1211990-8722466?psc=1,2026-02-27,0,sports,co.uk
1,10,"BEAR GRIP Straps - Premium Neoprene Padded Heavy Duty Double Stitched Weight Lifting Gym Straps, Deadlift, Gym Accessories for Men and Women, Advanced Gel Grip, 100% cotton, Extra long length",EUR 11.39,5548,4.6 out of 5 stars,B07Q5N81YQ,https://www.amazon.co.uk/BEAR-GRIP-Straps-Neoprene-stitched/dp/B07Q5N81YQ/ref=zg_bs_g_sports_d_sccl_10/525-1211990-8722466?psc=1,2026-02-27,0,sports,co.uk
1,11,"SEASEVEN 1L Water Bottle with Straw,Plastic Drinks Bottle,1 Litre Sports Water Bottles with Time Markings,Girls Boys Waterbottle Leak-Proof & Bpa-Free for Gym,Cycling, Office, Outdoor",EUR 10.27,3550,4.6 out of 5 stars,B0CBFZF8TD,https://www.amazon.co.uk/SEASEVEN-Motivational-Waterbottle-Leak-Proof-Free%EF%BC%8CBpa-Free/dp/B0CBFZF8TD/ref=zg_bs_g_sports_d_sccl_11/525-1211990-8722466?psc=1,2026-02-27,0,sports,co.uk
1,12,"General Medi Mini First Aid Kit, 92 Pieces Small First Aid Kit - Includes Emergency Foil Blanket, Scissors for Travel, Home, Office, Vehicle, Camping, Workplace & Outdoor (Red)",EUR 7.02,8456,4.7 out of 5 stars,B0746GHQ2N,https://www.amazon.co.uk/Mini-First-Aid-Pieces-Small/dp/B0746GHQ2N/ref=zg_bs_g_sports_d_sccl_12/525-1211990-8722466?psc=1,2026-02-27,0,sports,co.uk
1,13,WINMAU Fusion Integrated Flight and Shaft System No.6 – One-Piece Dart Flights and Shafts,EUR 6.27,851,4.5 out of 5 stars,B0DJSV4Y7F,https://www.amazon.co.uk/WINMAU-Fusion-Integrated-Flight-System/dp/B0DJSV4Y7F/ref=zg_bs_g_sports_d_sccl_13/525-1211990-8722466?psc=1,2026-02-27,0,sports,co.uk
1,14,"KAYMAN Yoga Mat – Multi-Purpose Extra Thick Foam Exercise Mats – Ideal Floor Mat for Pilates, Stretching, Resistance Workout & Therapy – Home & Gym Equipment Accessory",EUR 13.70,3552,4.4 out of 5 stars,B0BRQQVRJW,https://www.amazon.co.uk/KAYMAN-Exercise-Yoga-Mat-Slip/dp/B0BRQQVRJW/ref=zg_bs_g_sports_d_sccl_14/525-1211990-8722466?psc=1,2026-02-27,0,sports,co.uk
1,15,HotHands Hand Warmers - 5 Pairs - 10 hours of heat - Air activated - Ready to use,EUR 6.04,9538,4.6 out of 5 stars,B08GCT8SXZ,https://www.amazon.co.uk/HOTHANDS-Hand-Warmers-Pairs-activated/dp/B08GCT8SXZ/ref=zg_bs_g_sports_d_sccl_15/525-1211990-8722466?psc=1,2026-02-27,0,sports,co.uk
1,16,"Ion8 Water Bottle, 500 ml/18 oz, Leak Proof, Easy to Open, Secure Lock, Dishwasher Safe, BPA Free, Hygienic Flip Cover, Carry Handle, Fits Cup Holders, Easy Clean, Carbon Neutral, Navy Blue",EUR 9.48,37350,4.5 out of 5 stars,B074WDVB8X,https://www.amazon.co.uk/Ion8-Proof-Water-Bottle-Frosted/dp/B074WDVB8X/ref=zg_bs_g_sports_d_sccl_16/525-1211990-8722466?psc=1,2026-02-27,0,sports,co.uk
1,17,"Super Sparrow Sports Water Bottle - 350ml & 500ml & 750ml & 1000ml - Non-Toxic BPA Free & Eco-Friendly Tritan Co-Polyester Plastic - For Running, Gym, Yoga, Outdoors and Camping",EUR 9.70,42736,4.6 out of 5 stars,B077ZLDC2H,https://www.amazon.co.uk/Super-Sparrow-Sports-Water-Bottle/dp/B077ZLDC2H/ref=zg_bs_g_sports_d_sccl_17/525-1211990-8722466?psc=1,2026-02-27,0,sports,co.uk
1,18,"Neo-G Knee Support Open Patella - Knee Brace For Arthritis, Joint Pain Relief, ACL, Meniscus Tear, Runners Knee, Walking, Running - Knee Supports for Joint Pain Men and Women - Adjustable",EUR 18.84,14842,4.4 out of 5 stars,B001M04WVK,https://www.amazon.co.uk/Neo-Knee-Support-Basketball-Compression/dp/B001M04WVK/ref=zg_bs_g_sports_d_sccl_18/525-1211990-8722466?psc=1,2026-02-27,0,sports,co.uk
1,19,"Zoggs Super Seal Kids Swimming Goggles, UV Protection, Quick Adjust Split Yoke Comfort Strap, Fog Free Clear Swim Goggle Lenses, Ages 6-14",EUR 11.41,4730,4.5 out of 5 stars,B077VX8Q12,https://www.amazon.co.uk/Zoggs-Super-Junior-Swimming-Goggles/dp/B077VX8Q12/ref=zg_bs_g_sports_d_sccl_19/525-1211990-8722466?psc=1,2026-02-27,0,sports,co.uk
1,20,"bottlebottle Stainless Steel Water Bottle with Straw and Lid, Sports Insulated Metal Water Bottle with Handle, Light Green, 700ml",EUR 26.27,8148,4.4 out of 5 stars,B0C3V7765F,https://www.amazon.co.uk/BOTTLE-Insulated-Bottle-Stainless-Bottles/dp/B0C3V7765F/ref=zg_bs_g_sports_d_sccl_20/525-1211990-8722466?psc=1,2026-02-27,0,sports,co.uk
1,21,"EVOLAND Vibration Plate Exercise Machine, Vibration Fitness Trainer with Bluetooth Speaker, 5 Program Modes, 2 Resistance Bands, Home Exercise Equipment for Fitness Body Toning",EUR 67.97,1751,4.5 out of 5 stars,B07LGN21BY,https://www.amazon.co.uk/AGM-Vibration-Machine-Vibrating-Bluetooth/dp/B07LGN21BY/ref=zg_bs_g_sports_d_sccl_21/525-1211990-8722466?psc=1,2026-02-27,0,sports,co.uk
1,22,"GT85 Multi-Purpose Oil Spray 400ml, Clean, Lube & Protect Metal and Composite Parts, Rust Prevention and Lubricant for Bike Accessories & Tools",EUR 10.23,10085,4.8 out of 5 stars,B000OYFSIG,https://www.amazon.co.uk/GT85-Spray-400ml-Lubricates-Composite/dp/B000OYFSIG/ref=zg_bs_g_sports_d_sccl_22/525-1211990-8722466?psc=1,2026-02-27,0,sports,co.uk
1,23,"GAME GUARD Sports Mouthguard – Easy Fit Boil & Bite Gum Shield for Kids/Junior (Age 8+) – Mouth Guard for Rugby, Hockey, GAA – Ideal for Schools and Clubs (Clear)",EUR 8.28,5847,4.0 out of 5 stars,B002PD5E2E,https://www.amazon.co.uk/GAME-GUARD-Sports-Mouthguard-Schools/dp/B002PD5E2E/ref=zg_bs_g_sports_d_sccl_23/525-1211990-8722466?psc=1,2026-02-27,0,sports,co.uk
1,24,"SAFEJAWZ Mouth Guard, Slim Fit Gum Shield for Adults & Juniors with Case, Easy Fit Remouldable Gumshield for Rugby, Boxing, MMA, Hockey, Karate & All Contact Sports Mouthguard",EUR 11.41,15071,4.2 out of 5 stars,B073CW6WTQ,https://www.amazon.co.uk/SAFEJAWZ-Mouthguard-Martial-Contact-B073CZHSRS/dp/B073CW6WTQ/ref=zg_bs_g_sports_d_sccl_24/525-1211990-8722466?psc=1,2026-02-27,0,sports,co.uk
1,25,"Pelle & Sol 200 Natural Firelighters – Long Burning Fire Lighters for Wood Burners, BBQ Lighter, Pizza Ovens, Open Fires – Quick Light Fire Starter, Log Burner Accessories - Eco Firelighters",EUR 12.11,470,4.4 out of 5 stars,B0DZ2K4NWF,https://www.amazon.co.uk/Pelle-Sol-200-Natural-Firelighters/dp/B0DZ2K4NWF/ref=zg_bs_g_sports_d_sccl_25/525-1211990-8722466?psc=1,2026-02-27,0,sports,co.uk
1,26,"Target Darts K Flex Integrated Dart Flights And Shafts, No.2 | Pack Of 3 K-Flex - No2, Kflex All In One Moulded Dart Flight & Stem Lengths: Short, Intermediate & Medium | Professional Dart Accessories",EUR 11.37,4176,4.6 out of 5 stars,B0CYHMFWDN,https://www.amazon.co.uk/TARGET-Darts-Integrated-Flights-Shafts/dp/B0CYHMFWDN/ref=zg_bs_g_sports_d_sccl_26/525-1211990-8722466?psc=1,2026-02-27,0,sports,co.uk
1,27,"Roe Tenpo Electric Air Pump with 3 Nozzles/Inflate Or Deflate Swimming Ring, Airbeds, Paddling Pools & Other Toys / AC110-240V/ DC12V/50W (Black-Air-Pump)",EUR 6.84,1326,4.5 out of 5 stars,B0C5VLDJRH,https://www.amazon.co.uk/Electric-Swimming-Paddling-AC110-240V-Black-Air-Pump/dp/B0C5VLDJRH/ref=zg_bs_g_sports_d_sccl_27/525-1211990-8722466?psc=1,2026-02-27,0,sports,co.uk
1,28,"RED DRAGON Pegasus Professional 80% Tungsten Darts Set Available in Steel Tip 21g, 23g, 24g, 25g, 26g, 28g, 30g darts | Amazon Exclusive Dart Set with Flights, Stems (Shafts) and Case",EUR 22.84,10231,4.5 out of 5 stars,B00H1Q5JYI,https://www.amazon.co.uk/RED-DRAGON-Pegasus-Tungsten-Steeltip/dp/B00H1Q5JYI/ref=zg_bs_g_sports_d_sccl_28/525-1211990-8722466?psc=1,2026-02-27,0,sports,co.uk
1,29,"MAVIKS Exercise Bands Resistance Bands for Working Out, Set of 5 Bands, Elastic Resistance Bands for Physical Therapy, Pilates,Yoga, Stretching, Home Fitness with Guide and Carry Bag",EUR 9.11,1034,4.4 out of 5 stars,B0D77SFSPY,https://www.amazon.co.uk/MAVIKS-Exercise-Resistance-Physical-Stretching/dp/B0D77SFSPY/ref=zg_bs_g_sports_d_sccl_29/525-1211990-8722466?psc=1,2026-02-27,0,sports,co.uk
1,30,Speedo Unisex Kids Biofuse 2.0 Anti-fog Swimming Goggles (pack of 1),EUR 16.00,2698,4.6 out of 5 stars,B0C3W8B1TV,https://www.amazon.co.uk/Speedo-Swimming-Patented-Adjustment-Anti-Leak/dp/B0C3W8B1TV/ref=zg_bs_g_sports_d_sccl_30/525-1211990-8722466?psc=1,2026-02-27,0,sports,co.uk
1,31,"Mitre Unisex Impel L30P Football, Highly Durable, Shape Retention,Football",EUR 10.11,13611,4.5 out of 5 stars,B093THVMZ7,https://www.amazon.co.uk/Mitre-Training-Football-Without-Dazzlingling/dp/B093THVMZ7/ref=zg_bs_g_sports_d_sccl_31/525-1211990-8722466?psc=1,2026-02-27,0,sports,co.uk
1,32,"Rocket TT Super Tube Lubricant Spray 450ml | Rust Remover & Anti-Corrosion Maintenance Spray | Penetrating Oil for Seized Bolts,Tools, Bikes & Garden Equipment | Water-Resistant Protective Coating",EUR 7.18,1025,4.7 out of 5 stars,B0BTMTQNZ6,https://www.amazon.co.uk/Rocket-Anti-Corrosion-Maintenance-Penetrating-Water-Resistant/dp/B0BTMTQNZ6/ref=zg_bs_g_sports_d_sccl_32/525-1211990-8722466?psc=1,2026-02-27,0,sports,co.uk
1,33,"KAYMAN Exercise Ball - Anti-Burst System, Non-Slip Rings, Durable Material, Easy to Inflate, Perfect for Yoga, Pilates, Fitness, Balance Training, Gym, and Home Workouts",EUR 10.27,392,4.4 out of 5 stars,B0FZVHGJPV,https://www.amazon.co.uk/KAYMAN-Exercise-Ball-Anti-Burst-Non-Slip/dp/B0FZVHGJPV/ref=zg_bs_g_sports_d_sccl_33/525-1211990-8722466?psc=1,2026-02-27,0,sports,co.uk
1,34,"Winmau Blade X & Blade 6 Series Dartboards - Professional PDC Official Tournament Dart Board, Ultra-Thin Wire System, High-Density Sisal Construction",EUR 50.27,5250,4.7 out of 5 stars,B09HR1SV6C,https://www.amazon.co.uk/WINMAU-Blade-Professional-Bristle-Dartboard/dp/B09HR1SV6C/ref=zg_bs_g_sports_d_sccl_34/525-1211990-8722466?psc=1,2026-02-27,0,sports,co.uk
1,35,Speedo Unisex Long Hair Cap,EUR 9.14,11007,4.2 out of 5 stars,B01LX7M2J1,https://www.amazon.co.uk/Speedo-Unisexs-Long-Hair-Black/dp/B01LX7M2J1/ref=zg_bs_g_sports_d_sccl_35/525-1211990-8722466?psc=1,2026-02-27,0,sports,co.uk
1,36,Stanley 1913 Flip Straw Sports Water Bottle with Straw 0.7L - 10 Hours Cold - 3 Days Iced - Stainless Steel - BPA Free - Leak Resistant - Fits in Cup Holder - Dishwasher Safe - Rose Quartz,EUR 37.43,2075,4.6 out of 5 stars,B0DXL2X4VF,https://www.amazon.co.uk/Stanley-Straw-Sports-Water-Bottle/dp/B0DXL2X4VF/ref=zg_bs_g_sports_d_sccl_36/525-1211990-8722466?psc=1,2026-02-27,0,sports,co.uk
1,37,"Blukar Skipping Rope, Speed Jump Rope Tangle-free Adjustable Cord with Rapid Ball Bearings & Soft Foam Handle for Fitness Workouts Fat Burning Exercises Boxing - Spare Cord Length Adjuster Included",EUR 6.79,27162,4.3 out of 5 stars,B08CRVG7BB,https://www.amazon.co.uk/Blukar-Skipping-Tangle-free-Adjustable-Exercises/dp/B08CRVG7BB/ref=zg_bs_g_sports_d_sccl_37/525-1211990-8722466?psc=1,2026-02-27,0,sports,co.uk
1,38,HEAD Championship Tennis Balls,EUR 5.13,12581,4.6 out of 5 stars,B000W8G4JG,https://www.amazon.co.uk/HEAD-Championship-Tennis-Balls/dp/B000W8G4JG/ref=zg_bs_g_sports_d_sccl_38/525-1211990-8722466?psc=1,2026-02-27,3K+,sports,co.uk
1,39,"Minecraft Atlantic Creeper Drinks Bottle with Logo | Eco Friendly BPA-free Plastic School Water Bottle with Removable straw, spill Proof | Gift for Minecraft fan | Official Merch 600ML",EUR 7.99,1646,4.6 out of 5 stars,B0CKHVMS8M,https://www.amazon.co.uk/HOX-Minecraft-Atlantic-Creeper-Drinks/dp/B0CKHVMS8M/ref=zg_bs_g_sports_d_sccl_39/525-1211990-8722466?psc=1,2026-02-27,0,sports,co.uk
1,40,Yogii Yoga Mat - Non-Slip 6mm Thick TPE & Travel-friendly Yoga Mat - Perfect for Home & Gym Exercise Fitness & Pilates - With Laser Alignment Guides for Men & Women,EUR 20.56,3059,4.4 out of 5 stars,B0F54Q7RVS,https://www.amazon.co.uk/Yogii-Yoga-Mat-Travel-friendly-Alignment/dp/B0F54Q7RVS/ref=zg_bs_g_sports_d_sccl_40/525-1211990-8722466?psc=1,2026-02-27,0,sports,co.uk
1,41,"Core Balance Foam Roller For Deep Tissue Muscle Massage, Trigger Point Grid Sports Massager, Fitness Gym Physio",EUR 13.59,5911,4.4 out of 5 stars,B01N9OQOB2,https://www.amazon.co.uk/Core-Balance-Massage-Therapy-Exercise/dp/B01N9OQOB2/ref=zg_bs_g_sports_d_sccl_41/525-1211990-8722466?psc=1,2026-02-27,0,sports,co.uk
1,42,Superun Walking Pad Raceable 6% Incline 2.5HP Under Desk Treadmill 136KG Capacity MAX 12KM/H Foldable Treadmill with HIIT & MIIT Programs APP Control Portable Walking Machine for Home,EUR 102.82,2171,4.3 out of 5 stars,B0D25ZMHJC,https://www.amazon.co.uk/Superun-Walking-Pad-2-5HP-Treadmill/dp/B0D25ZMHJC/ref=zg_bs_g_sports_d_sccl_42/525-1211990-8722466?psc=1,2026-02-27,0,sports,co.uk
1,43,"Blukar Head Torch Rechargeable, 2 Pack 2000L Super Bright Headlamp Headlight with 8 Light Modes, Spotlight Floodlight Combination, Sensor Control, Waterproof, Long Battery Life for Running,Camping",EUR 18.27,10200,4.6 out of 5 stars,B0D3VDXB19,https://www.amazon.co.uk/Blukar-Rechargeable-Floodlight-Combination-Waterproof/dp/B0D3VDXB19/ref=zg_bs_g_sports_d_sccl_43/525-1211990-8722466?psc=1,2026-02-27,0,sports,co.uk
1,44,SONGMICS Dumbbells Set of 2 Dumbbells Hexagon Neoprene Coating Strength Training Workout Fitness Training Home,EUR 20.56,10527,4.7 out of 5 stars,B0BS691J24,https://www.amazon.co.uk/SONGMICS-Dumbbells-Neoprene-Strength-SYL906Q01/dp/B0BS691J24/ref=zg_bs_g_sports_d_sccl_44/525-1211990-8722466?psc=1,2026-02-27,0,sports,co.uk
1,45,Foam Roller for Deep Tissue Muscle Massage Trigger Point Muscles Enhance Recovery for Physical Therapy and Rehab (Black),EUR 9.13,184,4.4 out of 5 stars,B0FH72M3WZ,https://www.amazon.co.uk/Massage-Trigger-Muscles-Recovery-Physical/dp/B0FH72M3WZ/ref=zg_bs_g_sports_d_sccl_45/525-1211990-8722466?psc=1,2026-02-27,0,sports,co.uk
1,46,"OPRO Gold Level Mouthguard Premium Fit – Gum Shield Adult and Kids – OPRO Mouth Guard Boxing and MMA, Easy Self-Fit Gum Shield Rugby and Hockey – Premium Protection with Dental Warranty",EUR 22.84,2779,4.4 out of 5 stars,B09PLM99VT,https://www.amazon.co.uk/Mouthguard-Featuring-Revolutionary-Technology-Lacrosse/dp/B09PLM99VT/ref=zg_bs_g_sports_d_sccl_46/525-1211990-8722466?psc=1,2026-02-27,0,sports,co.uk
2,51,"NIYIKOW Hand Grip Strengthener, Grip Strengthener, Forearm Strengthener, Adjustable Resistance 22-132Lbs (10-60kg), Perfect for Musicians Athletes",EUR 11.41,31377,4.5 out of 5 stars,B092M58WVY,https://www.amazon.co.uk/NIYIKOW-Strengthener-Adjustable-Resistance-Rehabilitation/dp/B092M58WVY/ref=zg_bs_g_sports_d_sccl_1/525-1211990-8722466?psc=1,2026-02-27,0,sports,co.uk
2,52,"HomeFitnessCode Walking Pad Treadmill 7% Incline, Treadmills for Home, 2.5HP Portable Electric Under Desk Treadmill with LED Display & Remote, Adjustable Speed, No Assembly",EUR 114.25,706,4.4 out of 5 stars,B0F7H4ZT2F,https://www.amazon.co.uk/HomeFitnessCode-Treadmill-Treadmills-Portable-Adjustable/dp/B0F7H4ZT2F/ref=zg_bs_g_sports_d_sccl_2/525-1211990-8722466?psc=1,2026-02-27,0,sports,co.uk
2,53,"EXERZ Yoga Blocks 2pcs Gym Bricks -Comfortable Fitness Yoga Bricks, Anti-Slip, Lightweight and Travel Friendly Pilates Practice",EUR 10.27,3842,4.6 out of 5 stars,B079B5CPQV,https://www.amazon.co.uk/EXERZ-Comfortable-Anti-Slip-Lightweight-Friendly/dp/B079B5CPQV/ref=zg_bs_g_sports_d_sccl_3/525-1211990-8722466?psc=1,2026-02-27,0,sports,co.uk
2,54,"KEPLIN Freezer Blocks - Reusable Ice Pack Cooler for Lunch boxes, Travel, Picnic, and Outdoor Activities | Ice Boxes Maintains Cool Temperature for food and Drinks for hours | Multicolour (6 Pack)",EUR 7.42,8699,4.5 out of 5 stars,B07CHWHPR4,https://www.amazon.co.uk/KEPLIN-Freezer-Family-Blocks-17x10x2cm/dp/B07CHWHPR4/ref=zg_bs_g_sports_d_sccl_4/525-1211990-8722466?psc=1,2026-02-27,0,sports,co.uk
2,55,"FULDENT Sports Water Bottle 1L Leakproof Design Water Bottle, BPA Free Tritan Plastic Drinking Bottle for Teenager, Adult, Sports, Hiking, Gym, Fitness, Outdoor, Cycling, School & Office",EUR 13.70,3874,4.4 out of 5 stars,B09K7KHK9G,https://www.amazon.co.uk/FULDENT-Trinkflasche-Wasserflasche-rutschfest-Geeignet/dp/B09K7KHK9G/ref=zg_bs_g_sports_d_sccl_5/525-1211990-8722466?psc=1,2026-02-27,0,sports,co.uk
2,56,Mezere Kids Swimming Goggles Kids 6-14 Anti Fog Swim Goggles No Leaking Girls Swimming Goggles UV Protection Childrens Goggle Swim Glasses,EUR 6.99,697,4.4 out of 5 stars,B0CWXTDBJB,https://www.amazon.co.uk/Mezere-Swimming-Goggles-Leaking-Childrens/dp/B0CWXTDBJB/ref=zg_bs_g_sports_d_sccl_6/525-1211990-8722466?psc=1,2026-02-27,0,sports,co.uk
2,57,"Bestway Double Air Bed, Inflatable Outdoor, Indoor Airbed, Quick Inflation, Flocked Double Size Air Bed",EUR 17.14,20473,4.2 out of 5 stars,B00F0B5IV0,https://www.amazon.co.uk/Bestway-Inflatable-Outdoor-Inflation-Flocked/dp/B00F0B5IV0/ref=zg_bs_g_sports_d_sccl_7/525-1211990-8722466?psc=1,2026-02-27,0,sports,co.uk
2,58,"Super Sparrow Water Bottle Stainless Steel - 350ml/500ml/620ml/750ml/1L- Insulated Metal Water Bottles - Standard Mouth Flask - BPA Free - Straw Bottle for Work, Gym, Sports - 2 Lids",EUR 14.52,60401,4.6 out of 5 stars,B01NAL7NSO,https://www.amazon.co.uk/Super-Sparrow-Stainless-Vacuum-Insulated/dp/B01NAL7NSO/ref=zg_bs_g_sports_d_sccl_8/525-1211990-8722466?psc=1,2026-02-27,0,sports,co.uk
2,59,"OCOOPA UT3 Lite Magnetic Hand Warmers Rechargeable 2 pack, Electric Handwarmers Ultra Thin Light Portable for Pocket Gloves,3 Levels Heat, Up to 8 hrs, UL Certified,Idea Tech Gifts for Men, Women",EUR 22.84,13057,4.5 out of 5 stars,B0CC189314,https://www.amazon.co.uk/OCOOPA-Magnetic-Rechargeable-Handwarmers-Certified/dp/B0CC189314/ref=zg_bs_g_sports_d_sccl_9/525-1211990-8722466?psc=1,2026-02-27,0,sports,co.uk
2,60,"ATERCEL Weight Lifting Gloves, Gym Gloves for Crossfit, Workout, Exercise Cycling, Training, Breathable and Snug fit, for Men and Women",EUR 9.05,41477,4.5 out of 5 stars,B07KQR9VXG,https://www.amazon.co.uk/Atercel-Exercise-Powerlifting-Crossfit-Training/dp/B07KQR9VXG/ref=zg_bs_g_sports_d_sccl_10/525-1211990-8722466?psc=1,2026-02-27,0,sports,co.uk
2,61,"BEEWAY Bike Cover, Waterproof Bicycle Cover Indoor Outdoor Storage - 210T Nylon with Pu Coating, Safty Straps, Lock-holes, Fits for Most Bikes up to 29""",EUR 11.41,7947,4.5 out of 5 stars,B0BZR8J7VY,https://www.amazon.co.uk/BEEWAY-Waterproof-Bicycle-Outdoor-Storage/dp/B0BZR8J7VY/ref=zg_bs_g_sports_d_sccl_11/525-1211990-8722466?psc=1,2026-02-27,0,sports,co.uk
2,62,"RED DRAGON Javelin Darts - Javelin Original - 85% Professional Tungsten Darts Set with Dart Flights and Shafts (Stems) - Steel Tip Points Available in 20g, 22g, 24g and 26g",EUR 29.71,4374,4.3 out of 5 stars,B00I4049B4,https://www.amazon.co.uk/RED-DRAGON-Javelin-Tungsten-Checkout/dp/B00I4049B4/ref=zg_bs_g_sports_d_sccl_12/525-1211990-8722466?psc=1,2026-02-27,0,sports,co.uk
2,63,"Resistance Bands Set [Set of 3] 1.5M/4.9ft Skin-Friendly Exercise Bands with 3 Resistance Levels,Workout Bands Set for Women Men,Ideal for Yoga,Gym,Fitness (MULTI-COLOR)) ((SET OF 3 (MULTI-COLOR))",EUR 7.94,478,4.5 out of 5 stars,B0D9NSRN1N,https://www.amazon.co.uk/Resistance-Skin-Friendly-Exercise-Workout-MULTI-COLOR/dp/B0D9NSRN1N/ref=zg_bs_g_sports_d_sccl_13/525-1211990-8722466?psc=1,2026-02-27,0,sports,co.uk
2,64,"Coresteady Resistance Band For Men & Women - Exercise Band to Build Strength, Flexibility, Muscle & Tone - For Fitness, Stretching, Pilates, Physio & Yoga - With Exercise e-Guide",EUR 7.99,14160,4.3 out of 5 stars,B07814S9XB,https://www.amazon.co.uk/Coresteady-Resistance-Strength-Physiotherapy-Rehabilitation/dp/B07814S9XB/ref=zg_bs_g_sports_d_sccl_14/525-1211990-8722466?psc=1,2026-02-27,0,sports,co.uk
2,65,"Target Darts Swiss Points, Diamond Pro Swiss Point Dart Tips (3 Pack Set of Tips) Change Dart Points, Professional Darts Accessories",EUR 7.94,1720,4.6 out of 5 stars,B087DGV3VZ,https://www.amazon.co.uk/Target-Darts-Swiss-Diamond-Points/dp/B087DGV3VZ/ref=zg_bs_g_sports_d_sccl_15/525-1211990-8722466?psc=1,2026-02-27,0,sports,co.uk
2,66,"Super Sparrow Water Bottle - 500ml, 750ml, 1L - TouchSip Bottle - BPA-Free, Non-Toxic, Eco-Friendly - Straw Tritan Bottles for Sports, Outdoors, Camping",EUR 11.21,1933,4.4 out of 5 stars,B0DTP6PZP2,https://www.amazon.co.uk/Super-Sparrow-Water-Bottle-Eco-Friendly/dp/B0DTP6PZP2/ref=zg_bs_g_sports_d_sccl_16/525-1211990-8722466?psc=1,2026-02-27,0,sports,co.uk
2,67,"Log Barn Natural Firelighters Box of 200. Fire Lighters for Wood Burners, Pizza Ovens, Open Fires, BBQ Lighters, Fire Starters for Log Burners – Genuine Log Barn Wood Wool Firelighters",EUR 14.84,22123,4.7 out of 5 stars,B07FF436N5,https://www.amazon.co.uk/Natural-Firelighters-Lighters-Burners-Starters/dp/B07FF436N5/ref=zg_bs_g_sports_d_sccl_17/525-1211990-8722466?psc=1,2026-02-27,0,sports,co.uk
2,68,"HAISSKY Running Belt, Waist Pack Ultra Light Fitness Belt Water Resistant Running Waist Pack for iPhone 15 Pro Max/14/13 Pro/12/11 Plus Waist Bag for Women Men Fit Smartphone Up to 6.9 inch",EUR 10.27,3593,4.3 out of 5 stars,B08HYWNG9H,https://www.amazon.co.uk/Yigou-Running-Fitness-Resistant-Smartphone/dp/B08HYWNG9H/ref=zg_bs_g_sports_d_sccl_18/525-1211990-8722466?psc=1,2026-02-27,0,sports,co.uk
2,69,"HIGAHY Kids Swimming Goggles - Adjustable Anti Fog Swimming Goggles Kids 6-14 years, UV Resist Junior Swim Goggles, Wide Clear Vision and Anti-Leak for Boys Girls",EUR 9.70,125,4.7 out of 5 stars,B0DZWVMX31,https://www.amazon.co.uk/HIGAHY-Kids-Swimming-Goggles-Adjustable/dp/B0DZWVMX31/ref=zg_bs_g_sports_d_sccl_19/525-1211990-8722466?psc=1,2026-02-27,0,sports,co.uk
2,70,"Zoggs Kids' Phantom Mask with UV Protection And Anti-fog Swimming Goggles, 3-6 Years",EUR 17.13,527,4.4 out of 5 stars,B0CQ1YMH98,https://www.amazon.co.uk/Zoggs-Phantom-Kids-Violet-Clear/dp/B0CQ1YMH98/ref=zg_bs_g_sports_d_sccl_20/525-1211990-8722466?psc=1,2026-02-27,0,sports,co.uk
2,71,Neoprene Dumbbell Hand Weights Pair Home Exercise for Women Men Arm Pilates Dumbbells in 1kg 1.5kg 2kg 3kg 4kg 5kg 8kg 10kg Set,EUR 9.13,2248,4.7 out of 5 stars,B0C7W8XLCT,https://www.amazon.co.uk/Neoprene-Dumbbell-Weights-Exercise-Dumbbells/dp/B0C7W8XLCT/ref=zg_bs_g_sports_d_sccl_21/525-1211990-8722466?psc=1,2026-02-27,0,sports,co.uk
2,72,MUC-OFF - All-Weather Chain Lube 50ml,EUR 6.86,880,4.7 out of 5 stars,B0C4B5HWBN,https://www.amazon.co.uk/Muc-Off-All-Weather-Lubricant/dp/B0C4B5HWBN/ref=zg_bs_g_sports_d_sccl_22/525-1211990-8722466?psc=1,2026-02-27,0,sports,co.uk
2,73,"Nikwax TX.DIRECT Spray-On Waterproofer 500ml, Powerful Waterproofing Spray For Outdoor Clothing, Restores Waterproof Treatment for Jackets and Wet Weather Clothing",EUR 15.98,2411,4.4 out of 5 stars,B001DKG7XA,https://www.amazon.co.uk/Nikwax-TX-DIRECT-Waterproofer-Waterproof-Clothing/dp/B001DKG7XA/ref=zg_bs_g_sports_d_sccl_23/525-1211990-8722466?psc=1,2026-02-27,0,sports,co.uk
2,74,Speedo Junior Plain Moulded Silicone Swimming Cap,EUR 6.84,2812,4.2 out of 5 stars,B086DZ5GL1,https://www.amazon.co.uk/Speedo-Unisex-Youth-Moulded-Silicone-Swimming/dp/B086DZ5GL1/ref=zg_bs_g_sports_d_sccl_24/525-1211990-8722466?psc=1,2026-02-27,0,sports,co.uk
