page,rank,title,price,reviews_count,rating,asin,url,date,bought_number,category,market_place
2,75,"lanpard Faraday Box for Car Keys, Keyless Signal Blocking Anti-Theft Key Protector Signal Blocking Box",EUR 14.83,4378,4.7 out of 5 stars,B0CKMY22F3,https://www.amazon.co.uk/Faraday-Keyless-Blocking-Anti-Theft-Protector/dp/B0CKMY22F3/ref=zg_bs_g_automotive_d_sccl_25/260-0569253-8374645?psc=1,2026-02-27,3K+,automotive,co.uk
2,76,"flintronic 4PCS Trim Removal Tool, Car Trim Removal kit, Tool Kits for Car Radio Door Dashboard Installation, Plastic Pry Tool, Automotive Panel Dash nterior Accessories, Repair Mechanic Bar Scraper",EUR 4.22,4740,4.3 out of 5 stars,B0BW8SRJC8,https://www.amazon.co.uk/flintronic-Dashboard-Installation-Automotive-Accessories/dp/B0BW8SRJC8/ref=zg_bs_g_automotive_d_sccl_26/260-0569253-8374645?psc=1,2026-02-27,1K+,automotive,co.uk
2,77,"AA 12V Digital Tyre Inflator AA5502 – For Cars Other Vehicles Inflatables Bicycles - Shows PSI BAR KPA 3-100 PSI – Includes Adaptors, Black",EUR 30.82,16627,4.5 out of 5 stars,B00N94L21U,https://www.amazon.co.uk/AA-Digital-Tyre-Inflator-Adapters/dp/B00N94L21U/ref=zg_bs_g_automotive_d_sccl_27/260-0569253-8374645?psc=1,2026-02-27,2K+,automotive,co.uk
2,78,"URAQT Microfibre Cleaning Cloths, 6 Pack, Two-layer Thickened Towels, Lint Free Super Absorbent Towel for Household and Car Washing, Drying, Detailing, 40x30cm",EUR 11.41,5832,4.5 out of 5 stars,B08R8F8FGM,https://www.amazon.co.uk/URAQT-Microfibre-Two-layer-Thickened-Absorbent/dp/B08R8F8FGM/ref=zg_bs_g_automotive_d_sccl_28/260-0569253-8374645?psc=1,2026-02-27,1K+,automotive,co.uk
2,79,"Carlube AdBlue with Integrated Easy Pour Spout, 10 Litres",EUR 22.84,12007,4.5 out of 5 stars,B009LHDWLM,https://www.amazon.co.uk/Carlube-109481645-CAB010-AdBluee-10Ltr/dp/B009LHDWLM/ref=zg_bs_g_automotive_d_sccl_29/260-0569253-8374645?psc=1,2026-02-27,0,automotive,co.uk
2,80,Beeswax Leather Balsam Rich Conditioner & Restorer 100ml - 100% Natural Ingredients CLEANS SEALS & PROTECTS Handpoured in UK Chemical Free Biodegradable Moisturises Nourishes Prolongs Life of Items,EUR 11.41,2695,4.5 out of 5 stars,B09JNZSS7H,https://www.amazon.co.uk/Beeswax-Leather-Conditioner-Restorer-Polish/dp/B09JNZSS7H/ref=zg_bs_g_automotive_d_sccl_30/260-0569253-8374645?psc=1,2026-02-27,0,automotive,co.uk
2,81,"Autoglym Vinyl And Rubber Care, Fresh Lemon Scented Interior Car Cleaner Spray Designed To Protect Your Dashboard And Other Interior Plastics, White, 500 ml",EUR 21.14,11126,4.7 out of 5 stars,B001151E5I,https://www.amazon.co.uk/Autoglym-Vinyl-Rubber-Care-500ml/dp/B001151E5I/ref=zg_bs_g_automotive_d_sccl_81/260-0569253-8374645?psc=1,2026-02-27,0,automotive,co.uk
2,82,"Wetado Trim Removal Tool, Car Upholstery Repair Kit, Car Door Audio Panel Trim Removal Set, Fastener Terminal Remover Tool Set Clips Pry Kit Auto Clip Pliers (8PCS Blue)",EUR 11.41,3747,4.6 out of 5 stars,B08PCMX9MK,https://www.amazon.co.uk/Wetado-Removal-Upholstery-Fastener-Terminal/dp/B08PCMX9MK/ref=zg_bs_g_automotive_d_sccl_82/260-0569253-8374645?psc=1,2026-02-27,800+,automotive,co.uk
2,83,Castrol MAGNATEC 5W-30 A5 Engine Oil 5L,EUR 38.79,3417,4.8 out of 5 stars,B0C814DZ9D,https://www.amazon.co.uk/Castrol-MAGNATEC-5W-30-Engine-Oil/dp/B0C814DZ9D/ref=zg_bs_g_automotive_d_sccl_83/260-0569253-8374645?psc=1,2026-02-27,0,automotive,co.uk
2,84,"Little Trees Air Freshener Tree MTR0053 Coconut Fragrance For Car Home Boat Caravan - Single Pack, brown",EUR 2.05,1307,4.3 out of 5 stars,B000CINO8U,https://www.amazon.co.uk/Freshener-MTR0053-Coconut-Fragrance-Caravan/dp/B000CINO8U/ref=zg_bs_g_automotive_d_sccl_84/260-0569253-8374645?psc=1,2026-02-27,0,automotive,co.uk
2,85,"T-Cut Colour Fast Scratch Remover Colour Enhancer, Black, 150g",EUR 13.65,10134,4.0 out of 5 stars,B001EILAQU,https://www.amazon.co.uk/T-Cut-CSB150-Colour-Scratch-Remover/dp/B001EILAQU/ref=zg_bs_g_automotive_d_sccl_85/260-0569253-8374645?psc=1,2026-02-27,0,automotive,co.uk
2,86,"OSRAM COOL BLUE® INTENSE H7, +100% more brightness, up to 5,000K, halogen headlight lamp, LED look, Hanging folding box (2 lamps)",EUR 17.41,3991,4.2 out of 5 stars,B0D845VTG7,https://www.amazon.co.uk/OSRAM-INTENSE-brightness-halogen-headlight/dp/B0D845VTG7/ref=zg_bs_g_automotive_d_sccl_86/260-0569253-8374645?psc=1,2026-02-27,1K+,automotive,co.uk
2,87,Cataclean Diesel Fuel & Exhaust Cleaner Catalytic Converter Valve & Injector Cleaner 500ml,EUR 14.84,12791,4.5 out of 5 stars,B00BFWGI6M,https://www.amazon.co.uk/Cataclean-Diesel-Catalytic-Converter-Cleaner/dp/B00BFWGI6M/ref=zg_bs_g_automotive_d_sccl_87/260-0569253-8374645?psc=1,2026-02-27,0,automotive,co.uk
2,88,"Prestone Screenwash, Ready To Use Screen Wash For Cars, High Performance Cleaning With Streak Free Formula, Maximum Visibility Summer Windscreen Washer Fluid, Removes Stubborn Dirt, 5L Bottle",EUR 6.83,2018,4.6 out of 5 stars,B094DFY8PC,https://www.amazon.co.uk/Prestone-PSCW0021A-Summer-Screenwash-5L/dp/B094DFY8PC/ref=zg_bs_g_automotive_d_sccl_88/260-0569253-8374645?psc=1,2026-02-27,0,automotive,co.uk
2,89,"TREKURE 4000A Jump Starter Power Pack, 12V Car Battery Booster Jump Starter (up to 9.0L Gas or 8.5L Diesel Engine), Car Starter Power Bank with LED Flashlight, Jump Pack with Jump Leads",EUR 37.69,3079,4.6 out of 5 stars,B0DQ54YKH9,https://www.amazon.co.uk/TREKURE-Starter-Battery-Booster-Flashlight/dp/B0DQ54YKH9/ref=zg_bs_g_automotive_d_sccl_89/260-0569253-8374645?psc=1,2026-02-27,900+,automotive,co.uk
2,90,"OSRAM NIGHT BREAKER LASER H7, +150% more brightness, halogen headlight lamp, 64210NL-2HB, 12V, Hanging folding box (2 lamps)",EUR 25.88,2145,4.4 out of 5 stars,B0D841RKNG,https://www.amazon.co.uk/OSRAM-BREAKER-brightness-headlight-64210NL-2HB/dp/B0D841RKNG/ref=zg_bs_g_automotive_d_sccl_90/260-0569253-8374645?psc=1,2026-02-27,400+,automotive,co.uk
2,91,"Redex Diesel Fuel System Cleaner 250ml, Diesel Additives To Remove Harmful Emissions, Maximise Performance & Increase Fuel Economy Fuel Additives For Diesel Engines, Suitable For Hybrids",EUR 5.70,4304,4.6 out of 5 stars,B001QLX0TK,https://www.amazon.co.uk/Redex-Diesel-System-Cleaner-250ml/dp/B001QLX0TK/ref=zg_bs_g_automotive_d_sccl_91/260-0569253-8374645?psc=1,2026-02-27,0,automotive,co.uk
2,92,"Nicoman Universal Black Car Mats with Anti-Slip, Heavy Duty Performance All Weather Protection, Trim to Fit Rubber Floor Mat Carpet for SUV, Vans, Sedans, Trucks Waterproof, Made in UK (Full Set)",EUR 26.27,132,4.1 out of 5 stars,B0FPBPGGJ7,https://www.amazon.co.uk/Nicoman-Universal-Performance-Protection-Waterproof/dp/B0FPBPGGJ7/ref=zg_bs_g_automotive_d_sccl_92/260-0569253-8374645?psc=1,2026-02-27,0,automotive,co.uk
2,93,"Tevlaphee Steering Wheel Lock Twin Bar, Steering Lock, Car Anti-Theft Device, High Visibility, Heavy Duty, Universal Fit, Adjustable Length,3 Keys(Yellow)",EUR 43.40,12784,4.6 out of 5 stars,B0BVHNMTPY,https://www.amazon.co.uk/Tevlaphee-Anti-Theft-Visibility-Universal-Adjustable/dp/B0BVHNMTPY/ref=zg_bs_g_automotive_d_sccl_93/260-0569253-8374645?psc=1,2026-02-27,1K+,automotive,co.uk
2,94,"OSRAM NIGHT BREAKER 220, H4, +220% more brightness, halogen headlight lamp, 64193NB220-2HB, Folding Box (2 lamps)",EUR 24.26,6624,4.3 out of 5 stars,B0D4QT2YGM,https://www.amazon.co.uk/OSRAM-BREAKER-brightness-headlight-64193NB220-2HB/dp/B0D4QT2YGM/ref=zg_bs_g_automotive_d_sccl_94/260-0569253-8374645?psc=1,2026-02-27,1K+,automotive,co.uk
2,95,Mannol 5 Litre Energy 5W-30 Engine Oil A3/B4 Universal Synthetic Ester Technology,EUR 23.87,9335,4.7 out of 5 stars,B01FURYYEU,https://www.amazon.co.uk/MANNOL-MN7511-5-Mannol-Energy-5W30/dp/B01FURYYEU/ref=zg_bs_g_automotive_d_sccl_95/260-0569253-8374645?psc=1,2026-02-27,0,automotive,co.uk
2,96,"Autoglym Bodywork Car Shampoo Conditioner, 2.5L - Low Foam Car Shampoo For All Bodyworks - pH Neutral, 125 Washes, Wax Safe Formula for Car Cleaning and Car Detailing - Concentrated Car Wash Shampoo",EUR 18.85,11816,4.7 out of 5 stars,B0011DW2KG,https://www.amazon.co.uk/Autoglym-Bottle-Quality-Bodywork-Shampoo/dp/B0011DW2KG/ref=zg_bs_g_automotive_d_sccl_96/260-0569253-8374645?psc=1,2026-02-27,0,automotive,co.uk
