page,rank,title,price,reviews_count,rating,asin,url,date,bought_number,category,market_place
2,87,"Joma Women's Sports T-Shirt, 6XS – 3XL – Keeps Contact with the Body Dry, Ideal for Running or Gym – Combi",€7.99,4640.0,4.2 out of 5 stars,B01CSTEWMM,https://www.amazon.it/-/en/Joma-Womens-Sports-T-Shirt-6XS/dp/B01CSTEWMM/ref=zg_bs_g_fashion_d_sccl_87/525-1604200-4349858?psc=1,2026-02-27,40+,fashion,it
2,88,"Fitgriff® V1 Men's & Women's Gym Bag – Sports Bag with Shoe Holder and Wet Pocket for Travel, Sports, Fitness, Swimming Pool – Duffel Bag",€33.95,10794.0,4.7 out of 5 stars,B07RQHPBHC,https://www.amazon.it/-/en/Fitgriff%C2%AE-Mens-Womens-Gym-Bag/dp/B07RQHPBHC/ref=zg_bs_g_fashion_d_sccl_88/525-1604200-4349858?psc=1,2026-02-27,300+,fashion,it
2,89,FILA Morro Bay Slipper Flip Flops,€14.99,3707.0,4.4 out of 5 stars,B07V6MK1GB,https://www.amazon.it/-/en/Fila-Morro-Slipper-Flops-Black/dp/B07V6MK1GB/ref=zg_bs_g_fashion_d_sccl_89/525-1604200-4349858?psc=1,2026-02-27,50+,fashion,it
2,90,"ROCKBROS Winter Thermal Balaclava with Fleece Balaclava Warm Multifunctional Balaclava for Cycling, Skiing, Windproof, Breathable, Unisex, One Size, Reflective Logo, 4 Colours",€14.99,15257.0,4.6 out of 5 stars,B07ZPTZ2GH,https://www.amazon.it/-/en/ROCKBROS-LF7345/dp/B07ZPTZ2GH/ref=zg_bs_g_fashion_d_sccl_90/525-1604200-4349858?psc=1,2026-02-27,1K+,fashion,it
2,91,"riemot Shoe Insoles Men Women, Sports Insole for Shock Absorption and Cushioning, Memory Foam Soles Arch Support Sole, Inserts Breathable Replacement, 36-46 EU, blue",€6.99,1495.0,4.3 out of 5 stars,B0CNKB4XVW,https://www.amazon.it/-/en/riemot-Insoles-Absorption-Cushioning-Replacement/dp/B0CNKB4XVW/ref=zg_bs_g_fashion_d_sccl_91/525-1604200-4349858?psc=1,2026-02-27,50+,fashion,it
2,92,"DUNLOP Protective Footwear, K500011, Dee Calf, Black, Size EU 37",€14.99,17669.0,4.4 out of 5 stars,B00I46CIPM,https://www.amazon.it/-/en/Dunlop-K580011-Waterproof-Boots-green/dp/B00I46CIPM/ref=zg_bs_g_fashion_d_sccl_92/525-1604200-4349858?psc=1,2026-02-27,300+,fashion,it
2,93,Calvin Klein Iconic Monogram SS Slim Tee Men's T-Shirt,€23.00,4350.0,4.5 out of 5 stars,B09R2F4CZF,https://www.amazon.it/-/en/Calvin-Klein-Monologo-J30j320935-Short-Sleeved/dp/B09R2F4CZF/ref=zg_bs_g_fashion_d_sccl_93/525-1604200-4349858?psc=1,2026-02-27,100+,fashion,it
2,94,Feethit Men's Sneakers Running Running Gymnastics Walking Casual Jogging Trekking Tennis Outdoor Fitness Sports Gym Work Shoes Comfortable Lightweight Breathable,€32.99,16349.0,4.4 out of 5 stars,B09YLB3SKY,https://www.amazon.it/-/en/Feethit-Sneakers-Comfortable-Lightweight-Breathable/dp/B09YLB3SKY/ref=zg_bs_g_fashion_d_sccl_94/525-1604200-4349858?psc=1,2026-02-27,100+,fashion,it
2,95,"adidas Hamburg, Unisex Low Trainers - Adult",€51.49,11038.0,4.4 out of 5 stars,B0B3218F1K,https://www.amazon.it/-/en/adidas-Hamburg-Sneaker-Cloud-White/dp/B0B3218F1K/ref=zg_bs_g_fashion_d_sccl_95/525-1604200-4349858?psc=1,2026-02-27,0,fashion,it
2,96,Navigare 573/E (Pack of 6) Men's Boxer Shorts (Pack of 6),€26.43,12763.0,4.4 out of 5 stars,B00ULBXCZI,https://www.amazon.it/-/en/Navigare-Boxer-Shorts-Multicoloured-Black/dp/B00ULBXCZI/ref=zg_bs_g_fashion_d_sccl_96/525-1604200-4349858?psc=1,2026-02-27,100+,fashion,it
