page,rank,title,price,reviews_count,rating,asin,url,rank_filled,category,market_place,bought_number
2,89,"Aprimagic Pack of 24 Scratch Notebooks, Puzzles and Gift Bags – Birthday Gifts for Children School – Children's Birthday Bags – Children's Birthday Details (24)",€26.99,45.0,4.7 out of 5 stars,B0F3ZQH5XY,https://www.amazon.es/-/en/Aprimagic-Pack-Scratch-Notebooks-Puzzles/dp/B0F3ZQH5XY/ref=zg_bs_g_toys_d_sccl_89/525-2667301-1523310?psc=1,89,toys,es,200+
2,90,"BARRADO Stranger Things - Stranger Things Characters Plush - 28 cm - Eleven, Will, Mike, Dustin, Lucas, Demogorgon - Super Soft Quality (Demogorgon)",€29.79,353.0,4.7 out of 5 stars,B09T76MPVL,https://www.amazon.es/-/en/BARRADO-Stranger-Things-Characters-Demogorgon/dp/B09T76MPVL/ref=zg_bs_g_toys_d_sccl_90/525-2667301-1523310?psc=1,90,toys,es,500+
2,91,PERPLEXUS – Puzzle PERPLEXUS Rebel: 3D Maze Ball with 70 Obstacles – Toys Children 8 Years + – Gift Children 8 Years + – Game of Wit,€21.99,13508.0,4.7 out of 5 stars,B07MKCZJNJ,https://www.amazon.es/-/en/PERPLEXUS-Puzzle-Rebel-Obstacles-Children/dp/B07MKCZJNJ/ref=zg_bs_g_toys_d_sccl_91/525-2667301-1523310?psc=1,91,toys,es,0
2,92,SmartGames IQ-Puzzler Pro,€12.95,8968.0,4.8 out of 5 stars,B01G3PYWCW,https://www.amazon.es/-/en/SmartGames-SG-455-IQ-Puzzler-Pro/dp/B01G3PYWCW/ref=zg_bs_g_toys_d_sccl_92/525-2667301-1523310?psc=1,92,toys,es,400+
2,93,"Coolzon Digital Alarm Clock, Alarm Clock Battery for Children and Adults, Silent Travel Alarm Clock with LED Display Calendar Temperature Snooze Function Night Light, Black",€10.19,3665.0,4.0 out of 5 stars,B0DM1Z7KV2,https://www.amazon.es/-/en/Coolzon-Children-Calendar-Temperature-Function/dp/B0DM1Z7KV2/ref=zg_bs_g_toys_d_sccl_93/525-2667301-1523310?psc=1,93,toys,es,50+
2,94,"Hasbro Nerf 2.0 Commander RC-6, Toy Darts Blaster, 12 Pieces, Outdoor Games for Boys and Girls Ages 8 and Up, Spin Drum",€7.16,31309.0,4.7 out of 5 stars,B07ZYCNZTZ,https://www.amazon.es/-/en/Hasbro-Nerf-Commander-Blaster-Outdoor/dp/B07ZYCNZTZ/ref=zg_bs_g_toys_d_sccl_94/525-2667301-1523310?psc=1,94,toys,es,400+
2,95,"Play-Doh Hasbro, Dinosaur, Shapes and Colors, Christmas Arts and Crafts Toys, Art Materials for Boys and Girls 2 Years and Older, 6 Canisters, Colored Plasticine, Creativity, Gift",€14.99,14769.0,4.7 out of 5 stars,B0DNFQ9ST6,https://www.amazon.es/-/en/Play-Doh-Christmas-Materials-Plasticine-Creativity/dp/B0DNFQ9ST6/ref=zg_bs_g_toys_d_sccl_95/525-2667301-1523310?psc=1,95,toys,es,400+
2,96,"Kinderkraft Aston Evolutionary Tricycle, Pedalless Bike, Baby Bike, for Children, Belt, with Accessories, Cup Holder, Basket, 9 Months to 25 kg, Green",€99.00,1932.0,4.6 out of 5 stars,B0C1TD8KHZ,https://www.amazon.es/-/en/Kinderkraft-Evolutionary-Tricycle-Pedalless-Accessories/dp/B0C1TD8KHZ/ref=zg_bs_g_toys_d_sccl_96/525-2667301-1523310?psc=1,96,toys,es,100+
