page,rank,title,price,reviews_count,rating,asin,url,rank_filled,category,market_place,bought_number
1,1,no title,€69.99,,,B0G4NT3SH1,https://www.amazon.es/-/en/Pok%C3%A9mon-H%C3%A9roes-Ascendentes/dp/B0G4NT3SH1/ref=zg_bs_g_toys_d_sccl_1/525-2667301-1523310?psc=1,1,toys,es,0
1,2,no title,€10.99,,,B0G4NS6SJY,https://www.amazon.es/-/en/Pok%C3%A9mon-Togepi-y-Totodile/dp/B0G4NS6SJY/ref=zg_bs_g_toys_d_sccl_2/525-2667301-1523310?psc=1,2,toys,es,0
1,3,no title,€10.99,,,B0G4NS1BCR,https://www.amazon.es/-/en/Pok%C3%A9mon-Pikachu-y-Tepig/dp/B0G4NS1BCR/ref=zg_bs_g_toys_d_sccl_3/525-2667301-1523310?psc=1,3,toys,es,0
1,4,no title,€10.99,,,B0G4NT35J8,https://www.amazon.es/-/en/Pok%C3%A9mon-Riolu-y-Darumaka/dp/B0G4NT35J8/ref=zg_bs_g_toys_d_sccl_4/525-2667301-1523310?psc=1,4,toys,es,0
1,5,no title,€10.99,,,B0G4NQ9LVW,https://www.amazon.es/-/en/Pok%C3%A9mon-Zorua-y-Cramorant/dp/B0G4NQ9LVW/ref=zg_bs_g_toys_d_sccl_5/525-2667301-1523310?psc=1,5,toys,es,0
1,6,no title,€10.99,,,B0G4NQK15P,https://www.amazon.es/-/en/Pok%C3%A9mon-Clefairy-y-Chikorita/dp/B0G4NQK15P/ref=zg_bs_g_toys_d_sccl_6/525-2667301-1523310?psc=1,6,toys,es,0
1,7,LEGO Speed Champions Ferrari SF-24 F1 Race Car Toy - Father's Day Gift - Formula 1 Red Vehicle Model and Pilot Minifigure to Collect - 77242,€21.99,14058.0,4.8 out of 5 stars,B0DHSBBV6R,https://www.amazon.es/-/en/LEGO-Speed-Champions-Ferrari-SF-24/dp/B0DHSBBV6R/ref=zg_bs_g_toys_d_sccl_7/525-2667301-1523310?psc=1,7,toys,es,1K+
1,8,Pokémon: JCC Pokémon Megaevolution Enhancement Packs-Ghost Fires (6 Upgrade Envelopes),€29.04,30.0,4.0 out of 5 stars,B0FTG3C43P,https://www.amazon.es/-/en/Pok%C3%A9mon-Megaevolution-Enhancement-Packs-Ghost-Envelopes/dp/B0FTG3C43P/ref=zg_bs_g_toys_d_sccl_8/525-2667301-1523310?psc=1,8,toys,es,1K+
1,9,QuickStop - Board Games for Family and Friends - Dynamic and Fun - 2 to 7 Players - Toy Grand Prix 2024 - Original Gift,€18.36,5117.0,4.8 out of 5 stars,B0CJ54TF8K,https://www.amazon.es/-/en/QuickStop-Friends-Dynamic-Players-Original/dp/B0CJ54TF8K/ref=zg_bs_g_toys_d_sccl_9/525-2667301-1523310?psc=1,9,toys,es,4K+
1,10,Ludilo - Taco Cat Goat Cheese Pizza | Board Games | Board Games Kids 8 Years or Older | Card Game with 60 Cards | Gift Child 8 Years or Over 3 to 8 Players,€12.49,3155.0,4.8 out of 5 stars,B085DTTYP7,https://www.amazon.es/-/en/Ludilo-Cheese-Pizza-Board-Players/dp/B085DTTYP7/ref=zg_bs_g_toys_d_sccl_10/525-2667301-1523310?psc=1,10,toys,es,1K+
1,11,"Pokémon: Laurean Megaevolution-Ascending Heroes Collection (1 Holographic Promotion Card, 1 Coin and 2 Upgrade Envelopes)",€11.99,31.0,4.6 out of 5 stars,B0G7JRZNBY,https://www.amazon.es/-/en/Pok%C3%A9mon-Megaevolution-Ascending-Collection-Holographic-Promotion/dp/B0G7JRZNBY/ref=zg_bs_g_toys_d_sccl_11/525-2667301-1523310?psc=1,11,toys,es,0
1,12,Faber-Castell 554201 – Cardboard Case with 12 School Markers,€1.22,4022.0,4.6 out of 5 stars,B08LL5R3BH,https://www.amazon.es/-/en/Faber-Castell-554201-Cardboard-School-Markers/dp/B08LL5R3BH/ref=zg_bs_g_toys_d_sccl_12/525-2667301-1523310?psc=1,12,toys,es,400+
1,13,Desire Deluxe Kit Bloques de Construcción Magnéticos 3D para Niños de 3 - 7 Años - Juguete Educativo con Figuras Geométricas para Desarrollar la Creatividad de Sus Pequeños - 57 Piezas,€26.99,15247.0,4.8 out of 5 stars,B07MGYKZ36,https://www.amazon.es/-/en/Desire-Deluxe-Bloques-Construcci%C3%B3n-Magn%C3%A9ticos/dp/B07MGYKZ36/ref=zg_bs_g_toys_d_sccl_13/525-2667301-1523310?psc=1,13,toys,es,600+
1,14,Beyblade X Drop Attack Battle Set,€30.01,4897.0,4.6 out of 5 stars,B0DNFPM6KB,https://www.amazon.es/-/en/Beyblade-Drop-Attack-Battle-Set/dp/B0DNFPM6KB/ref=zg_bs_g_toys_d_sccl_14/525-2667301-1523310?psc=1,14,toys,es,500+
1,15,"Pokémon: JCC Pokémon Megaevolution Elite Trainer Box-Ghost Fires (1 Promo Card with Expanded Illustration, 9 Upgrade Envelopes and Premium Accessories)",€52.99,139.0,4.5 out of 5 stars,B0FTG4DGK7,https://www.amazon.es/-/en/Pok%C3%A9mon-Megaevolution-Box-Ghost-Illustration-Accessories/dp/B0FTG4DGK7/ref=zg_bs_g_toys_d_sccl_15/525-2667301-1523310?psc=1,15,toys,es,1K+
1,16,Tranjis games - Virus - Card Game (TRG-01vir) (1138753.62),€12.99,17470.0,4.8 out of 5 stars,8460659666,https://www.amazon.es/-/en/Tranjis-games-Virus-TRG-01vir-1138753-62/dp/8460659666/ref=zg_bs_g_toys_d_sccl_16/525-2667301-1523310?psc=1,16,toys,es,1K+
1,17,Play-Doh Imagine Anything 18 Pack,€13.99,41066.0,4.8 out of 5 stars,B0DNFPHXDN,https://www.amazon.es/-/en/Play-Doh-Imagine-Anything-18-Pack/dp/B0DNFPHXDN/ref=zg_bs_g_toys_d_sccl_17/525-2667301-1523310?psc=1,17,toys,es,500+
1,18,Beyblade X Starter Kit ARC Wizard R 4-55LO CX with Top and Launcher,€13.99,4188.0,4.7 out of 5 stars,B0DNFP9PRX,https://www.amazon.es/-/en/Beyblade-Starter-Wizard-4-55LO-Launcher/dp/B0DNFP9PRX/ref=zg_bs_g_toys_d_sccl_18/525-2667301-1523310?psc=1,18,toys,es,300+
1,19,ZURU My Mini Baby Series 2 Mystery Capsule Collectible Toy for Girls Realistic Miniature Baby Play Kit and Accessories,€9.99,749.0,4.6 out of 5 stars,B0DS4TS7MB,https://www.amazon.es/-/en/ZURU-Collectible-Realistic-Miniature-Accessories/dp/B0DS4TS7MB/ref=zg_bs_g_toys_d_sccl_19/525-2667301-1523310?psc=1,19,toys,es,1K+
1,20,"Bright Starts, Classic Easy Grip Oball - BPA Free - Red, Yellow, Green, Blue, Age Newborn & More",€5.99,153140.0,4.8 out of 5 stars,B00ZRD99C0,https://www.amazon.es/-/en/Bright-Starts-Classic-Easy-Oball/dp/B00ZRD99C0/ref=zg_bs_g_toys_d_sccl_20/525-2667301-1523310?psc=1,20,toys,es,600+
1,21,Paw Patrol Paw Patrol – Motorcycle Toy Quad Rescue and Ryder Figure – Toys Children 3 Years + – Gift Children 3 Years – Paw Patrol Toys,€14.99,2472.0,4.8 out of 5 stars,B0DCBXNSRS,https://www.amazon.es/-/en/Paw-Patrol-Motorcycle-Rescue-Children/dp/B0DCBXNSRS/ref=zg_bs_g_toys_d_sccl_21/525-2667301-1523310?psc=1,21,toys,es,300+
1,22,"Pokémon: Pokémon Day Collection 2026 (1 Holographic Promo Card, 1 Coin and 3 Upgrade Envelopes)",€24.99,42.0,3.6 out of 5 stars,B0G3XHTC4T,https://www.amazon.es/-/en/Pok%C3%A9mon-Collection-Holographic-Upgrade-Envelopes/dp/B0G3XHTC4T/ref=zg_bs_g_toys_d_sccl_22/525-2667301-1523310?psc=1,22,toys,es,0
1,23,"Disney Store Official, Pixar Toy Story, Buzz Lightyear, Talking Interactive Action Figure, 36 cm, Space Guardian Toy and 15 English Phrases, Interact with More Characters, Ages 3+",€32.00,40272.0,4.6 out of 5 stars,B0DLH5XMRH,https://www.amazon.es/-/en/Disney-Store-Lightyear-Interactive-Characters/dp/B0DLH5XMRH/ref=zg_bs_g_toys_d_sccl_23/525-2667301-1523310?psc=1,23,toys,es,0
1,24,Pokémon: Megaevolution-Ascending Heroes Special Sticker Collection - Gastly (1 Holographic Promotion Card and 3 Upgrade Envelopes),€18.99,27.0,4.7 out of 5 stars,B0G4NSB2J1,https://www.amazon.es/-/en/Pok%C3%A9mon-Megaevolution-Ascending-Collection-Holographic-Promotion/dp/B0G4NSB2J1/ref=zg_bs_g_toys_d_sccl_24/525-2667301-1523310?psc=1,24,toys,es,0
1,25,"Jovi Air Dry White Modeling Paste, Pack of White Clay, 3 x 500 g, 1.5 kg, Air Drying Modeling Dough, Crafts for Kids (P85/3)",€5.50,4759.0,4.7 out of 5 stars,B0BD4HMRZL,https://www.amazon.es/-/en/Jovi-Modeling-Drying-Crafts-P85/dp/B0BD4HMRZL/ref=zg_bs_g_toys_d_sccl_25/525-2667301-1523310?psc=1,25,toys,es,900+
1,26,"Hitster Original, Board Game Adults and Fun, Musical Board Game, from 16 years old, from 2 to 10 players, Free app, party game, Spanish (EN)",€24.99,6096.0,4.7 out of 5 stars,B0B3RVC43L,https://www.amazon.es/-/en/Hitster-Original-Musical-players-Spanish/dp/B0B3RVC43L/ref=zg_bs_g_toys_d_sccl_26/525-2667301-1523310?psc=1,26,toys,es,1K+
1,27,"Umatoll Pedalless Bike for Children from 1 Year of Balance, Toys Babies 12 to 24 Months, Baby Bike with Basket, Pimera Bicycle for Boys and Girls as Birthday Gift (Green)",€29.39,4004.0,4.8 out of 5 stars,B0BXGNLGB5,https://www.amazon.es/-/en/Umatoll-Pedalless-Children-Balance-Birthday/dp/B0BXGNLGB5/ref=zg_bs_g_toys_d_sccl_27/525-2667301-1523310?psc=1,27,toys,es,500+
1,28,"LEGO Classic Caja de Ladrillos Creativos Mediana, Juegos de Construcción para Niños y Niñas de 4 Años o Más, Base Verde, Coches y Animales de Juguete, Fácil Almacenaje, Idea de Regalo Infantil 10696",€23.69,34685.0,4.8 out of 5 stars,B00NVDP3ZU,https://www.amazon.es/-/en/LEGO-Ladrillos-Construcci%C3%B3n-Almacenaje-10696/dp/B00NVDP3ZU/ref=zg_bs_g_toys_d_sccl_28/525-2667301-1523310?psc=1,28,toys,es,800+
1,29,Painting Water Mat 110 x 70 cm – Toys Children 2 to 6 Years – Water Magic Slate with Drawing Book & 4 Pens – Educational Games for Boys Girls Christmas Gifts (Dinosaur Theme),€21.99,2448.0,4.5 out of 5 stars,B0B9631SZK,https://www.amazon.es/-/en/Painting-Water-Mat-110-Educational/dp/B0B9631SZK/ref=zg_bs_g_toys_d_sccl_29/525-2667301-1523310?psc=1,29,toys,es,200+
1,30,Jovi 50 Mini Clay Tray 10 Units Assorted Colours,€5.49,7217.0,4.5 out of 5 stars,B000NMAJVK,https://www.amazon.es/-/en/Jovi-Mini-Units-Assorted-Colours/dp/B000NMAJVK/ref=zg_bs_g_toys_d_sccl_30/525-2667301-1523310?psc=1,30,toys,es,700+
1,31,Tin Box Gold Series Adrenalyn 2025/2026,€11.95,6.0,4.8 out of 5 stars,B06Y63CWVX,https://www.amazon.es/-/en/Tin-Gold-Adrenalyn-2025-2026/dp/B06Y63CWVX/ref=zg_bs_g_toys_d_sccl_31/525-2667301-1523310?psc=1,31,toys,es,800+
1,32,"ATM Gaming Quickstop Family - The Most Fun Board Game for the Whole Family | Fast, Competitive Nights at Home - Original Gift",€17.99,728.0,4.8 out of 5 stars,B0F33P8VJ6,https://www.amazon.es/-/en/ATM-Gaming-Quickstop-Family-Competitive/dp/B0F33P8VJ6/ref=zg_bs_g_toys_d_sccl_32/525-2667301-1523310?psc=1,32,toys,es,1K+
1,33,"Snazaroo Face and Body Paint, 18 ml - White (Individual Colour)",€7.50,37296.0,4.4 out of 5 stars,B000H6W2GW,https://www.amazon.es/-/en/Snazaroo-Face-Body-Paint-Individual/dp/B000H6W2GW/ref=zg_bs_g_toys_d_sccl_33/525-2667301-1523310?psc=1,33,toys,es,700+
1,34,LEGO Botanicals Lucky Bamboo - Artificial Plant for Indoor Display - Set for Adults Incl. a Buildable Pot with a Wood-Effect Plinth for Home Decor - DIY Gift Idea - 10344,€19.99,14116.0,4.8 out of 5 stars,B01N9D9U4O,https://www.amazon.es/-/en/LEGO-Botanicals-Lucky-Bamboo-Wood-Effect/dp/B01N9D9U4O/ref=zg_bs_g_toys_d_sccl_34/525-2667301-1523310?psc=1,34,toys,es,500+
1,35,Pokémon: Megaevolution-Ascending Heroes Special Sticker Collection: Charmander (1 Holographic Promotion Card and 3 Upgrade Envelopes),€18.99,43.0,4.8 out of 5 stars,B0G4NS7XT2,https://www.amazon.es/Pok%C3%A9mon-Megaevolution-Ascending-Collection-Charmander-Holographic/dp/B0G4NS7XT2/ref=zg_bs_g_toys_d_sccl_35/525-2667301-1523310?psc=1,35,toys,es,0
1,36,Fenix Turbo Spinning Top with Rotating Tip - Includes Rope with Ring and Star,€14.19,257.0,4.1 out of 5 stars,B0CLM6Q9W8,https://www.amazon.es/-/en/Fenix-Turbo-Spinning-Top-Rotating/dp/B0CLM6Q9W8/ref=zg_bs_g_toys_d_sccl_36/525-2667301-1523310?psc=1,36,toys,es,600+
1,37,PLAY-DOH SWIRLIN SMOOTHIES BLENDER PLAYSET,€9.99,26564.0,4.6 out of 5 stars,B0C3528VHM,https://www.amazon.es/-/en/PLAY-DOH-SWIRLIN-SMOOTHIES-BLENDER-PLAYSET/dp/B0C3528VHM/ref=zg_bs_g_toys_d_sccl_37/525-2667301-1523310?psc=1,37,toys,es,500+
1,38,Funko Stranger Things Vinyl Figure Season 5 - Mike Wheeler 1783 Unrated Pop! Standard PVC,€16.00,275.0,4.6 out of 5 stars,B0DYJX8N7G,https://www.amazon.es/-/en/Funko-Stranger-Things-Figure-Season/dp/B0DYJX8N7G/ref=zg_bs_g_toys_d_sccl_38/525-2667301-1523310?psc=1,38,toys,es,100+
1,39,"Rodzon Musical Piano Baby Mat with 10 Animals, Children's Toys 1 2 3 Years, Baby Gift, Children's Play Mat 9 Melodies 19 Songs, Christmas Birthday Gifts for Boys Girls 1 2 3 Years",€22.99,6803.0,4.5 out of 5 stars,B0C7VP45P4,https://www.amazon.es/-/en/Rodzon-Childrens-Melodies-Christmas-Birthday/dp/B0C7VP45P4/ref=zg_bs_g_toys_d_sccl_39/525-2667301-1523310?psc=1,39,toys,es,400+
1,40,Rumi K-pop Costume Kids Demon Zoey Mira K-pop Cosplay Demon Hunter Carnival Halloween Costume Asian Idol Inspired Set,€28.99,89.0,4.3 out of 5 stars,B0G59ZHW4Q,https://www.amazon.es/-/en/Ballerina-Costume-Carnival-Halloween-Inspired/dp/B0G59ZHW4Q/ref=zg_bs_g_toys_d_sccl_40/525-2667301-1523310?psc=1,40,toys,es,100+
1,41,"Pokémon: Scarlet and Purple-Obsidian Flames Combat Stadium (2 40-Card Decks, 11 Upgrade Packs, and More)",€57.49,13.0,4.1 out of 5 stars,B0CK2LRH1Y,https://www.amazon.es/-/en/Pok%C3%A9mon-Scarlet-Purple-Obsidian-Stadium-40-Card/dp/B0CK2LRH1Y/ref=zg_bs_g_toys_d_sccl_41/525-2667301-1523310?psc=1,41,toys,es,100+
1,42,"Dislocati Karaoke Kids 2 Wireless Microphones Karaoke, Unicorns Gift for Girls 3-12 Years Old Wireless Bluetooth Microphone for Singing Toys Girl 3-12 Years Microphone Gift Christmas Girl",€19.54,2257.0,4.7 out of 5 stars,B0CZCVXVZC,https://www.amazon.es/-/en/Dislocati-Microphones-Bluetooth-Microphone-Christmas/dp/B0CZCVXVZC/ref=zg_bs_g_toys_d_sccl_42/525-2667301-1523310?psc=1,42,toys,es,400+
1,43,"Science4you Robotics Betabot 126 Piece Robotic Kit, Build Your Interactive Robot, Construction Games, Riding Toys, Gifts for Boys and Girls Ages 8 9 10+",€14.99,5126.0,4.4 out of 5 stars,B07B42X1Z3,https://www.amazon.es/-/en/Science4you-Robotics-Betabot-Interactive-Construction/dp/B07B42X1Z3/ref=zg_bs_g_toys_d_sccl_43/525-2667301-1523310?psc=1,43,toys,es,300+
1,44,Diset,€19.95,4669.0,4.7 out of 5 stars,B0068A96N8,https://www.amazon.es/-/en/Diset-63752/dp/B0068A96N8/ref=zg_bs_g_toys_d_sccl_44/525-2667301-1523310?psc=1,44,toys,es,500+
1,45,chimoo Foldable Ankle Jumping Ball Flashing Jump Ring Colorful Ankle Jumping Ring Sports Jumping Ball for Boys Girls Age 6 7 8 9 Years Old,€12.99,838.0,4.4 out of 5 stars,B0CQLV8DQS,https://www.amazon.es/-/en/chimoo-Foldable-Jumping-Flashing-Colorful/dp/B0CQLV8DQS/ref=zg_bs_g_toys_d_sccl_45/525-2667301-1523310?psc=1,45,toys,es,400+
1,46,"Goula The 3 Little Pigs: Preschool Educational Board Game for Children from 2 Years, Children's Game 1 to 4 Players with Wooden Pieces and Puzzle Board - Toys Children 2 Years Old",€15.99,2432.0,4.7 out of 5 stars,B07B37TT7F,https://www.amazon.es/-/en/Goula-Little-Pigs-Preschool-Educational/dp/B07B37TT7F/ref=zg_bs_g_toys_d_sccl_46/525-2667301-1523310?psc=1,46,toys,es,300+
2,51,"BONNYCO Set of plasticine with moulds and bags surprise pack of 16 birthday gifts for children school 3-9 years. Details students end of course, gift ideas for guests, filling pinata",€16.99,109.0,4.6 out of 5 stars,B0FFMM1GJB,https://www.amazon.es/-/en/BONNYCO-plasticine-surprise-birthday-children/dp/B0FFMM1GJB/ref=zg_bs_g_toys_d_sccl_1/525-2667301-1523310?psc=1,51,toys,es,500+
2,52,LEGO Speed Champions Lightning Mcqueen Toy Car - Collectible Model Kit - Gift for Boys and Girls Fans of Disney Pixar Cars Movies 77255,€27.99,471.0,4.8 out of 5 stars,B0FPXCYXHM,https://www.amazon.es/-/en/LEGO-Speed-Champions-Lightning-Mcqueen/dp/B0FPXCYXHM/ref=zg_bs_g_toys_d_sccl_2/525-2667301-1523310?psc=1,52,toys,es,600+
2,53,DC Comics Batman – Articulated Batman Rebirth Figure 30 cm – Superheroes Toys – Toys Children 3 Years + – Gift Child 3 Years +,€6.99,753.0,4.8 out of 5 stars,B0CQTG857D,https://www.amazon.es/-/en/DC-Comics-Batman-Articulated-Superheroes/dp/B0CQTG857D/ref=zg_bs_g_toys_d_sccl_3/525-2667301-1523310?psc=1,53,toys,es,600+
2,54,Uno H20 Waterproof Clear Cards,€7.00,10531.0,4.8 out of 5 stars,B001HN6EF4,https://www.amazon.es/-/en/Uno-H20-Waterproof-Clear-Cards/dp/B001HN6EF4/ref=zg_bs_g_toys_d_sccl_4/525-2667301-1523310?psc=1,54,toys,es,300+
2,55,"Pokémon: Scarlet & Purple-Evolutions Combat Stadium in Paldea (2 Decks, 11 Upgrade Packs and more)",€57.49,13.0,4.4 out of 5 stars,B0C64LR9BS,https://www.amazon.es/-/en/Pok%C3%A9mon-Scarlet-Purple-Evolutions-Stadium-Upgrade/dp/B0C64LR9BS/ref=zg_bs_g_toys_d_sccl_5/525-2667301-1523310?psc=1,55,toys,es,0
2,56,"Inspireyes Rechargeable Kids Walkie Talkie, 48 Hours Working Time, 3km Long Range, Birthday Gifts, Outdoor Toys for Kids Ages 3-12, Pack of 3",€27.97,8940.0,4.6 out of 5 stars,B09QW9Z6FX,https://www.amazon.es/-/en/Inspireyes-Rechargeable-Working-Birthday-Outdoor/dp/B09QW9Z6FX/ref=zg_bs_g_toys_d_sccl_6/525-2667301-1523310?psc=1,56,toys,es,100+
2,57,trompos space Neptune Roller Red Universal Box,€24.80,71.0,4.1 out of 5 stars,B0BNND8D1W,https://www.amazon.es/-/en/trompos-space-Neptune-Roller-Universal/dp/B0BNND8D1W/ref=zg_bs_g_toys_d_sccl_7/525-2667301-1523310?psc=1,57,toys,es,400+
2,58,"YPLUS Painting with Water Books for Toddlers,Watercolor Paper for Ages 1-4,Craft Art Gift with Brush and Animal Illustrations Included",€11.99,5103.0,4.6 out of 5 stars,B0BQTHTZG1,https://www.amazon.es/-/en/YPLUS-Painting-Toddlers-Watercolor-Illustrations/dp/B0BQTHTZG1/ref=zg_bs_g_toys_d_sccl_8/525-2667301-1523310?psc=1,58,toys,es,400+
2,59,"Hitster 100% in Spanish, Music Board Game for Adults, Songs in Spanish, +16 years, Free App, 2-10 Players",€21.99,473.0,4.6 out of 5 stars,B0DW4HY6HN,https://www.amazon.es/-/en/Hitster-Spanish-Music-Adults-Players/dp/B0DW4HY6HN/ref=zg_bs_g_toys_d_sccl_9/525-2667301-1523310?psc=1,59,toys,es,800+
2,60,"LEGO Creator 3 in 1 Platform Truck with Helicopter Convertible into Toy Vehicles: Propeller Plane, Bolide and SUV Car, Gift for Boys and Girls Ages 7 and Up 31146",€15.99,4499.0,4.7 out of 5 stars,B0CFVYPKGB,https://www.amazon.es/-/en/LEGO-Platform-Helicopter-Convertible-Vehicles/dp/B0CFVYPKGB/ref=zg_bs_g_toys_d_sccl_10/525-2667301-1523310?psc=1,60,toys,es,300+
2,61,no title,€12.99,,,B0G5ZFYC8H,https://www.amazon.es/-/en/SUPERTHINGS-KAZOOM-Power-Spinner-Spinning/dp/B0G5ZFYC8H/ref=zg_bs_g_toys_d_sccl_11/525-2667301-1523310?psc=1,61,toys,es,0
2,62,"Play-Doh, Pack of 8 85g Rainbow Colors Jars",€5.95,562.0,4.8 out of 5 stars,B0DNFPRP3V,https://www.amazon.es/-/en/Play-Doh-Pack-Rainbow-Colors-Jars/dp/B0DNFPRP3V/ref=zg_bs_g_toys_d_sccl_12/525-2667301-1523310?psc=1,62,toys,es,300+
2,63,Potato Head Toy Mr. Potato Head,€9.21,12837.0,4.7 out of 5 stars,B0CP42LHNQ,https://www.amazon.es/-/en/Potato-Head-Toy-Mr/dp/B0CP42LHNQ/ref=zg_bs_g_toys_d_sccl_13/525-2667301-1523310?psc=1,63,toys,es,200+
2,64,BEY BLADE GEN 4 DLX LAUNCHER AND TOP,€24.99,1942.0,4.7 out of 5 stars,B0D87NFXGQ,https://www.amazon.es/-/en/BEY-BLADE-GEN-DLX-LAUNCHER/dp/B0D87NFXGQ/ref=zg_bs_g_toys_d_sccl_14/525-2667301-1523310?psc=1,64,toys,es,0
2,65,Lint Set,€13.95,798.0,4.8 out of 5 stars,B0B12MD4YR,https://www.amazon.es/-/en/MAR-L%C3%9ADICO-M0013-Lint-Set/dp/B0B12MD4YR/ref=zg_bs_g_toys_d_sccl_15/525-2667301-1523310?psc=1,65,toys,es,600+
2,66,"Clementoni - 18779 - Idea - Pen Workshop - A Perfect Set to Make Your Own Pens, Creative Game, Craft Set, Toy 6 Years",€23.69,2057.0,4.7 out of 5 stars,B0C3XL1HZ5,https://www.amazon.es/-/en/Clementoni-18779-Workshop-Perfect-Creative/dp/B0C3XL1HZ5/ref=zg_bs_g_toys_d_sccl_16/525-2667301-1523310?psc=1,66,toys,es,300+
2,67,"Pourbibi Magnetic Building Blocks for Children, Magnetic Children 108 Pieces, Toys for Children 3 Years, Magnetic Constructions, Creative Montessori Toy for 3 4 5 6 7 8 9 10 Years Old",€23.99,1115.0,4.5 out of 5 stars,B0FGQ9J5BK,https://www.amazon.es/-/en/Pourbibi-Magnetic-Building-Constructions-Montessori/dp/B0FGQ9J5BK/ref=zg_bs_g_toys_d_sccl_17/525-2667301-1523310?psc=1,67,toys,es,0
2,68,"UIONVO Instant Children's Photo Camera, 1080P Children's Photo Camera with 32GB Card and Printing Paper Instant Camera Birthday for Boys and Girls from 3 to 12 Years, Pink",€24.99,248.0,4.3 out of 5 stars,B0FK9XXZ5S,https://www.amazon.es/-/en/UIONVO-Instant-Childrens-Printing-Birthday/dp/B0FK9XXZ5S/ref=zg_bs_g_toys_d_sccl_18/525-2667301-1523310?psc=1,68,toys,es,400+
2,69,"Lisciani Giochi Disney Princesses Drawing School with Projector for Children from 3 Years Old - Learn to Draw with Projected Models - Includes Models, Paper and Pencils - Creative Set",€29.95,1328.0,4.3 out of 5 stars,B0B5GKV1V6,https://www.amazon.es/-/en/Lisciani-Princesses-Drawing-Projector-Children/dp/B0B5GKV1V6/ref=zg_bs_g_toys_d_sccl_19/525-2667301-1523310?psc=1,69,toys,es,0
2,70,"BIC Kids Plastidecor Coloring Waxes, Stain Resistant for Creative Activities at Home and School, Blister Pack of 12 (Pack of 1), Assorted Colors, Classic",€3.28,6098.0,4.7 out of 5 stars,B00B6GRVS6,https://www.amazon.es/-/en/BIC-Plastidecor-Coloring-Resistant-Activities/dp/B00B6GRVS6/ref=zg_bs_g_toys_d_sccl_20/525-2667301-1523310?psc=1,70,toys,es,300+
2,71,"5 Surprise My Mini Baby Toy, Colour, Single Capsule (ZURU 77487)",€9.99,1638.0,4.4 out of 5 stars,B0CG26X1D4,https://www.amazon.es/-/en/Surprise-Colour-Capsule-ZURU-77487/dp/B0CG26X1D4/ref=zg_bs_g_toys_d_sccl_21/525-2667301-1523310?psc=1,71,toys,es,300+
2,72,"Kazzley Pen Creation Kit with 55+ PCS, Create 15 Personalized Pens, Crafts Kids 5 6 7 8 9 10 Years Old, Creative Kids Game, Gift Toys for Boys and Girls",€19.99,751.0,4.6 out of 5 stars,B0DPYVJ1HB,https://www.amazon.es/-/en/Kazzley-Creation-Create-Personalized-Creative/dp/B0DPYVJ1HB/ref=zg_bs_g_toys_d_sccl_22/525-2667301-1523310?psc=1,72,toys,es,600+
2,73,"JoyCat Watercolor Coloring Book for Toddlers Ages 3-8 and Up, Watercolor Set for Arts and Crafts, Educational Toy as Birthday Gift for Boys and Girls",€11.99,3089.0,4.7 out of 5 stars,B0CTHQJF57,https://www.amazon.es/-/en/JoyCat-Watercolor-Coloring-Toddlers-Educational/dp/B0CTHQJF57/ref=zg_bs_g_toys_d_sccl_23/525-2667301-1523310?psc=1,73,toys,es,400+
2,74,BEY BLADE BBX LANCE KNIGHT DEFENSE,€12.99,3090.0,4.7 out of 5 stars,B0D87R1Z2C,https://www.amazon.es/-/en/BEY-BLADE-LANCE-KNIGHT-DEFENSE/dp/B0D87R1Z2C/ref=zg_bs_g_toys_d_sccl_24/525-2667301-1523310?psc=1,74,toys,es,100+
2,75,"Das 387000 – Gluten-free Modelling Paste, Air Dried, 500 g Tablet, White",€2.53,27938.0,4.6 out of 5 stars,B000J445XA,https://www.amazon.es/-/en/Das-387000-Gluten-free-Modelling-Tablet/dp/B000J445XA/ref=zg_bs_g_toys_d_sccl_25/525-2667301-1523310?psc=1,75,toys,es,0
2,76,"LEGO Creator 3 in 1 Space Shuttle, Astronaut Figure or Toy Ship, Building Set for Boys and Girls Ages 6 and Up, Creative Gift for Children 31134",€7.99,7327.0,4.8 out of 5 stars,B0BBRYHTPS,https://www.amazon.es/-/en/LEGO-Astronaut-Building-Creative-31134/dp/B0BBRYHTPS/ref=zg_bs_g_toys_d_sccl_26/525-2667301-1523310?psc=1,76,toys,es,400+
2,77,"Almaxi Spanish Busy Board Toys Kids 2 3 4 Years, 5 Layers Montessori Toys, Sensory Board Montessori Fine Motor Toys, Educational Games Children 2 3 4 Years,Gifts Children Birthday",€15.92,416.0,4.6 out of 5 stars,B0CZHWVMJ3,https://www.amazon.es/-/en/Almaxi-Montessori-Educational-Children-Birthday/dp/B0CZHWVMJ3/ref=zg_bs_g_toys_d_sccl_27/525-2667301-1523310?psc=1,77,toys,es,100+
2,78,Sawyer Bikes - Adjustable Scooter LED Wheels - Children 2 to 8 Years,€49.99,5206.0,4.8 out of 5 stars,B096JZMNG1,https://www.amazon.es/-/en/Sawyer-Bikes-Adjustable-Scooter-Children/dp/B096JZMNG1/ref=zg_bs_g_toys_d_sccl_28/525-2667301-1523310?psc=1,78,toys,es,50+
2,79,PERPLEXUS - PERPLEXUS BEAST PUZZLE: 3D Maze Ball with 100 Obstacles - 6053142 - Toys Children 8 years +,€26.48,17830.0,4.6 out of 5 stars,B07MNLXJ11,https://www.amazon.es/-/en/PERPLEXUS-PUZZLE-Obstacles-6053142-Children/dp/B07MNLXJ11/ref=zg_bs_g_toys_d_sccl_29/525-2667301-1523310?psc=1,79,toys,es,300+
2,80,Magilano SKYJO Ultimate Card Game for Kids and Adults.,€15.95,73092.0,4.8 out of 5 stars,B06XZ9K244,https://www.amazon.es/-/en/Magilano-SKYJO-Ultimate-Card-Adults/dp/B06XZ9K244/ref=zg_bs_g_toys_d_sccl_30/525-2667301-1523310?psc=1,80,toys,es,500+
2,81,"Bitzee - Virtual Pet with 30 Disney Characters - Digital Pet That Reacts to Touch, with Interactions and Sounds - Gift Child 5 Years + - Toys Children 5 Years +",€35.54,5678.0,4.6 out of 5 stars,B0CQN38M8W,https://www.amazon.es/-/en/Bitzee-Virtual-Characters-Interactions-Children/dp/B0CQN38M8W/ref=zg_bs_g_toys_d_sccl_81/525-2667301-1523310?psc=1,81,toys,es,300+
2,82,ZURU Mini Brands Fill The Fridge UV Light Game Kit Collectibles DIY Resin Set Exclusive Recipe NOT Edible 8+,€29.99,967.0,4.6 out of 5 stars,B0DR3VG3YH,https://www.amazon.es/-/en/Mini-Brands-Fridge-Collectibles-Exclusive/dp/B0DR3VG3YH/ref=zg_bs_g_toys_d_sccl_82/525-2667301-1523310?psc=1,82,toys,es,300+
2,83,Lisciani - Baby Memo - Animals - Educational Society Game - Memory and Reflection Game - 24 Cards - For Children 1 to 4 Years of Age - CAROTINA BABY,€6.99,11568.0,4.7 out of 5 stars,B0843R4NGJ,https://www.amazon.es/-/en/Lisciani-Educational-Reflection-Children-CAROTINA/dp/B0843R4NGJ/ref=zg_bs_g_toys_d_sccl_83/525-2667301-1523310?psc=1,83,toys,es,0
2,84,Avalon Hill HeroQuest Wizards of Morcar Mission Pack (Requires HeroQuest Game System),€49.99,140.0,4.5 out of 5 stars,B0FTMC64MR,https://www.amazon.es/-/en/Avalon-Hill-HeroQuest-Wizards-Requires/dp/B0FTMC64MR/ref=zg_bs_g_toys_d_sccl_84/525-2667301-1523310?psc=1,84,toys,es,0
2,85,"Beyblade X, Collaboration with Transformers Multipack Optimus Primal 3-60F vs. Starscream 3-80N with 2 Tops and 2 Launchers, Battle Tops for Boys and Girls Ages 8+",€19.50,1436.0,4.6 out of 5 stars,B0D457ZHKK,https://www.amazon.es/-/en/Beyblade-Collaboration-Transformers-Multipack-Starscream/dp/B0D457ZHKK/ref=zg_bs_g_toys_d_sccl_85/525-2667301-1523310?psc=1,85,toys,es,100+
2,86,"HiMont Instant Kids Photo Camera, HD/1080P Instant Camera for Children with 32G Card and Printing Paper, Children's Photo Camera Funny Toy Gifts for Children Ages 3-12",€37.99,3649.0,4.4 out of 5 stars,B0DDGY6HJJ,https://www.amazon.es/-/en/HiMont-Instant-Children-Printing-Childrens/dp/B0DDGY6HJJ/ref=zg_bs_g_toys_d_sccl_86/525-2667301-1523310?psc=1,86,toys,es,50+
2,87,"Gamegenic Premium Toploading Exoshields, 25 TOPLOADING Exoshields with UV Protection Per Pack, Card Accessory",€3.99,15.0,4.1 out of 5 stars,B0F7M21KNZ,https://www.amazon.es/-/en/Gamegenic-Toploading-Exoshields-TOPLOADING-Protection/dp/B0F7M21KNZ/ref=zg_bs_g_toys_d_sccl_87/525-2667301-1523310?psc=1,87,toys,es,400+
2,88,"Hidden Games Crime Scene: Crime in the Regio Family, Imperfect Crimes, Exit Cooperative Mystery and Detective Board Game, 1-6 Players, Starting at 16, in Spanish.",€24.90,1289.0,4.6 out of 5 stars,B0DK248ZCZ,https://www.amazon.es/-/en/Hidden-Games-Crime-Scene-Cooperative/dp/B0DK248ZCZ/ref=zg_bs_g_toys_d_sccl_88/525-2667301-1523310?psc=1,88,toys,es,400+
